Bill Date & Time,DateTIme,Name,Phone Number,Waxing,Facial,De-tan,Pedicure,Manicure,Bleaching,Wash,Massage,Threading,Hair Cut,Miscellaneous,Bill Amount,Service done by,Payment Mode,Helper for S,Bill Date,week,Name of the day
18/09/2024 18:45:00,18/09/2024 18:45,Aishwarya,9330251907,Waxing,Facial,De-tan,Pedicure,,Bleaching,Wash,Massage,,,Miscellaneous,1069,Pinky,Cash,,2024-09-18,38,Wednesday
10/10/2024 13:10:00,10/10/2024 13:10,Shruthi,9613158960,Waxing,,,,Manicure,Bleaching,,Massage,Threading,,Miscellaneous,1372,Suganya Sri,PhonePe,Pinky,2024-10-10,41,Thursday
19/09/2024 10:06:00,19/09/2024 10:06,Ranjani,9112480854,Waxing,,,,,,,,Threading,Hair Cut,Miscellaneous,1038,Pinky,GPay,Pinky,2024-09-19,38,Thursday
16/09/2024 17:23:00,16/09/2024 17:23,Swathi,9702577861,Waxing,Facial,De-tan,,Manicure,,,,,Hair Cut,,981,Malar,Card,Poornima,2024-09-16,38,Monday
10/09/2024 19:10:00,10/09/2024 19:10,Meena,9686292307,,,,Pedicure,,,Wash,,Threading,Hair Cut,,1723,Suganya Sri,Card,Anjali,2024-09-10,37,Tuesday
31/10/2024 16:11:00,31/10/2024 16:11,Soumya,9367588288,,,,,,Bleaching,Wash,Massage,,Hair Cut,Miscellaneous,3013,Poornima,Card,Anjali,2024-10-31,44,Thursday
14/09/2024 11:04:00,14/09/2024 11:04,Divya,9490146560,Waxing,,De-tan,Pedicure,Manicure,Bleaching,,Massage,,,,1605,Poornima,PhonePe,Poornima,2024-09-14,37,Saturday
15/11/2024 11:31:00,15/11/2024 11:31,Nisha,9944179791,,Facial,,,,,Wash,,,,Miscellaneous,1719,Poornima,Cash,Pinky,2024-11-15,46,Friday
11/09/2024 17:14:00,11/09/2024 17:14,Keerthana,9621810600,,Facial,,,Manicure,,,Massage,,,,1555,Pinky,PhonePe,Suganya Sri,2024-09-11,37,Wednesday
27/10/2024 15:52:00,27/10/2024 15:52,Kavya,9779806960,,,,,,,,Massage,Threading,Hair Cut,Miscellaneous,1432,Pinky,PhonePe,Anjali,2024-10-27,43,Sunday
06/09/2024 16:56:00,06/09/2024 16:56,Keerthana,9623113288,Waxing,Facial,De-tan,Pedicure,,,Wash,Massage,Threading,,Miscellaneous,1313,Suganya Sri,Cash,,2024-09-06,36,Friday
20/10/2024 12:45:00,20/10/2024 12:45,Aishwarya,9764042295,Waxing,,,,Manicure,,Wash,Massage,Threading,Hair Cut,Miscellaneous,1943,Suganya Sri,PhonePe,Suganya Sri,2024-10-20,42,Sunday
24/10/2024 20:09:00,24/10/2024 20:09,Ranjani,9348082159,,Facial,De-tan,,,Bleaching,Wash,,,,Miscellaneous,929,Anjali,GPay,,2024-10-24,43,Thursday
25/10/2024 13:00:00,25/10/2024 13:00,Soumya,9914334476,Waxing,Facial,De-tan,,Manicure,Bleaching,,Massage,,,,807,Malar,Cash,,2024-10-25,43,Friday
12/10/2024 12:28:00,12/10/2024 12:28,Swathi,9559273133,Waxing,Facial,De-tan,,Manicure,Bleaching,Wash,Massage,,,Miscellaneous,1111,Anjali,GPay,Pinky,2024-10-12,41,Saturday
03/09/2024 12:48:00,03/09/2024 12:48,Swathi,9782459475,Waxing,,De-tan,Pedicure,Manicure,Bleaching,Wash,,Threading,,,3017,Pinky,GPay,,2024-09-03,36,Tuesday
17/11/2024 09:23:00,17/11/2024 09:23,Swathi,9570446556,Waxing,Facial,De-tan,,Manicure,,Wash,,Threading,,,3160,Suganya Sri,Card,Poornima,2024-11-17,46,Sunday
14/11/2024 20:21:00,14/11/2024 20:21,Kavya,9901139025,Waxing,,,Pedicure,Manicure,Bleaching,Wash,,,Hair Cut,,1668,Suganya Sri,Card,,2024-11-14,46,Thursday
12/10/2024 09:03:00,12/10/2024 09:03,Aishwarya,9828876088,Waxing,,,Pedicure,Manicure,,,,Threading,,,1890,Pinky,GPay,Pinky,2024-10-12,41,Saturday
13/10/2024 18:32:00,13/10/2024 18:32,Soumya,9645907769,Waxing,Facial,,Pedicure,,,,,,,,3200,Malar,PhonePe,,2024-10-13,41,Sunday
17/09/2024 12:46:00,17/09/2024 12:46,Kavya,9552862999,Waxing,,,Pedicure,Manicure,,Wash,Massage,Threading,Hair Cut,Miscellaneous,1793,Pinky,Cash,Anjali,2024-09-17,38,Tuesday
31/08/2024 17:39:00,31/08/2024 17:39,Priya,9377722718,,,De-tan,Pedicure,Manicure,Bleaching,Wash,Massage,,Hair Cut,,860,Malar,Cash,Malar,2024-08-31,35,Saturday
30/09/2024 19:57:00,30/09/2024 19:57,Latha,9204814906,,,,Pedicure,Manicure,,Wash,,Threading,,Miscellaneous,3492,Suganya Sri,Cash,,2024-09-30,40,Monday
20/10/2024 11:47:00,20/10/2024 11:47,Deepa,9622289581,Waxing,,,Pedicure,,Bleaching,Wash,,Threading,,,151,Anjali,GPay,,2024-10-20,42,Sunday
09/09/2024 11:25:00,09/09/2024 11:25,Sangeetha,9155761748,,Facial,De-tan,Pedicure,,,,Massage,,Hair Cut,,3385,Anjali,PhonePe,,2024-09-09,37,Monday
09/09/2024 09:36:00,09/09/2024 09:36,Harini,9996274543,,,,Pedicure,Manicure,Bleaching,,Massage,Threading,Hair Cut,Miscellaneous,444,Anjali,Card,,2024-09-09,37,Monday
25/10/2024 20:47:00,25/10/2024 20:47,Swathi,9473573556,,Facial,,Pedicure,,,,Massage,,Hair Cut,,150,Poornima,Card,Pinky,2024-10-25,43,Friday
31/08/2024 15:47:00,31/08/2024 15:47,Kavya,9596564452,Waxing,Facial,De-tan,Pedicure,Manicure,Bleaching,Wash,Massage,Threading,Hair Cut,,2042,Suganya Sri,Card,,2024-08-31,35,Saturday
27/08/2024 18:21:00,27/08/2024 18:21,Harini,9545547925,Waxing,Facial,De-tan,Pedicure,,,,,Threading,,Miscellaneous,2247,Suganya Sri,GPay,,2024-08-27,35,Tuesday
08/09/2024 20:31:00,08/09/2024 20:31,Anjali,9690963653,Waxing,,,,,,Wash,Massage,,Hair Cut,Miscellaneous,3404,Pinky,Cash,,2024-09-08,36,Sunday
30/10/2024 12:22:00,30/10/2024 12:22,Ranjani,9759024107,,Facial,,Pedicure,Manicure,Bleaching,Wash,Massage,,Hair Cut,Miscellaneous,2511,Anjali,Cash,Pinky,2024-10-30,44,Wednesday
18/10/2024 17:18:00,18/10/2024 17:18,Priya,9769063095,Waxing,,,,Manicure,,Wash,Massage,Threading,Hair Cut,Miscellaneous,1743,Pinky,GPay,Malar,2024-10-18,42,Friday
01/11/2024 19:21:00,01/11/2024 19:21,Divya,9237518304,,,De-tan,,Manicure,Bleaching,,Massage,,Hair Cut,Miscellaneous,1894,Poornima,GPay,Suganya Sri,2024-11-01,44,Friday
22/08/2024 13:27:00,22/08/2024 13:27,Nisha,9230957192,Waxing,Facial,De-tan,Pedicure,,,,Massage,Threading,Hair Cut,Miscellaneous,3422,Anjali,Cash,,2024-08-22,34,Thursday
12/10/2024 16:05:00,12/10/2024 16:05,Divya,9929733543,,Facial,De-tan,Pedicure,Manicure,Bleaching,,,,Hair Cut,Miscellaneous,1290,Suganya Sri,Card,,2024-10-12,41,Saturday
08/11/2024 10:01:00,08/11/2024 10:01,Nisha,9831783357,Waxing,Facial,,,,Bleaching,,Massage,Threading,Hair Cut,,2214,Poornima,GPay,Malar,2024-11-08,45,Friday
18/11/2024 16:05:00,18/11/2024 16:05,Latha,9830104308,Waxing,Facial,,,Manicure,Bleaching,Wash,,,Hair Cut,Miscellaneous,2618,Anjali,PhonePe,Pinky,2024-11-18,47,Monday
17/09/2024 19:00:00,17/09/2024 19:00,Meena,9943965983,Waxing,,De-tan,Pedicure,,,,Massage,,,,1965,Pinky,PhonePe,Pinky,2024-09-17,38,Tuesday
15/09/2024 10:32:00,15/09/2024 10:32,Kavya,9163585056,,Facial,De-tan,,,,,,Threading,,,777,Pinky,GPay,Suganya Sri,2024-09-15,37,Sunday
02/11/2024 12:49:00,02/11/2024 12:49,Aishwarya,9279750663,,Facial,,,Manicure,,,Massage,,,,2473,Malar,GPay,Poornima,2024-11-02,44,Saturday
31/08/2024 15:41:00,31/08/2024 15:41,Aishwarya,9798505275,,,,,Manicure,Bleaching,Wash,Massage,Threading,Hair Cut,,2378,Poornima,Cash,,2024-08-31,35,Saturday
21/09/2024 15:09:00,21/09/2024 15:09,Ranjani,9323027686,Waxing,,,,Manicure,Bleaching,Wash,Massage,,,,2510,Malar,Cash,,2024-09-21,38,Saturday
01/10/2024 12:23:00,01/10/2024 12:23,Swathi,9514648475,,Facial,,Pedicure,Manicure,Bleaching,Wash,,,,,3098,Suganya Sri,Cash,,2024-10-01,40,Tuesday
12/10/2024 13:16:00,12/10/2024 13:16,Anjali,9658059811,,Facial,,Pedicure,Manicure,,Wash,Massage,Threading,Hair Cut,,3299,Suganya Sri,PhonePe,,2024-10-12,41,Saturday
07/09/2024 14:25:00,07/09/2024 14:25,Meena,9182517647,,,De-tan,Pedicure,,,Wash,,Threading,,,3324,Anjali,PhonePe,Pinky,2024-09-07,36,Saturday
20/10/2024 18:03:00,20/10/2024 18:03,Sandhya,9280492867,,,,Pedicure,Manicure,,,Massage,Threading,,,553,Suganya Sri,Card,,2024-10-20,42,Sunday
30/08/2024 13:17:00,30/08/2024 13:17,Keerthana,9742710842,,Facial,,Pedicure,Manicure,,,,Threading,,,2132,Poornima,GPay,Poornima,2024-08-30,35,Friday
26/10/2024 17:44:00,26/10/2024 17:44,Sandhya,9178751252,Waxing,Facial,De-tan,,Manicure,,Wash,Massage,,Hair Cut,,609,Anjali,GPay,,2024-10-26,43,Saturday
06/09/2024 20:06:00,06/09/2024 20:06,Meena,9873971225,Waxing,,De-tan,,,Bleaching,,Massage,,,Miscellaneous,2434,Malar,Cash,,2024-09-06,36,Friday
05/09/2024 17:42:00,05/09/2024 17:42,Priya,9929332873,Waxing,,,Pedicure,Manicure,Bleaching,Wash,,,,,3062,Suganya Sri,GPay,Suganya Sri,2024-09-05,36,Thursday
20/10/2024 14:58:00,20/10/2024 14:58,Keerthana,9851121036,,,De-tan,Pedicure,Manicure,,Wash,Massage,Threading,Hair Cut,,321,Anjali,Card,Anjali,2024-10-20,42,Sunday
30/08/2024 16:27:00,30/08/2024 16:27,Deepa,9752493600,,,De-tan,,Manicure,Bleaching,,,,Hair Cut,,1644,Pinky,PhonePe,Suganya Sri,2024-08-30,35,Friday
24/08/2024 20:19:00,24/08/2024 20:19,Divya,9158750623,Waxing,Facial,,,,,,,,,Miscellaneous,327,Poornima,GPay,,2024-08-24,34,Saturday
19/10/2024 10:58:00,19/10/2024 10:58,Kavya,9834569456,Waxing,,,Pedicure,,,,,,,Miscellaneous,3426,Anjali,GPay,,2024-10-19,42,Saturday
29/08/2024 19:15:00,29/08/2024 19:15,Meena,9741016860,Waxing,,,,Manicure,Bleaching,Wash,Massage,,Hair Cut,Miscellaneous,2083,Pinky,Cash,Poornima,2024-08-29,35,Thursday
16/10/2024 20:18:00,16/10/2024 20:18,Swathi,9162235547,,,,,,,,Massage,,Hair Cut,,2960,Suganya Sri,PhonePe,,2024-10-16,42,Wednesday
11/10/2024 15:19:00,11/10/2024 15:19,Keerthana,9552027525,,,De-tan,,,,Wash,Massage,,,,2686,Poornima,PhonePe,Suganya Sri,2024-10-11,41,Friday
12/11/2024 11:56:00,12/11/2024 11:56,Harini,9748622663,Waxing,,De-tan,,,Bleaching,Wash,,,Hair Cut,,1661,Suganya Sri,PhonePe,,2024-11-12,46,Tuesday
28/09/2024 17:16:00,28/09/2024 17:16,Sangeetha,9311915949,Waxing,,De-tan,,,,,Massage,Threading,Hair Cut,Miscellaneous,871,Anjali,Cash,Malar,2024-09-28,39,Saturday
19/11/2024 15:45:00,19/11/2024 15:45,Keerthana,9296569090,Waxing,,,Pedicure,,,,,,Hair Cut,,750,Malar,GPay,Pinky,2024-11-19,47,Tuesday
10/10/2024 19:15:00,10/10/2024 19:15,Divya,9843266245,Waxing,,,,,Bleaching,,,,,Miscellaneous,750,Suganya Sri,PhonePe,Anjali,2024-10-10,41,Thursday
29/10/2024 18:35:00,29/10/2024 18:35,Aishwarya,9866304427,,Facial,De-tan,,Manicure,,Wash,Massage,Threading,Hair Cut,Miscellaneous,1339,Poornima,GPay,Anjali,2024-10-29,44,Tuesday
30/10/2024 13:28:00,30/10/2024 13:28,Sangeetha,9480957803,,Facial,,Pedicure,,,Wash,,Threading,Hair Cut,,2898,Malar,GPay,,2024-10-30,44,Wednesday
12/09/2024 17:48:00,12/09/2024 17:48,Swathi,9638912782,,,,,Manicure,Bleaching,,Massage,Threading,,Miscellaneous,2395,Poornima,Cash,Malar,2024-09-12,37,Thursday
16/09/2024 14:02:00,16/09/2024 14:02,Sangeetha,9946623284,Waxing,,,,Manicure,Bleaching,,Massage,Threading,,Miscellaneous,1858,Pinky,Card,,2024-09-16,38,Monday
24/09/2024 11:01:00,24/09/2024 11:01,Harini,9865565221,Waxing,,,Pedicure,,,Wash,,,Hair Cut,,1029,Anjali,PhonePe,,2024-09-24,39,Tuesday
27/10/2024 15:52:00,27/10/2024 15:52,Latha,9879181262,,Facial,De-tan,,Manicure,Bleaching,Wash,,,Hair Cut,,3467,Suganya Sri,Card,Suganya Sri,2024-10-27,43,Sunday
13/11/2024 15:19:00,13/11/2024 15:19,Aishwarya,9508549521,,,De-tan,Pedicure,,Bleaching,,Massage,Threading,,Miscellaneous,3081,Pinky,PhonePe,,2024-11-13,46,Wednesday
11/11/2024 13:24:00,11/11/2024 13:24,Harini,9565890568,Waxing,Facial,,Pedicure,Manicure,,Wash,Massage,Threading,,,314,Malar,PhonePe,Poornima,2024-11-11,46,Monday
30/09/2024 11:41:00,30/09/2024 11:41,Nisha,9259658125,,Facial,De-tan,Pedicure,Manicure,Bleaching,,Massage,,Hair Cut,,3292,Suganya Sri,Cash,,2024-09-30,40,Monday
23/09/2024 19:20:00,23/09/2024 19:20,Anjali,9106463031,,,,,Manicure,,,Massage,,Hair Cut,Miscellaneous,2472,Pinky,Cash,Malar,2024-09-23,39,Monday
14/09/2024 18:38:00,14/09/2024 18:38,Harini,9414322116,Waxing,,,Pedicure,,Bleaching,Wash,,,Hair Cut,,1790,Malar,Card,,2024-09-14,37,Saturday
28/08/2024 18:43:00,28/08/2024 18:43,Swathi,9869248448,Waxing,Facial,De-tan,Pedicure,Manicure,,,,Threading,,,954,Pinky,Card,Malar,2024-08-28,35,Wednesday
17/10/2024 11:08:00,17/10/2024 11:08,Sangeetha,9437918939,Waxing,,De-tan,,Manicure,,,Massage,,Hair Cut,Miscellaneous,2906,Malar,Card,Pinky,2024-10-17,42,Thursday
17/10/2024 11:40:00,17/10/2024 11:40,Priya,9887093284,,Facial,,,,Bleaching,Wash,,Threading,,,2413,Pinky,PhonePe,Malar,2024-10-17,42,Thursday
30/08/2024 20:51:00,30/08/2024 20:51,Meena,9694688087,Waxing,,,,,,Wash,,Threading,Hair Cut,Miscellaneous,2952,Suganya Sri,Cash,,2024-08-30,35,Friday
13/11/2024 13:01:00,13/11/2024 13:01,Priya,9158462205,,Facial,De-tan,,,,Wash,,,,,862,Malar,Card,Anjali,2024-11-13,46,Wednesday
08/10/2024 17:48:00,08/10/2024 17:48,Divya,9568366207,Waxing,,De-tan,,Manicure,Bleaching,,Massage,Threading,,,2854,Poornima,PhonePe,Poornima,2024-10-08,41,Tuesday
20/11/2024 14:01:00,20/11/2024 14:01,Anjali,9447236150,Waxing,,De-tan,,,Bleaching,Wash,,Threading,Hair Cut,Miscellaneous,318,Malar,GPay,,2024-11-20,47,Wednesday
22/09/2024 17:04:00,22/09/2024 17:04,Deepa,9151663951,,Facial,De-tan,,,Bleaching,Wash,,,Hair Cut,,1928,Anjali,GPay,Poornima,2024-09-22,38,Sunday
07/09/2024 16:31:00,07/09/2024 16:31,Divya,9115547803,,Facial,De-tan,,,,Wash,Massage,,Hair Cut,,1071,Malar,GPay,Anjali,2024-09-07,36,Saturday
17/10/2024 19:51:00,17/10/2024 19:51,Anjali,9710420875,Waxing,Facial,De-tan,,,Bleaching,,,,,Miscellaneous,1261,Anjali,GPay,Poornima,2024-10-17,42,Thursday
08/09/2024 15:12:00,08/09/2024 15:12,Anjali,9786129224,,Facial,De-tan,,Manicure,Bleaching,Wash,Massage,Threading,Hair Cut,Miscellaneous,257,Pinky,Card,Poornima,2024-09-08,36,Sunday
24/10/2024 16:18:00,24/10/2024 16:18,Deepa,9116357703,Waxing,,,,,Bleaching,,,,,,2637,Pinky,Cash,Malar,2024-10-24,43,Thursday
21/09/2024 09:10:00,21/09/2024 09:10,Meena,9434508604,,,,Pedicure,,Bleaching,,,,,,1120,Anjali,GPay,Suganya Sri,2024-09-21,38,Saturday
24/08/2024 09:27:00,24/08/2024 09:27,Deepa,9476729150,,Facial,,Pedicure,,Bleaching,,Massage,,,,1062,Malar,Card,Malar,2024-08-24,34,Saturday
06/09/2024 10:53:00,06/09/2024 10:53,Sangeetha,9401811080,,Facial,De-tan,Pedicure,Manicure,,,Massage,,,,3440,Anjali,Cash,,2024-09-06,36,Friday
23/10/2024 18:23:00,23/10/2024 18:23,Shruthi,9655507012,,,,Pedicure,Manicure,,,Massage,Threading,Hair Cut,,1366,Suganya Sri,Card,,2024-10-23,43,Wednesday
07/09/2024 17:29:00,07/09/2024 17:29,Harini,9627999998,Waxing,,De-tan,,Manicure,,Wash,,,,Miscellaneous,3438,Poornima,Cash,Pinky,2024-09-07,36,Saturday
11/10/2024 09:33:00,11/10/2024 09:33,Meena,9513773146,Waxing,Facial,De-tan,,,Bleaching,Wash,,Threading,Hair Cut,,832,Poornima,Card,,2024-10-11,41,Friday
02/10/2024 17:22:00,02/10/2024 17:22,Swathi,9300842186,,Facial,De-tan,Pedicure,Manicure,Bleaching,Wash,,,Hair Cut,Miscellaneous,1361,Malar,Card,,2024-10-02,40,Wednesday
25/08/2024 14:30:00,25/08/2024 14:30,Aishwarya,9395576645,,,,,,,Wash,,,,Miscellaneous,1107,Suganya Sri,GPay,Anjali,2024-08-25,34,Sunday
25/09/2024 17:31:00,25/09/2024 17:31,Divya,9282228203,,,,,Manicure,,,,,Hair Cut,,3421,Pinky,GPay,Suganya Sri,2024-09-25,39,Wednesday
16/09/2024 10:50:00,16/09/2024 10:50,Divya,9742626636,Waxing,Facial,,Pedicure,,,,Massage,,Hair Cut,,2037,Poornima,Cash,Suganya Sri,2024-09-16,38,Monday
01/09/2024 16:10:00,01/09/2024 16:10,Anjali,9503804319,,,De-tan,Pedicure,,,Wash,,,,Miscellaneous,316,Poornima,Card,,2024-09-01,35,Sunday
31/08/2024 20:26:00,31/08/2024 20:26,Meena,9636356479,,Facial,,,Manicure,,Wash,,,Hair Cut,Miscellaneous,1173,Suganya Sri,GPay,,2024-08-31,35,Saturday
18/11/2024 15:25:00,18/11/2024 15:25,Keerthana,9628775436,,,De-tan,Pedicure,,Bleaching,Wash,,,,,1602,Anjali,Cash,,2024-11-18,47,Monday
16/09/2024 20:22:00,16/09/2024 20:22,Ranjani,9860821733,,Facial,,,Manicure,,Wash,,,,Miscellaneous,270,Anjali,PhonePe,,2024-09-16,38,Monday
19/10/2024 11:01:00,19/10/2024 11:01,Latha,9505776877,,Facial,,,Manicure,,Wash,,,,Miscellaneous,1581,Pinky,Cash,,2024-10-19,42,Saturday
14/11/2024 10:29:00,14/11/2024 10:29,Keerthana,9381500609,,Facial,De-tan,Pedicure,,,,,Threading,,Miscellaneous,2621,Anjali,PhonePe,,2024-11-14,46,Thursday
31/10/2024 14:47:00,31/10/2024 14:47,Sandhya,9735760621,Waxing,,,,Manicure,Bleaching,Wash,,,Hair Cut,,3222,Anjali,Card,,2024-10-31,44,Thursday
29/09/2024 18:24:00,29/09/2024 18:24,Meena,9990913711,,Facial,De-tan,Pedicure,Manicure,,Wash,,,Hair Cut,Miscellaneous,292,Pinky,Card,Malar,2024-09-29,39,Sunday
09/11/2024 14:07:00,09/11/2024 14:07,Anjali,9479883047,Waxing,Facial,,,Manicure,Bleaching,Wash,,Threading,Hair Cut,,2484,Anjali,Cash,,2024-11-09,45,Saturday
06/10/2024 13:43:00,06/10/2024 13:43,Sangeetha,9804730076,Waxing,,,Pedicure,Manicure,Bleaching,,Massage,Threading,Hair Cut,,2035,Malar,GPay,,2024-10-06,40,Sunday
17/10/2024 11:18:00,17/10/2024 11:18,Deepa,9669962815,Waxing,Facial,,Pedicure,Manicure,Bleaching,Wash,Massage,,Hair Cut,,3364,Poornima,Cash,,2024-10-17,42,Thursday
04/10/2024 12:24:00,04/10/2024 12:24,Soumya,9308977785,Waxing,Facial,De-tan,Pedicure,,Bleaching,,Massage,Threading,Hair Cut,Miscellaneous,3170,Anjali,PhonePe,,2024-10-04,40,Friday
10/11/2024 17:38:00,10/11/2024 17:38,Divya,9700573796,,,De-tan,,Manicure,Bleaching,Wash,,Threading,Hair Cut,,2086,Suganya Sri,GPay,Suganya Sri,2024-11-10,45,Sunday
18/11/2024 09:48:00,18/11/2024 09:48,Anjali,9678654610,,,,Pedicure,Manicure,Bleaching,Wash,,Threading,,,2380,Poornima,GPay,Poornima,2024-11-18,47,Monday
16/11/2024 10:42:00,16/11/2024 10:42,Sangeetha,9447325415,,Facial,,Pedicure,Manicure,Bleaching,Wash,Massage,Threading,,,1649,Poornima,GPay,,2024-11-16,46,Saturday
25/09/2024 10:13:00,25/09/2024 10:13,Keerthana,9216700791,Waxing,,,,Manicure,Bleaching,Wash,Massage,Threading,,Miscellaneous,1691,Anjali,PhonePe,Suganya Sri,2024-09-25,39,Wednesday
09/09/2024 17:02:00,09/09/2024 17:02,Anjali,9506817067,Waxing,Facial,De-tan,,,Bleaching,Wash,,Threading,,,1981,Suganya Sri,PhonePe,Anjali,2024-09-09,37,Monday
01/09/2024 18:56:00,01/09/2024 18:56,Keerthana,9917312770,Waxing,,,,Manicure,,Wash,Massage,,,Miscellaneous,1964,Suganya Sri,GPay,,2024-09-01,35,Sunday
29/10/2024 17:30:00,29/10/2024 17:30,Latha,9643476951,,Facial,De-tan,Pedicure,,,Wash,Massage,,,Miscellaneous,2262,Malar,Cash,Pinky,2024-10-29,44,Tuesday
19/09/2024 10:48:00,19/09/2024 10:48,Nisha,9204834426,Waxing,Facial,De-tan,,Manicure,Bleaching,Wash,Massage,,,Miscellaneous,1335,Pinky,GPay,,2024-09-19,38,Thursday
28/08/2024 14:31:00,28/08/2024 14:31,Deepa,9480357978,Waxing,Facial,De-tan,Pedicure,Manicure,,,Massage,,Hair Cut,,1068,Suganya Sri,GPay,,2024-08-28,35,Wednesday
28/09/2024 16:59:00,28/09/2024 16:59,Sandhya,9862933143,,Facial,De-tan,Pedicure,Manicure,,Wash,Massage,Threading,,,1624,Anjali,GPay,,2024-09-28,39,Saturday
19/09/2024 14:52:00,19/09/2024 14:52,Latha,9604729193,,Facial,De-tan,,Manicure,,Wash,Massage,Threading,,Miscellaneous,686,Malar,Card,,2024-09-19,38,Thursday
13/10/2024 18:31:00,13/10/2024 18:31,Ranjani,9515983153,Waxing,Facial,,,,Bleaching,,Massage,,Hair Cut,,2796,Anjali,PhonePe,,2024-10-13,41,Sunday
10/11/2024 16:40:00,10/11/2024 16:40,Shruthi,9301723087,,Facial,De-tan,,Manicure,,Wash,Massage,,Hair Cut,,3252,Poornima,GPay,Poornima,2024-11-10,45,Sunday
26/09/2024 13:47:00,26/09/2024 13:47,Latha,9754194532,Waxing,,,Pedicure,,Bleaching,Wash,,,Hair Cut,,740,Anjali,GPay,,2024-09-26,39,Thursday
07/09/2024 20:03:00,07/09/2024 20:03,Harini,9594676852,Waxing,,De-tan,,Manicure,Bleaching,Wash,Massage,Threading,,,910,Suganya Sri,GPay,,2024-09-07,36,Saturday
25/10/2024 17:38:00,25/10/2024 17:38,Meena,9873842447,Waxing,,De-tan,,,Bleaching,Wash,,Threading,Hair Cut,,3134,Anjali,PhonePe,Malar,2024-10-25,43,Friday
24/09/2024 19:58:00,24/09/2024 19:58,Deepa,9890916878,,Facial,De-tan,Pedicure,,Bleaching,Wash,Massage,,,,1586,Suganya Sri,GPay,,2024-09-24,39,Tuesday
29/08/2024 17:54:00,29/08/2024 17:54,Meena,9186871541,,,,Pedicure,Manicure,Bleaching,,Massage,,,Miscellaneous,776,Malar,PhonePe,Pinky,2024-08-29,35,Thursday
30/09/2024 11:45:00,30/09/2024 11:45,Priya,9755532311,Waxing,,De-tan,,,Bleaching,Wash,,Threading,,Miscellaneous,734,Pinky,PhonePe,,2024-09-30,40,Monday
26/10/2024 09:32:00,26/10/2024 09:32,Deepa,9403605532,Waxing,Facial,De-tan,Pedicure,,Bleaching,,Massage,,Hair Cut,,2157,Suganya Sri,Card,Malar,2024-10-26,43,Saturday
14/10/2024 19:33:00,14/10/2024 19:33,Shruthi,9244519955,,Facial,De-tan,Pedicure,Manicure,Bleaching,,Massage,,Hair Cut,,1585,Poornima,Cash,Anjali,2024-10-14,42,Monday
09/11/2024 17:39:00,09/11/2024 17:39,Shruthi,9106705479,,Facial,,,,,,,,Hair Cut,,2911,Poornima,Card,Pinky,2024-11-09,45,Saturday
26/08/2024 19:58:00,26/08/2024 19:58,Sandhya,9581908773,,Facial,,,Manicure,,,Massage,,,,2226,Anjali,PhonePe,Anjali,2024-08-26,35,Monday
11/10/2024 09:47:00,11/10/2024 09:47,Meena,9220971647,,Facial,,Pedicure,Manicure,,Wash,,,,,862,Malar,Card,,2024-10-11,41,Friday
23/08/2024 12:37:00,23/08/2024 12:37,Meena,9582313412,Waxing,,,,Manicure,,,Massage,,Hair Cut,Miscellaneous,2381,Malar,GPay,,2024-08-23,34,Friday
13/11/2024 11:53:00,13/11/2024 11:53,Ranjani,9979072839,Waxing,Facial,,,Manicure,,,,,Hair Cut,,270,Pinky,PhonePe,,2024-11-13,46,Wednesday
14/10/2024 15:49:00,14/10/2024 15:49,Keerthana,9388099445,,,,,,,Wash,Massage,Threading,Hair Cut,,222,Malar,Card,,2024-10-14,42,Monday
25/08/2024 10:20:00,25/08/2024 10:20,Soumya,9423439912,,Facial,,Pedicure,,Bleaching,,Massage,Threading,Hair Cut,,2038,Poornima,Card,Anjali,2024-08-25,34,Sunday
25/09/2024 20:03:00,25/09/2024 20:03,Keerthana,9233166820,,,De-tan,,Manicure,Bleaching,,Massage,Threading,,,2203,Malar,Cash,,2024-09-25,39,Wednesday
21/09/2024 09:32:00,21/09/2024 09:32,Keerthana,9444632116,Waxing,Facial,,,Manicure,Bleaching,Wash,,Threading,,,185,Anjali,Cash,Anjali,2024-09-21,38,Saturday
16/10/2024 11:48:00,16/10/2024 11:48,Anjali,9677478002,,,,Pedicure,,,,Massage,,Hair Cut,,3019,Pinky,GPay,,2024-10-16,42,Wednesday
21/10/2024 13:18:00,21/10/2024 13:18,Keerthana,9690969856,Waxing,,,Pedicure,Manicure,Bleaching,,Massage,,,Miscellaneous,1556,Poornima,Cash,,2024-10-21,43,Monday
18/11/2024 17:22:00,18/11/2024 17:22,Divya,9762248262,,,De-tan,,Manicure,Bleaching,Wash,Massage,,,,1934,Anjali,Card,,2024-11-18,47,Monday
27/10/2024 13:00:00,27/10/2024 13:00,Nisha,9772610313,,Facial,De-tan,,,,Wash,Massage,Threading,Hair Cut,Miscellaneous,3371,Malar,PhonePe,Anjali,2024-10-27,43,Sunday
08/10/2024 12:00:00,08/10/2024 12:00,Swathi,9112051733,Waxing,,De-tan,,Manicure,Bleaching,Wash,Massage,,Hair Cut,,1593,Pinky,Card,Poornima,2024-10-08,41,Tuesday
17/10/2024 11:11:00,17/10/2024 11:11,Shruthi,9454783298,Waxing,,,Pedicure,,,Wash,,,Hair Cut,,957,Anjali,Cash,Pinky,2024-10-17,42,Thursday
26/09/2024 09:43:00,26/09/2024 09:43,Sangeetha,9141330767,Waxing,Facial,De-tan,,,,Wash,Massage,Threading,,Miscellaneous,1669,Poornima,Card,,2024-09-26,39,Thursday
28/10/2024 14:17:00,28/10/2024 14:17,Deepa,9741904169,Waxing,Facial,De-tan,,Manicure,,Wash,Massage,,Hair Cut,Miscellaneous,2235,Anjali,GPay,Anjali,2024-10-28,44,Monday
03/10/2024 16:31:00,03/10/2024 16:31,Aishwarya,9556277517,Waxing,,,Pedicure,,Bleaching,,Massage,Threading,,,1284,Anjali,Cash,Suganya Sri,2024-10-03,40,Thursday
23/10/2024 13:15:00,23/10/2024 13:15,Sandhya,9846495045,Waxing,Facial,,Pedicure,Manicure,,,Massage,,,Miscellaneous,927,Malar,PhonePe,Anjali,2024-10-23,43,Wednesday
12/09/2024 15:46:00,12/09/2024 15:46,Priya,9524278983,,,,Pedicure,Manicure,Bleaching,Wash,Massage,Threading,Hair Cut,Miscellaneous,997,Anjali,PhonePe,,2024-09-12,37,Thursday
06/10/2024 13:09:00,06/10/2024 13:09,Keerthana,9262096206,Waxing,,De-tan,Pedicure,,Bleaching,,,Threading,Hair Cut,Miscellaneous,1672,Poornima,PhonePe,,2024-10-06,40,Sunday
28/10/2024 15:49:00,28/10/2024 15:49,Soumya,9453819351,Waxing,Facial,,Pedicure,Manicure,Bleaching,Wash,,Threading,,Miscellaneous,1860,Malar,PhonePe,,2024-10-28,44,Monday
15/09/2024 11:31:00,15/09/2024 11:31,Nisha,9427010738,,,De-tan,,,,Wash,Massage,Threading,Hair Cut,,2473,Malar,PhonePe,,2024-09-15,37,Sunday
09/10/2024 17:29:00,09/10/2024 17:29,Keerthana,9951592285,,Facial,De-tan,Pedicure,,,Wash,Massage,Threading,,,3147,Malar,Cash,Malar,2024-10-09,41,Wednesday
31/10/2024 09:10:00,31/10/2024 09:10,Meena,9253327019,Waxing,Facial,De-tan,,Manicure,Bleaching,Wash,Massage,,,Miscellaneous,333,Suganya Sri,Card,Malar,2024-10-31,44,Thursday
12/11/2024 19:16:00,12/11/2024 19:16,Shruthi,9964144894,Waxing,Facial,De-tan,Pedicure,Manicure,Bleaching,,Massage,Threading,Hair Cut,Miscellaneous,904,Malar,Card,,2024-11-12,46,Tuesday
22/10/2024 10:45:00,22/10/2024 10:45,Ranjani,9474547968,,,De-tan,Pedicure,,,Wash,,,,Miscellaneous,3293,Pinky,GPay,Pinky,2024-10-22,43,Tuesday
25/08/2024 09:59:00,25/08/2024 09:59,Shruthi,9466705845,Waxing,Facial,De-tan,Pedicure,,,,Massage,,,,1828,Suganya Sri,GPay,,2024-08-25,34,Sunday
08/09/2024 19:33:00,08/09/2024 19:33,Harini,9224560796,,Facial,De-tan,,,,Wash,,Threading,Hair Cut,Miscellaneous,2398,Suganya Sri,Cash,Pinky,2024-09-08,36,Sunday
04/10/2024 17:22:00,04/10/2024 17:22,Aishwarya,9526946286,,Facial,De-tan,,Manicure,,,,,Hair Cut,Miscellaneous,778,Suganya Sri,PhonePe,,2024-10-04,40,Friday
03/11/2024 16:08:00,03/11/2024 16:08,Meena,9159025754,,,De-tan,Pedicure,Manicure,,Wash,Massage,Threading,Hair Cut,Miscellaneous,1008,Pinky,GPay,,2024-11-03,44,Sunday
28/09/2024 19:24:00,28/09/2024 19:24,Sandhya,9564346091,,,De-tan,Pedicure,Manicure,Bleaching,,,,,Miscellaneous,2288,Malar,PhonePe,,2024-09-28,39,Saturday
17/11/2024 17:53:00,17/11/2024 17:53,Nisha,9168754244,Waxing,,De-tan,Pedicure,Manicure,,,,,,Miscellaneous,678,Pinky,GPay,,2024-11-17,46,Sunday
25/09/2024 17:54:00,25/09/2024 17:54,Shruthi,9741923710,Waxing,Facial,De-tan,,,,,Massage,,Hair Cut,Miscellaneous,2418,Poornima,GPay,,2024-09-25,39,Wednesday
26/08/2024 14:36:00,26/08/2024 14:36,Swathi,9602270321,Waxing,Facial,,,Manicure,Bleaching,Wash,,,,,844,Suganya Sri,PhonePe,,2024-08-26,35,Monday
18/11/2024 16:22:00,18/11/2024 16:22,Divya,9122378395,,Facial,De-tan,Pedicure,Manicure,,,,,Hair Cut,,1152,Anjali,Cash,,2024-11-18,47,Monday
26/10/2024 19:03:00,26/10/2024 19:03,Aishwarya,9501373789,Waxing,,De-tan,Pedicure,,Bleaching,,,Threading,Hair Cut,,598,Malar,PhonePe,,2024-10-26,43,Saturday
09/10/2024 17:28:00,09/10/2024 17:28,Deepa,9778336273,Waxing,,De-tan,,,Bleaching,Wash,Massage,,,Miscellaneous,2519,Pinky,Cash,,2024-10-09,41,Wednesday
31/10/2024 14:29:00,31/10/2024 14:29,Meena,9959828417,Waxing,,De-tan,,,Bleaching,,Massage,Threading,,Miscellaneous,283,Malar,Card,,2024-10-31,44,Thursday
18/10/2024 19:59:00,18/10/2024 19:59,Kavya,9461256076,,,,Pedicure,,Bleaching,Wash,Massage,,Hair Cut,Miscellaneous,3248,Poornima,GPay,,2024-10-18,42,Friday
06/11/2024 20:04:00,06/11/2024 20:04,Keerthana,9974199071,,Facial,,Pedicure,Manicure,,Wash,Massage,,Hair Cut,,2156,Malar,Cash,Malar,2024-11-06,45,Wednesday
28/08/2024 17:17:00,28/08/2024 17:17,Nisha,9299269900,Waxing,Facial,,,Manicure,,,Massage,Threading,Hair Cut,,2172,Malar,GPay,,2024-08-28,35,Wednesday
12/09/2024 16:05:00,12/09/2024 16:05,Harini,9410376657,Waxing,Facial,,,Manicure,,Wash,,,,Miscellaneous,2684,Malar,Cash,Anjali,2024-09-12,37,Thursday
05/09/2024 14:15:00,05/09/2024 14:15,Ranjani,9132387547,,Facial,De-tan,,,Bleaching,,Massage,,,Miscellaneous,1680,Malar,GPay,Poornima,2024-09-05,36,Thursday
25/10/2024 19:02:00,25/10/2024 19:02,Shruthi,9198295461,,Facial,De-tan,Pedicure,Manicure,Bleaching,,Massage,,,,1251,Malar,Cash,Pinky,2024-10-25,43,Friday
25/08/2024 12:07:00,25/08/2024 12:07,Meena,9236052992,Waxing,Facial,De-tan,,,Bleaching,Wash,,,Hair Cut,Miscellaneous,2720,Malar,Cash,Anjali,2024-08-25,34,Sunday
27/10/2024 15:25:00,27/10/2024 15:25,Sandhya,9945054686,,,,Pedicure,,Bleaching,,,Threading,Hair Cut,,2991,Suganya Sri,GPay,,2024-10-27,43,Sunday
16/11/2024 10:59:00,16/11/2024 10:59,Sangeetha,9937621323,Waxing,,De-tan,Pedicure,,,Wash,Massage,,Hair Cut,Miscellaneous,443,Poornima,Cash,Suganya Sri,2024-11-16,46,Saturday
25/10/2024 14:53:00,25/10/2024 14:53,Keerthana,9119894583,Waxing,,,,,,,,,Hair Cut,,3423,Pinky,Cash,,2024-10-25,43,Friday
03/11/2024 16:08:00,03/11/2024 16:08,Deepa,9971211759,,,,Pedicure,,,Wash,Massage,,Hair Cut,,3149,Anjali,GPay,Malar,2024-11-03,44,Sunday
15/09/2024 16:13:00,15/09/2024 16:13,Soumya,9468502367,Waxing,,,,,,Wash,,Threading,Hair Cut,,965,Malar,PhonePe,,2024-09-15,37,Sunday
07/10/2024 17:04:00,07/10/2024 17:04,Deepa,9849417922,,,,Pedicure,Manicure,,,Massage,,,,735,Malar,PhonePe,,2024-10-07,41,Monday
16/09/2024 11:44:00,16/09/2024 11:44,Meena,9839112297,Waxing,Facial,,,,Bleaching,,Massage,Threading,Hair Cut,Miscellaneous,1749,Malar,GPay,Pinky,2024-09-16,38,Monday
14/10/2024 20:14:00,14/10/2024 20:14,Divya,9543473286,Waxing,,De-tan,,,,,Massage,Threading,Hair Cut,Miscellaneous,794,Malar,GPay,,2024-10-14,42,Monday
29/08/2024 18:41:00,29/08/2024 18:41,Harini,9797011788,,,,Pedicure,Manicure,Bleaching,Wash,,Threading,,Miscellaneous,3168,Malar,PhonePe,Malar,2024-08-29,35,Thursday
09/09/2024 13:51:00,09/09/2024 13:51,Shruthi,9143499295,,,De-tan,,Manicure,Bleaching,,Massage,Threading,Hair Cut,,2408,Poornima,PhonePe,,2024-09-09,37,Monday
21/09/2024 13:02:00,21/09/2024 13:02,Latha,9689699337,Waxing,Facial,De-tan,,Manicure,,,Massage,Threading,Hair Cut,,2391,Anjali,Card,,2024-09-21,38,Saturday
04/10/2024 13:07:00,04/10/2024 13:07,Anjali,9918906844,Waxing,Facial,De-tan,Pedicure,Manicure,Bleaching,Wash,,,,Miscellaneous,2461,Poornima,GPay,,2024-10-04,40,Friday
09/11/2024 09:16:00,09/11/2024 09:16,Kavya,9445854670,,,De-tan,Pedicure,,,,Massage,,Hair Cut,,2752,Malar,Card,,2024-11-09,45,Saturday
14/11/2024 15:18:00,14/11/2024 15:18,Keerthana,9993914659,Waxing,,De-tan,,,,,Massage,Threading,,,760,Poornima,GPay,Anjali,2024-11-14,46,Thursday
17/09/2024 19:48:00,17/09/2024 19:48,Ranjani,9443077837,Waxing,,,,Manicure,,,,,,,1329,Suganya Sri,Card,,2024-09-17,38,Tuesday
11/11/2024 19:08:00,11/11/2024 19:08,Divya,9836207479,,Facial,,,Manicure,,,,Threading,Hair Cut,,2093,Pinky,PhonePe,,2024-11-11,46,Monday
02/11/2024 16:26:00,02/11/2024 16:26,Keerthana,9114214406,,,,,Manicure,Bleaching,,,,,,3282,Suganya Sri,Cash,Suganya Sri,2024-11-02,44,Saturday
04/11/2024 18:41:00,04/11/2024 18:41,Sangeetha,9861494923,,,De-tan,,,,Wash,,,Hair Cut,,2157,Suganya Sri,Card,,2024-11-04,45,Monday
30/08/2024 19:00:00,30/08/2024 19:00,Harini,9323854999,Waxing,Facial,De-tan,Pedicure,,Bleaching,Wash,,Threading,,,923,Suganya Sri,Cash,Anjali,2024-08-30,35,Friday
28/08/2024 15:38:00,28/08/2024 15:38,Aishwarya,9789675533,Waxing,,,Pedicure,,,,,Threading,,,1276,Pinky,GPay,Poornima,2024-08-28,35,Wednesday
28/10/2024 11:07:00,28/10/2024 11:07,Deepa,9804551615,,,De-tan,,,Bleaching,,,Threading,,Miscellaneous,3398,Pinky,PhonePe,,2024-10-28,44,Monday
19/10/2024 19:19:00,19/10/2024 19:19,Keerthana,9267897761,Waxing,,De-tan,Pedicure,,Bleaching,,Massage,,,Miscellaneous,3296,Malar,Cash,Malar,2024-10-19,42,Saturday
16/10/2024 18:41:00,16/10/2024 18:41,Latha,9873238963,,,,Pedicure,,Bleaching,,Massage,,Hair Cut,,3043,Malar,GPay,,2024-10-16,42,Wednesday
30/08/2024 14:30:00,30/08/2024 14:30,Divya,9183017245,,Facial,De-tan,,Manicure,Bleaching,Wash,Massage,,,,1691,Malar,GPay,,2024-08-30,35,Friday
17/09/2024 18:39:00,17/09/2024 18:39,Swathi,9581313613,Waxing,,De-tan,Pedicure,,Bleaching,Wash,Massage,Threading,Hair Cut,Miscellaneous,3500,Poornima,GPay,Poornima,2024-09-17,38,Tuesday
21/09/2024 12:03:00,21/09/2024 12:03,Soumya,9225749301,Waxing,Facial,,Pedicure,Manicure,Bleaching,Wash,Massage,Threading,,,1812,Malar,PhonePe,,2024-09-21,38,Saturday
14/10/2024 09:13:00,14/10/2024 09:13,Swathi,9694493215,Waxing,,De-tan,,,,Wash,,,,,3039,Malar,GPay,Malar,2024-10-14,42,Monday
25/09/2024 14:20:00,25/09/2024 14:20,Shruthi,9791710585,,Facial,,Pedicure,Manicure,Bleaching,,,,,Miscellaneous,2694,Suganya Sri,Card,Malar,2024-09-25,39,Wednesday
08/09/2024 09:08:00,08/09/2024 09:08,Deepa,9330249827,,,,,Manicure,,Wash,Massage,Threading,,Miscellaneous,1963,Poornima,Card,Pinky,2024-09-08,36,Sunday
02/09/2024 14:22:00,02/09/2024 14:22,Anjali,9828895079,,,,Pedicure,,,,Massage,Threading,Hair Cut,Miscellaneous,158,Poornima,Card,,2024-09-02,36,Monday
03/10/2024 17:22:00,03/10/2024 17:22,Ranjani,9195106233,Waxing,,,Pedicure,Manicure,Bleaching,,,Threading,Hair Cut,Miscellaneous,1709,Anjali,Card,Poornima,2024-10-03,40,Thursday
31/10/2024 12:55:00,31/10/2024 12:55,Keerthana,9580442580,Waxing,,De-tan,,,,Wash,,,Hair Cut,,1516,Malar,GPay,Pinky,2024-10-31,44,Thursday
02/09/2024 13:45:00,02/09/2024 13:45,Sandhya,9773745327,,Facial,,Pedicure,Manicure,Bleaching,,,Threading,,Miscellaneous,1613,Poornima,PhonePe,Poornima,2024-09-02,36,Monday
25/10/2024 16:51:00,25/10/2024 16:51,Harini,9553351090,,Facial,,Pedicure,,,Wash,,,,,3059,Suganya Sri,GPay,,2024-10-25,43,Friday
27/08/2024 19:37:00,27/08/2024 19:37,Kavya,9797566041,,,De-tan,,Manicure,Bleaching,Wash,,,,,933,Pinky,Card,Malar,2024-08-27,35,Tuesday
26/10/2024 11:29:00,26/10/2024 11:29,Keerthana,9875317291,Waxing,Facial,De-tan,Pedicure,,Bleaching,Wash,Massage,Threading,,Miscellaneous,568,Anjali,PhonePe,,2024-10-26,43,Saturday
14/10/2024 16:40:00,14/10/2024 16:40,Sandhya,9960431672,Waxing,,,,,,Wash,Massage,,Hair Cut,Miscellaneous,923,Suganya Sri,GPay,,2024-10-14,42,Monday
23/09/2024 15:03:00,23/09/2024 15:03,Deepa,9901183730,Waxing,,,Pedicure,Manicure,Bleaching,Wash,Massage,Threading,,Miscellaneous,1743,Poornima,Cash,Anjali,2024-09-23,39,Monday
06/10/2024 19:58:00,06/10/2024 19:58,Ranjani,9584191207,Waxing,Facial,,,,,Wash,Massage,,Hair Cut,,2984,Pinky,Cash,,2024-10-06,40,Sunday
29/09/2024 16:53:00,29/09/2024 16:53,Nisha,9809569762,,,,Pedicure,,Bleaching,,,Threading,,,1423,Malar,GPay,Suganya Sri,2024-09-29,39,Sunday
31/10/2024 12:16:00,31/10/2024 12:16,Meena,9972706573,,Facial,,Pedicure,,Bleaching,Wash,,Threading,,Miscellaneous,3289,Poornima,Cash,,2024-10-31,44,Thursday
11/09/2024 12:29:00,11/09/2024 12:29,Meena,9345975647,,Facial,,Pedicure,,,Wash,,Threading,Hair Cut,Miscellaneous,389,Pinky,GPay,,2024-09-11,37,Wednesday
30/08/2024 09:15:00,30/08/2024 09:15,Aishwarya,9218469013,Waxing,,De-tan,Pedicure,,Bleaching,Wash,,Threading,Hair Cut,,1556,Pinky,Card,Poornima,2024-08-30,35,Friday
14/10/2024 18:53:00,14/10/2024 18:53,Anjali,9443126627,,Facial,,,Manicure,,Wash,,,Hair Cut,,405,Suganya Sri,GPay,Pinky,2024-10-14,42,Monday
22/09/2024 11:55:00,22/09/2024 11:55,Shruthi,9138632125,Waxing,,De-tan,,Manicure,Bleaching,,,Threading,Hair Cut,Miscellaneous,3203,Malar,GPay,Malar,2024-09-22,38,Sunday
04/11/2024 18:25:00,04/11/2024 18:25,Harini,9195721567,Waxing,Facial,,Pedicure,Manicure,,Wash,Massage,Threading,,Miscellaneous,1912,Malar,Cash,,2024-11-04,45,Monday
17/11/2024 18:53:00,17/11/2024 18:53,Harini,9944763273,Waxing,Facial,De-tan,Pedicure,Manicure,,Wash,,,,,220,Suganya Sri,GPay,,2024-11-17,46,Sunday
28/08/2024 14:06:00,28/08/2024 14:06,Nisha,9293385525,,Facial,De-tan,Pedicure,Manicure,,Wash,,,,Miscellaneous,2152,Malar,PhonePe,Malar,2024-08-28,35,Wednesday
05/11/2024 09:08:00,05/11/2024 09:08,Anjali,9469949049,,Facial,,Pedicure,,,,,,,,1634,Poornima,Card,,2024-11-05,45,Tuesday
06/11/2024 17:58:00,06/11/2024 17:58,Harini,9609872146,Waxing,Facial,De-tan,Pedicure,Manicure,,,,,Hair Cut,,3091,Suganya Sri,Cash,,2024-11-06,45,Wednesday
19/10/2024 15:43:00,19/10/2024 15:43,Sangeetha,9976136398,Waxing,,,,Manicure,,Wash,Massage,Threading,Hair Cut,Miscellaneous,2183,Pinky,GPay,,2024-10-19,42,Saturday
29/10/2024 14:28:00,29/10/2024 14:28,Sandhya,9592983486,Waxing,,,Pedicure,,,,Massage,,,Miscellaneous,1962,Poornima,Cash,Poornima,2024-10-29,44,Tuesday
03/10/2024 10:25:00,03/10/2024 10:25,Meena,9286046732,,,,,Manicure,Bleaching,,,Threading,Hair Cut,Miscellaneous,2120,Pinky,PhonePe,,2024-10-03,40,Thursday
01/09/2024 17:15:00,01/09/2024 17:15,Soumya,9865990343,Waxing,Facial,De-tan,,Manicure,Bleaching,Wash,,,,Miscellaneous,610,Malar,Cash,Malar,2024-09-01,35,Sunday
16/11/2024 10:10:00,16/11/2024 10:10,Deepa,9735721604,Waxing,Facial,,,Manicure,,,Massage,,,Miscellaneous,787,Anjali,Cash,Poornima,2024-11-16,46,Saturday
26/10/2024 15:32:00,26/10/2024 15:32,Priya,9983297091,,Facial,De-tan,Pedicure,Manicure,Bleaching,,,,,,575,Suganya Sri,PhonePe,,2024-10-26,43,Saturday
07/09/2024 16:02:00,07/09/2024 16:02,Divya,9696570875,,Facial,,Pedicure,,,,Massage,,,,960,Anjali,Cash,,2024-09-07,36,Saturday
14/10/2024 13:39:00,14/10/2024 13:39,Aishwarya,9453902865,,Facial,De-tan,Pedicure,,,Wash,Massage,,,,333,Anjali,Cash,,2024-10-14,42,Monday
07/09/2024 09:00:00,07/09/2024 09:00,Sandhya,9995472351,,,,,,,Wash,,,,Miscellaneous,2563,Malar,GPay,,2024-09-07,36,Saturday
11/10/2024 17:17:00,11/10/2024 17:17,Sangeetha,9606151579,,Facial,De-tan,Pedicure,,Bleaching,,,Threading,,Miscellaneous,584,Poornima,Card,,2024-10-11,41,Friday
17/11/2024 12:17:00,17/11/2024 12:17,Anjali,9202408628,Waxing,Facial,,,Manicure,,,,Threading,,,2251,Suganya Sri,GPay,,2024-11-17,46,Sunday
14/11/2024 12:09:00,14/11/2024 12:09,Meena,9482011581,,Facial,De-tan,Pedicure,Manicure,,,Massage,,Hair Cut,Miscellaneous,2877,Poornima,PhonePe,Malar,2024-11-14,46,Thursday
28/08/2024 14:33:00,28/08/2024 14:33,Harini,9211185275,,Facial,,,Manicure,Bleaching,,,Threading,,,2927,Malar,GPay,Anjali,2024-08-28,35,Wednesday
15/10/2024 14:01:00,15/10/2024 14:01,Shruthi,9657831689,,Facial,,,,,Wash,Massage,Threading,Hair Cut,,1423,Suganya Sri,Card,,2024-10-15,42,Tuesday
12/11/2024 10:14:00,12/11/2024 10:14,Keerthana,9578964758,,,,Pedicure,Manicure,,,,Threading,Hair Cut,,3200,Pinky,GPay,Malar,2024-11-12,46,Tuesday
08/09/2024 19:13:00,08/09/2024 19:13,Keerthana,9170126259,,Facial,,,,,,Massage,Threading,Hair Cut,Miscellaneous,1998,Pinky,Card,,2024-09-08,36,Sunday
22/10/2024 15:12:00,22/10/2024 15:12,Divya,9796246993,Waxing,,De-tan,,Manicure,,Wash,Massage,Threading,,,3084,Pinky,PhonePe,,2024-10-22,43,Tuesday
23/10/2024 20:34:00,23/10/2024 20:34,Anjali,9369304211,Waxing,,De-tan,Pedicure,Manicure,Bleaching,Wash,Massage,,Hair Cut,,1158,Anjali,GPay,,2024-10-23,43,Wednesday
15/09/2024 13:59:00,15/09/2024 13:59,Soumya,9435493200,,,,Pedicure,,Bleaching,,,Threading,Hair Cut,,3410,Malar,PhonePe,Suganya Sri,2024-09-15,37,Sunday
14/09/2024 09:01:00,14/09/2024 09:01,Aishwarya,9871426860,,,,,Manicure,Bleaching,Wash,,Threading,Hair Cut,,2568,Suganya Sri,Card,,2024-09-14,37,Saturday
28/10/2024 13:37:00,28/10/2024 13:37,Ranjani,9374503869,Waxing,,De-tan,Pedicure,,,Wash,,,,,3205,Pinky,Cash,,2024-10-28,44,Monday
05/10/2024 12:34:00,05/10/2024 12:34,Meena,9689354724,,,,,Manicure,,Wash,,Threading,Hair Cut,,2481,Anjali,PhonePe,,2024-10-05,40,Saturday
08/11/2024 17:47:00,08/11/2024 17:47,Divya,9872922126,Waxing,,De-tan,,,Bleaching,,,Threading,Hair Cut,Miscellaneous,2235,Poornima,PhonePe,,2024-11-08,45,Friday
23/10/2024 20:47:00,23/10/2024 20:47,Priya,9640276213,,,,Pedicure,,,Wash,Massage,,,,2534,Malar,Card,,2024-10-23,43,Wednesday
02/11/2024 12:45:00,02/11/2024 12:45,Soumya,9823251728,,,De-tan,,,Bleaching,,,,Hair Cut,Miscellaneous,3447,Pinky,PhonePe,,2024-11-02,44,Saturday
11/10/2024 20:51:00,11/10/2024 20:51,Keerthana,9416937518,Waxing,,De-tan,Pedicure,,,Wash,,Threading,Hair Cut,Miscellaneous,608,Poornima,Card,Pinky,2024-10-11,41,Friday
16/09/2024 11:15:00,16/09/2024 11:15,Divya,9324662682,Waxing,Facial,De-tan,,,,Wash,,,Hair Cut,,738,Malar,PhonePe,Suganya Sri,2024-09-16,38,Monday
20/09/2024 11:09:00,20/09/2024 11:09,Ranjani,9559382981,Waxing,,,Pedicure,Manicure,,,,Threading,Hair Cut,Miscellaneous,3144,Pinky,Cash,Pinky,2024-09-20,38,Friday
14/11/2024 11:07:00,14/11/2024 11:07,Aishwarya,9211173389,,,,,Manicure,,,,,,,2452,Anjali,Card,,2024-11-14,46,Thursday
02/10/2024 19:02:00,02/10/2024 19:02,Deepa,9254231988,,Facial,De-tan,,Manicure,,,Massage,Threading,,Miscellaneous,1560,Malar,PhonePe,,2024-10-02,40,Wednesday
05/10/2024 16:05:00,05/10/2024 16:05,Aishwarya,9657099842,Waxing,Facial,De-tan,Pedicure,Manicure,,,Massage,,,Miscellaneous,368,Pinky,GPay,Malar,2024-10-05,40,Saturday
23/08/2024 13:05:00,23/08/2024 13:05,Sandhya,9216479916,,,De-tan,Pedicure,Manicure,Bleaching,Wash,Massage,Threading,Hair Cut,,2445,Suganya Sri,PhonePe,Pinky,2024-08-23,34,Friday
21/09/2024 13:54:00,21/09/2024 13:54,Divya,9236010577,Waxing,Facial,,,Manicure,,Wash,,,,,2098,Suganya Sri,PhonePe,Poornima,2024-09-21,38,Saturday
04/11/2024 19:59:00,04/11/2024 19:59,Divya,9642081141,,Facial,,,Manicure,Bleaching,Wash,,Threading,Hair Cut,Miscellaneous,1177,Pinky,GPay,,2024-11-04,45,Monday
11/11/2024 16:40:00,11/11/2024 16:40,Priya,9845550366,Waxing,,,Pedicure,Manicure,Bleaching,Wash,,,Hair Cut,,188,Suganya Sri,GPay,,2024-11-11,46,Monday
20/10/2024 14:18:00,20/10/2024 14:18,Priya,9218731058,,,,,Manicure,Bleaching,Wash,,,,,990,Suganya Sri,PhonePe,Poornima,2024-10-20,42,Sunday
29/10/2024 15:01:00,29/10/2024 15:01,Shruthi,9306052536,,,De-tan,,Manicure,Bleaching,,Massage,Threading,,,2429,Poornima,Cash,,2024-10-29,44,Tuesday
18/10/2024 18:42:00,18/10/2024 18:42,Sangeetha,9565208946,Waxing,,,,,Bleaching,,Massage,,Hair Cut,Miscellaneous,2969,Suganya Sri,Cash,Poornima,2024-10-18,42,Friday
10/10/2024 20:22:00,10/10/2024 20:22,Anjali,9680503976,,,,,,Bleaching,Wash,,Threading,Hair Cut,,390,Malar,GPay,,2024-10-10,41,Thursday
28/10/2024 11:37:00,28/10/2024 11:37,Anjali,9724909740,,Facial,,Pedicure,,,Wash,Massage,,,Miscellaneous,515,Suganya Sri,GPay,Anjali,2024-10-28,44,Monday
10/11/2024 15:55:00,10/11/2024 15:55,Kavya,9848258899,,Facial,De-tan,,,Bleaching,,,Threading,Hair Cut,Miscellaneous,2365,Anjali,Cash,,2024-11-10,45,Sunday
10/10/2024 20:30:00,10/10/2024 20:30,Aishwarya,9660318309,Waxing,Facial,,,Manicure,,,Massage,Threading,,,2945,Pinky,GPay,Malar,2024-10-10,41,Thursday
29/10/2024 19:38:00,29/10/2024 19:38,Meena,9365230780,Waxing,Facial,De-tan,Pedicure,Manicure,,,Massage,Threading,,Miscellaneous,3184,Pinky,Card,Suganya Sri,2024-10-29,44,Tuesday
04/11/2024 13:12:00,04/11/2024 13:12,Meena,9364555444,,Facial,De-tan,,,,Wash,Massage,,Hair Cut,Miscellaneous,1682,Poornima,Cash,Poornima,2024-11-04,45,Monday
29/08/2024 11:28:00,29/08/2024 11:28,Latha,9307968383,,,De-tan,Pedicure,Manicure,,Wash,,Threading,Hair Cut,Miscellaneous,2451,Poornima,PhonePe,Pinky,2024-08-29,35,Thursday
02/11/2024 17:54:00,02/11/2024 17:54,Shruthi,9450236670,,Facial,De-tan,,Manicure,Bleaching,Wash,,Threading,Hair Cut,,2056,Anjali,PhonePe,,2024-11-02,44,Saturday
04/11/2024 14:09:00,04/11/2024 14:09,Divya,9818349420,,,De-tan,Pedicure,,,,Massage,Threading,,Miscellaneous,1312,Anjali,Cash,,2024-11-04,45,Monday
21/09/2024 16:44:00,21/09/2024 16:44,Ranjani,9730110788,,,,,,,Wash,Massage,Threading,,,2412,Pinky,Card,,2024-09-21,38,Saturday
13/10/2024 10:11:00,13/10/2024 10:11,Kavya,9931929952,Waxing,Facial,,,,Bleaching,Wash,Massage,,Hair Cut,Miscellaneous,1426,Anjali,PhonePe,Pinky,2024-10-13,41,Sunday
17/11/2024 11:29:00,17/11/2024 11:29,Sandhya,9283961330,Waxing,,De-tan,Pedicure,,Bleaching,Wash,Massage,,Hair Cut,Miscellaneous,2388,Suganya Sri,GPay,,2024-11-17,46,Sunday
04/09/2024 17:10:00,04/09/2024 17:10,Nisha,9838629550,Waxing,Facial,,,,Bleaching,Wash,Massage,Threading,Hair Cut,Miscellaneous,600,Malar,GPay,,2024-09-04,36,Wednesday
16/11/2024 10:16:00,16/11/2024 10:16,Sandhya,9784621527,,,De-tan,,Manicure,Bleaching,,Massage,Threading,Hair Cut,,2626,Poornima,Card,,2024-11-16,46,Saturday
11/09/2024 18:39:00,11/09/2024 18:39,Sandhya,9771088020,,Facial,De-tan,,,,,Massage,,Hair Cut,Miscellaneous,2055,Poornima,Cash,,2024-09-11,37,Wednesday
25/08/2024 20:57:00,25/08/2024 20:57,Nisha,9376017859,,,De-tan,Pedicure,Manicure,,,,Threading,Hair Cut,Miscellaneous,2708,Malar,PhonePe,Pinky,2024-08-25,34,Sunday
19/09/2024 19:36:00,19/09/2024 19:36,Latha,9301312301,,Facial,De-tan,Pedicure,,,,Massage,Threading,,Miscellaneous,2305,Anjali,Cash,,2024-09-19,38,Thursday
13/10/2024 18:28:00,13/10/2024 18:28,Soumya,9319559491,Waxing,Facial,De-tan,,,Bleaching,Wash,Massage,,,Miscellaneous,506,Pinky,Card,,2024-10-13,41,Sunday
06/11/2024 10:31:00,06/11/2024 10:31,Deepa,9670511674,Waxing,Facial,De-tan,Pedicure,Manicure,Bleaching,Wash,,,Hair Cut,,2774,Anjali,GPay,,2024-11-06,45,Wednesday
03/10/2024 12:18:00,03/10/2024 12:18,Ranjani,9251466192,,,De-tan,Pedicure,Manicure,Bleaching,Wash,,,Hair Cut,,675,Pinky,GPay,Anjali,2024-10-03,40,Thursday
14/09/2024 19:58:00,14/09/2024 19:58,Ranjani,9780176841,Waxing,Facial,,Pedicure,,,,,,,Miscellaneous,194,Poornima,Card,Malar,2024-09-14,37,Saturday
02/10/2024 13:12:00,02/10/2024 13:12,Ranjani,9982054828,,Facial,De-tan,Pedicure,,,Wash,Massage,,Hair Cut,Miscellaneous,2686,Anjali,GPay,,2024-10-02,40,Wednesday
18/09/2024 16:01:00,18/09/2024 16:01,Deepa,9991500835,Waxing,Facial,,,,Bleaching,,Massage,,Hair Cut,,2481,Pinky,Card,,2024-09-18,38,Wednesday
22/10/2024 11:35:00,22/10/2024 11:35,Kavya,9638126685,Waxing,Facial,De-tan,,,Bleaching,Wash,,Threading,Hair Cut,Miscellaneous,2374,Pinky,Card,,2024-10-22,43,Tuesday
03/09/2024 19:00:00,03/09/2024 19:00,Latha,9412162427,Waxing,,,,Manicure,Bleaching,,Massage,,,,3412,Malar,Card,,2024-09-03,36,Tuesday
23/10/2024 09:57:00,23/10/2024 09:57,Priya,9290499407,,Facial,De-tan,,,,,,Threading,,,3239,Malar,Cash,,2024-10-23,43,Wednesday
16/10/2024 14:45:00,16/10/2024 14:45,Soumya,9272417903,,,De-tan,,,,Wash,,Threading,,,969,Poornima,PhonePe,Poornima,2024-10-16,42,Wednesday
15/10/2024 15:58:00,15/10/2024 15:58,Latha,9990275149,Waxing,Facial,,,Manicure,Bleaching,,Massage,Threading,,Miscellaneous,2346,Malar,PhonePe,,2024-10-15,42,Tuesday
17/11/2024 12:50:00,17/11/2024 12:50,Meena,9394947945,Waxing,Facial,,,Manicure,,Wash,,Threading,,Miscellaneous,462,Poornima,PhonePe,,2024-11-17,46,Sunday
31/08/2024 15:01:00,31/08/2024 15:01,Divya,9226977481,,Facial,,Pedicure,,,Wash,Massage,,Hair Cut,Miscellaneous,3082,Malar,Cash,,2024-08-31,35,Saturday
30/09/2024 14:57:00,30/09/2024 14:57,Keerthana,9160637007,,Facial,,Pedicure,,Bleaching,,Massage,Threading,Hair Cut,Miscellaneous,651,Poornima,Cash,Suganya Sri,2024-09-30,40,Monday
10/09/2024 19:21:00,10/09/2024 19:21,Keerthana,9502396311,Waxing,Facial,,Pedicure,Manicure,,,Massage,Threading,Hair Cut,Miscellaneous,2910,Pinky,PhonePe,,2024-09-10,37,Tuesday
02/11/2024 15:37:00,02/11/2024 15:37,Shruthi,9542808301,Waxing,Facial,De-tan,Pedicure,Manicure,,,,,,Miscellaneous,2091,Suganya Sri,Card,,2024-11-02,44,Saturday
03/11/2024 11:29:00,03/11/2024 11:29,Keerthana,9525351039,,Facial,,Pedicure,,,Wash,,Threading,,Miscellaneous,3130,Suganya Sri,Cash,,2024-11-03,44,Sunday
22/10/2024 17:29:00,22/10/2024 17:29,Deepa,9516266130,Waxing,,De-tan,,Manicure,,Wash,Massage,Threading,,Miscellaneous,590,Poornima,Cash,Pinky,2024-10-22,43,Tuesday
22/08/2024 13:53:00,22/08/2024 13:53,Divya,9743245366,,,,Pedicure,,Bleaching,,Massage,,,,987,Pinky,Cash,Pinky,2024-08-22,34,Thursday
10/11/2024 19:30:00,10/11/2024 19:30,Priya,9501149878,,,De-tan,Pedicure,,Bleaching,,Massage,,,Miscellaneous,1515,Anjali,PhonePe,,2024-11-10,45,Sunday
21/09/2024 20:32:00,21/09/2024 20:32,Divya,9656986808,Waxing,,De-tan,,Manicure,,Wash,Massage,Threading,,,919,Anjali,Card,Malar,2024-09-21,38,Saturday
07/11/2024 18:22:00,07/11/2024 18:22,Sangeetha,9443117237,Waxing,Facial,,Pedicure,Manicure,,,Massage,,,Miscellaneous,983,Pinky,Cash,,2024-11-07,45,Thursday
08/10/2024 19:49:00,08/10/2024 19:49,Latha,9135931684,,Facial,De-tan,,Manicure,Bleaching,Wash,Massage,Threading,,Miscellaneous,257,Pinky,PhonePe,,2024-10-08,41,Tuesday
05/10/2024 18:01:00,05/10/2024 18:01,Anjali,9557586975,Waxing,,De-tan,Pedicure,,Bleaching,,,,,,1381,Pinky,PhonePe,Poornima,2024-10-05,40,Saturday
07/10/2024 17:23:00,07/10/2024 17:23,Harini,9358739835,,Facial,De-tan,,,,Wash,Massage,Threading,,,2711,Malar,Cash,Malar,2024-10-07,41,Monday
05/09/2024 15:20:00,05/09/2024 15:20,Kavya,9258159327,,Facial,,Pedicure,Manicure,Bleaching,Wash,,Threading,,,559,Malar,PhonePe,,2024-09-05,36,Thursday
15/11/2024 18:20:00,15/11/2024 18:20,Anjali,9330945577,Waxing,Facial,De-tan,Pedicure,Manicure,,,Massage,,Hair Cut,,2553,Malar,Card,Poornima,2024-11-15,46,Friday
21/10/2024 18:33:00,21/10/2024 18:33,Sangeetha,9615334201,Waxing,,De-tan,Pedicure,,Bleaching,Wash,Massage,,,,1783,Anjali,Card,Pinky,2024-10-21,43,Monday
26/09/2024 20:48:00,26/09/2024 20:48,Priya,9164576181,,Facial,,Pedicure,,,,,,Hair Cut,,2462,Malar,Card,Pinky,2024-09-26,39,Thursday
16/11/2024 15:53:00,16/11/2024 15:53,Anjali,9431573127,Waxing,Facial,,,Manicure,,Wash,,Threading,,Miscellaneous,2320,Malar,GPay,,2024-11-16,46,Saturday
28/08/2024 12:36:00,28/08/2024 12:36,Deepa,9544245349,,Facial,,,,Bleaching,,,,,Miscellaneous,429,Pinky,Cash,Pinky,2024-08-28,35,Wednesday
17/09/2024 18:41:00,17/09/2024 18:41,Keerthana,9416723284,,,De-tan,,Manicure,Bleaching,Wash,Massage,,Hair Cut,Miscellaneous,1771,Anjali,Cash,Anjali,2024-09-17,38,Tuesday
16/10/2024 20:22:00,16/10/2024 20:22,Deepa,9286079241,,,De-tan,Pedicure,,Bleaching,,,,Hair Cut,,886,Anjali,Card,,2024-10-16,42,Wednesday
04/09/2024 17:05:00,04/09/2024 17:05,Swathi,9457147176,Waxing,,,,Manicure,,,,,,Miscellaneous,3054,Suganya Sri,GPay,Malar,2024-09-04,36,Wednesday
29/08/2024 19:57:00,29/08/2024 19:57,Keerthana,9274223777,Waxing,,De-tan,Pedicure,,,Wash,,,Hair Cut,,2713,Poornima,GPay,,2024-08-29,35,Thursday
10/09/2024 16:28:00,10/09/2024 16:28,Harini,9963565440,Waxing,Facial,De-tan,,Manicure,,Wash,Massage,Threading,Hair Cut,Miscellaneous,2462,Suganya Sri,PhonePe,,2024-09-10,37,Tuesday
10/09/2024 11:51:00,10/09/2024 11:51,Anjali,9777213523,Waxing,Facial,De-tan,,,,,Massage,,Hair Cut,,1559,Suganya Sri,GPay,Poornima,2024-09-10,37,Tuesday
01/10/2024 19:32:00,01/10/2024 19:32,Aishwarya,9989480371,,Facial,,Pedicure,,Bleaching,Wash,Massage,,Hair Cut,,2876,Poornima,Cash,,2024-10-01,40,Tuesday
14/09/2024 17:23:00,14/09/2024 17:23,Ranjani,9854915835,Waxing,,,Pedicure,Manicure,,,,,,,477,Suganya Sri,Cash,,2024-09-14,37,Saturday
16/10/2024 11:09:00,16/10/2024 11:09,Kavya,9133707852,,,De-tan,Pedicure,Manicure,,,Massage,,Hair Cut,Miscellaneous,389,Malar,PhonePe,Poornima,2024-10-16,42,Wednesday
16/09/2024 18:11:00,16/09/2024 18:11,Keerthana,9667862669,,,De-tan,,,Bleaching,Wash,,Threading,Hair Cut,Miscellaneous,3141,Suganya Sri,PhonePe,,2024-09-16,38,Monday
03/11/2024 19:13:00,03/11/2024 19:13,Aishwarya,9740210669,Waxing,,De-tan,,Manicure,,,Massage,,,Miscellaneous,2999,Malar,PhonePe,,2024-11-03,44,Sunday
26/08/2024 18:52:00,26/08/2024 18:52,Ranjani,9487416354,Waxing,Facial,,Pedicure,Manicure,Bleaching,Wash,,,,,353,Poornima,PhonePe,,2024-08-26,35,Monday
25/10/2024 13:24:00,25/10/2024 13:24,Deepa,9417530116,Waxing,,De-tan,,,,,,,Hair Cut,,392,Suganya Sri,Card,Anjali,2024-10-25,43,Friday
26/10/2024 15:21:00,26/10/2024 15:21,Aishwarya,9549798157,,,De-tan,Pedicure,Manicure,Bleaching,,Massage,Threading,Hair Cut,,3012,Poornima,Cash,,2024-10-26,43,Saturday
10/09/2024 11:37:00,10/09/2024 11:37,Shruthi,9905979865,,Facial,,,Manicure,,Wash,Massage,Threading,,,1244,Poornima,PhonePe,,2024-09-10,37,Tuesday
20/11/2024 16:04:00,20/11/2024 16:04,Nisha,9791105648,Waxing,Facial,,,,Bleaching,,,,,,562,Suganya Sri,Card,,2024-11-20,47,Wednesday
11/09/2024 14:15:00,11/09/2024 14:15,Ranjani,9912880005,Waxing,Facial,,Pedicure,Manicure,,Wash,,,Hair Cut,Miscellaneous,945,Malar,GPay,Pinky,2024-09-11,37,Wednesday
04/09/2024 19:26:00,04/09/2024 19:26,Swathi,9102001729,,,De-tan,Pedicure,,,Wash,Massage,,,,1691,Poornima,GPay,,2024-09-04,36,Wednesday
05/09/2024 17:20:00,05/09/2024 17:20,Aishwarya,9304091885,,Facial,,Pedicure,,,Wash,,,,,1530,Suganya Sri,Card,,2024-09-05,36,Thursday
23/09/2024 14:39:00,23/09/2024 14:39,Keerthana,9918751451,,Facial,,,,Bleaching,Wash,Massage,Threading,Hair Cut,Miscellaneous,1060,Malar,Cash,Pinky,2024-09-23,39,Monday
07/09/2024 13:32:00,07/09/2024 13:32,Harini,9466258631,,,De-tan,Pedicure,,,Wash,Massage,Threading,,Miscellaneous,2422,Poornima,Card,Suganya Sri,2024-09-07,36,Saturday
11/09/2024 11:33:00,11/09/2024 11:33,Kavya,9797606598,,Facial,De-tan,,,Bleaching,,Massage,Threading,Hair Cut,,2715,Suganya Sri,Card,,2024-09-11,37,Wednesday
12/11/2024 11:26:00,12/11/2024 11:26,Swathi,9498340044,Waxing,,De-tan,Pedicure,,Bleaching,,,,Hair Cut,,1548,Pinky,Card,,2024-11-12,46,Tuesday
08/09/2024 19:17:00,08/09/2024 19:17,Shruthi,9480616373,,,De-tan,,,Bleaching,,Massage,,,,2759,Anjali,GPay,Pinky,2024-09-08,36,Sunday
31/10/2024 18:17:00,31/10/2024 18:17,Ranjani,9257720562,Waxing,Facial,De-tan,Pedicure,Manicure,Bleaching,Wash,Massage,Threading,,Miscellaneous,3116,Pinky,Card,,2024-10-31,44,Thursday
01/09/2024 11:46:00,01/09/2024 11:46,Divya,9638291672,Waxing,,,,,Bleaching,,Massage,Threading,Hair Cut,,2767,Pinky,PhonePe,,2024-09-01,35,Sunday
18/10/2024 19:39:00,18/10/2024 19:39,Meena,9718778128,Waxing,,De-tan,,,Bleaching,Wash,Massage,,,Miscellaneous,2482,Suganya Sri,Card,Malar,2024-10-18,42,Friday
24/09/2024 17:14:00,24/09/2024 17:14,Priya,9530806421,Waxing,,De-tan,,,Bleaching,,,Threading,Hair Cut,Miscellaneous,3197,Pinky,Card,,2024-09-24,39,Tuesday
12/09/2024 13:19:00,12/09/2024 13:19,Aishwarya,9888312365,Waxing,,,,Manicure,Bleaching,Wash,Massage,Threading,Hair Cut,,2391,Pinky,Card,,2024-09-12,37,Thursday
16/11/2024 15:57:00,16/11/2024 15:57,Ranjani,9375457544,Waxing,Facial,,,,Bleaching,Wash,,Threading,,,1013,Malar,PhonePe,Pinky,2024-11-16,46,Saturday
03/11/2024 09:45:00,03/11/2024 09:45,Aishwarya,9655518022,,Facial,De-tan,Pedicure,,,,Massage,,,,2595,Pinky,Card,,2024-11-03,44,Sunday
31/08/2024 14:51:00,31/08/2024 14:51,Divya,9987612102,Waxing,,De-tan,,,Bleaching,Wash,Massage,,,Miscellaneous,700,Poornima,PhonePe,,2024-08-31,35,Saturday
16/09/2024 17:46:00,16/09/2024 17:46,Deepa,9409940378,,Facial,De-tan,Pedicure,Manicure,Bleaching,,,Threading,,,2670,Poornima,PhonePe,Suganya Sri,2024-09-16,38,Monday
25/09/2024 14:06:00,25/09/2024 14:06,Divya,9684433820,,Facial,De-tan,,Manicure,Bleaching,,,Threading,,,2363,Suganya Sri,GPay,Suganya Sri,2024-09-25,39,Wednesday
24/08/2024 11:01:00,24/08/2024 11:01,Shruthi,9965658498,Waxing,,De-tan,Pedicure,Manicure,Bleaching,Wash,,,Hair Cut,,509,Poornima,Cash,Anjali,2024-08-24,34,Saturday
04/10/2024 12:36:00,04/10/2024 12:36,Kavya,9506828994,Waxing,,,,Manicure,Bleaching,,Massage,Threading,Hair Cut,Miscellaneous,2555,Pinky,GPay,Malar,2024-10-04,40,Friday
20/09/2024 14:26:00,20/09/2024 14:26,Nisha,9244710994,Waxing,,,,,Bleaching,,,Threading,,,2441,Anjali,PhonePe,Poornima,2024-09-20,38,Friday
26/10/2024 10:56:00,26/10/2024 10:56,Deepa,9263410660,,Facial,De-tan,Pedicure,,Bleaching,Wash,Massage,Threading,,Miscellaneous,457,Malar,GPay,,2024-10-26,43,Saturday
08/10/2024 16:19:00,08/10/2024 16:19,Aishwarya,9417513091,Waxing,Facial,De-tan,,,Bleaching,,Massage,Threading,Hair Cut,,3001,Anjali,GPay,,2024-10-08,41,Tuesday
04/10/2024 17:33:00,04/10/2024 17:33,Anjali,9523847468,Waxing,Facial,De-tan,,Manicure,,Wash,Massage,Threading,,,707,Malar,GPay,Suganya Sri,2024-10-04,40,Friday
29/09/2024 15:06:00,29/09/2024 15:06,Kavya,9568822189,Waxing,Facial,De-tan,Pedicure,Manicure,,,,Threading,Hair Cut,,2913,Poornima,GPay,Pinky,2024-09-29,39,Sunday
07/11/2024 11:00:00,07/11/2024 11:00,Harini,9437561133,,Facial,De-tan,,,,Wash,,,Hair Cut,Miscellaneous,883,Pinky,PhonePe,,2024-11-07,45,Thursday
18/09/2024 16:18:00,18/09/2024 16:18,Divya,9663100254,Waxing,Facial,,Pedicure,Manicure,,Wash,Massage,,Hair Cut,,3320,Poornima,PhonePe,Pinky,2024-09-18,38,Wednesday
24/08/2024 09:35:00,24/08/2024 09:35,Shruthi,9345288942,Waxing,,,Pedicure,,Bleaching,Wash,Massage,Threading,Hair Cut,,3063,Malar,GPay,Pinky,2024-08-24,34,Saturday
07/09/2024 19:36:00,07/09/2024 19:36,Harini,9615950009,,,,,Manicure,,Wash,,Threading,Hair Cut,,2234,Pinky,Card,,2024-09-07,36,Saturday
20/10/2024 15:03:00,20/10/2024 15:03,Deepa,9154605406,Waxing,,De-tan,,,,,,,Hair Cut,,2803,Poornima,Card,Malar,2024-10-20,42,Sunday
09/11/2024 17:21:00,09/11/2024 17:21,Ranjani,9781274174,,Facial,De-tan,,,,,Massage,,,,3038,Malar,GPay,,2024-11-09,45,Saturday
23/10/2024 13:35:00,23/10/2024 13:35,Soumya,9971817054,Waxing,Facial,De-tan,Pedicure,,,,Massage,,,,2853,Suganya Sri,GPay,,2024-10-23,43,Wednesday
07/10/2024 18:44:00,07/10/2024 18:44,Soumya,9528769881,,,,Pedicure,,Bleaching,Wash,,Threading,,Miscellaneous,3062,Suganya Sri,Card,Suganya Sri,2024-10-07,41,Monday
05/10/2024 18:43:00,05/10/2024 18:43,Harini,9717015730,Waxing,,De-tan,,Manicure,Bleaching,,,,,,818,Anjali,Card,Malar,2024-10-05,40,Saturday
07/09/2024 09:54:00,07/09/2024 09:54,Harini,9689772649,Waxing,,De-tan,,,,,Massage,Threading,Hair Cut,,548,Suganya Sri,Cash,,2024-09-07,36,Saturday
05/09/2024 20:07:00,05/09/2024 20:07,Sandhya,9510599278,,,,,Manicure,Bleaching,Wash,Massage,,Hair Cut,,753,Anjali,PhonePe,Malar,2024-09-05,36,Thursday
05/09/2024 17:19:00,05/09/2024 17:19,Swathi,9609106609,,,De-tan,,Manicure,Bleaching,Wash,,,Hair Cut,Miscellaneous,302,Poornima,Cash,Suganya Sri,2024-09-05,36,Thursday
05/10/2024 18:01:00,05/10/2024 18:01,Kavya,9939778860,,,De-tan,,Manicure,Bleaching,Wash,Massage,Threading,,Miscellaneous,3311,Suganya Sri,Cash,,2024-10-05,40,Saturday
24/09/2024 18:53:00,24/09/2024 18:53,Meena,9644693168,,Facial,De-tan,,,Bleaching,,,Threading,,,1190,Suganya Sri,Card,Malar,2024-09-24,39,Tuesday
06/09/2024 17:33:00,06/09/2024 17:33,Keerthana,9830303114,Waxing,,,,Manicure,,Wash,Massage,Threading,,Miscellaneous,893,Malar,Card,,2024-09-06,36,Friday
27/10/2024 12:48:00,27/10/2024 12:48,Sangeetha,9124645386,Waxing,,De-tan,Pedicure,,Bleaching,Wash,Massage,,,,1705,Poornima,Card,,2024-10-27,43,Sunday
10/11/2024 13:19:00,10/11/2024 13:19,Shruthi,9446790813,,Facial,,,Manicure,,,Massage,,,,708,Suganya Sri,PhonePe,Pinky,2024-11-10,45,Sunday
25/10/2024 16:55:00,25/10/2024 16:55,Deepa,9676450468,Waxing,,De-tan,Pedicure,Manicure,,,,Threading,Hair Cut,Miscellaneous,3181,Suganya Sri,GPay,Suganya Sri,2024-10-25,43,Friday
15/09/2024 18:10:00,15/09/2024 18:10,Anjali,9742597502,,,,,,Bleaching,Wash,Massage,Threading,Hair Cut,Miscellaneous,442,Pinky,Card,,2024-09-15,37,Sunday
23/10/2024 20:14:00,23/10/2024 20:14,Kavya,9343277843,Waxing,Facial,,Pedicure,Manicure,Bleaching,,,Threading,,Miscellaneous,988,Anjali,Card,Anjali,2024-10-23,43,Wednesday
24/10/2024 17:28:00,24/10/2024 17:28,Harini,9206406970,,,,,,Bleaching,,Massage,Threading,,,3248,Poornima,Cash,Poornima,2024-10-24,43,Thursday
08/11/2024 17:18:00,08/11/2024 17:18,Sandhya,9158529157,Waxing,,,,,Bleaching,,,Threading,Hair Cut,Miscellaneous,1922,Suganya Sri,PhonePe,,2024-11-08,45,Friday
18/11/2024 15:52:00,18/11/2024 15:52,Aishwarya,9780412855,,Facial,,,Manicure,,Wash,Massage,Threading,Hair Cut,,2735,Poornima,PhonePe,Poornima,2024-11-18,47,Monday
07/10/2024 20:26:00,07/10/2024 20:26,Meena,9675530821,,Facial,De-tan,Pedicure,Manicure,Bleaching,,Massage,,Hair Cut,Miscellaneous,2723,Suganya Sri,PhonePe,Poornima,2024-10-07,41,Monday
09/10/2024 20:05:00,09/10/2024 20:05,Nisha,9580452239,Waxing,Facial,,,,,Wash,,,,,2021,Malar,Cash,Poornima,2024-10-09,41,Wednesday
05/10/2024 18:31:00,05/10/2024 18:31,Priya,9370539046,,,De-tan,Pedicure,Manicure,,,,,,Miscellaneous,242,Malar,Cash,,2024-10-05,40,Saturday
20/10/2024 09:39:00,20/10/2024 09:39,Meena,9158197008,,,,Pedicure,,,Wash,,,,Miscellaneous,1916,Malar,GPay,Pinky,2024-10-20,42,Sunday
04/11/2024 14:42:00,04/11/2024 14:42,Kavya,9134388351,Waxing,,,,Manicure,Bleaching,,Massage,Threading,Hair Cut,Miscellaneous,1367,Poornima,Card,,2024-11-04,45,Monday
14/11/2024 19:36:00,14/11/2024 19:36,Kavya,9616149324,,Facial,,Pedicure,,Bleaching,,Massage,,Hair Cut,Miscellaneous,962,Anjali,Card,,2024-11-14,46,Thursday
07/10/2024 17:46:00,07/10/2024 17:46,Soumya,9806120192,,,De-tan,Pedicure,Manicure,Bleaching,,,Threading,,,2982,Pinky,Cash,,2024-10-07,41,Monday
09/10/2024 17:16:00,09/10/2024 17:16,Soumya,9737523643,,Facial,De-tan,,,,Wash,Massage,Threading,,,1782,Suganya Sri,Cash,Malar,2024-10-09,41,Wednesday
21/10/2024 17:20:00,21/10/2024 17:20,Anjali,9806913420,,,De-tan,Pedicure,Manicure,,,Massage,Threading,,Miscellaneous,1619,Poornima,Cash,Malar,2024-10-21,43,Monday
12/11/2024 10:27:00,12/11/2024 10:27,Harini,9554337053,,,,Pedicure,Manicure,,,Massage,Threading,,,2267,Pinky,PhonePe,,2024-11-12,46,Tuesday
21/09/2024 14:43:00,21/09/2024 14:43,Aishwarya,9214998923,Waxing,Facial,,Pedicure,,,Wash,,,,Miscellaneous,249,Suganya Sri,PhonePe,Anjali,2024-09-21,38,Saturday
02/10/2024 15:59:00,02/10/2024 15:59,Nisha,9750054571,,Facial,De-tan,Pedicure,,,,Massage,,Hair Cut,,1146,Malar,Cash,Poornima,2024-10-02,40,Wednesday
07/11/2024 09:05:00,07/11/2024 09:05,Harini,9652855937,,Facial,De-tan,,,,Wash,,Threading,Hair Cut,Miscellaneous,214,Malar,Cash,,2024-11-07,45,Thursday
28/10/2024 11:40:00,28/10/2024 11:40,Meena,9320652447,,Facial,,Pedicure,,Bleaching,,,,Hair Cut,Miscellaneous,2853,Poornima,Card,Suganya Sri,2024-10-28,44,Monday
30/08/2024 19:09:00,30/08/2024 19:09,Deepa,9867981206,,Facial,De-tan,,Manicure,,Wash,Massage,Threading,,,864,Malar,PhonePe,Anjali,2024-08-30,35,Friday
24/08/2024 10:28:00,24/08/2024 10:28,Anjali,9310661808,Waxing,Facial,,,Manicure,Bleaching,Wash,,,,,3096,Pinky,PhonePe,,2024-08-24,34,Saturday
30/08/2024 11:15:00,30/08/2024 11:15,Ranjani,9711232478,Waxing,Facial,De-tan,Pedicure,,Bleaching,Wash,Massage,Threading,,Miscellaneous,1697,Suganya Sri,PhonePe,,2024-08-30,35,Friday
03/09/2024 17:11:00,03/09/2024 17:11,Anjali,9144390171,Waxing,Facial,De-tan,Pedicure,Manicure,Bleaching,Wash,Massage,Threading,,,673,Pinky,PhonePe,Poornima,2024-09-03,36,Tuesday
24/09/2024 16:31:00,24/09/2024 16:31,Aishwarya,9979050032,Waxing,,,,,,,Massage,Threading,,,1794,Pinky,Cash,Suganya Sri,2024-09-24,39,Tuesday
04/09/2024 13:53:00,04/09/2024 13:53,Harini,9666936513,Waxing,,De-tan,,Manicure,Bleaching,,Massage,Threading,,,2343,Malar,Cash,Suganya Sri,2024-09-04,36,Wednesday
26/09/2024 17:21:00,26/09/2024 17:21,Divya,9524834320,,,,,Manicure,Bleaching,,Massage,,,,1099,Poornima,Card,Pinky,2024-09-26,39,Thursday
11/10/2024 20:04:00,11/10/2024 20:04,Meena,9973505117,,Facial,De-tan,Pedicure,Manicure,,Wash,,,Hair Cut,Miscellaneous,1863,Suganya Sri,GPay,,2024-10-11,41,Friday
26/08/2024 09:57:00,26/08/2024 09:57,Sandhya,9728258617,,,,Pedicure,,,,Massage,,Hair Cut,Miscellaneous,808,Anjali,GPay,Poornima,2024-08-26,35,Monday
17/09/2024 15:23:00,17/09/2024 15:23,Sangeetha,9987875795,Waxing,Facial,,,,Bleaching,,,,,,1988,Anjali,PhonePe,,2024-09-17,38,Tuesday
18/09/2024 14:49:00,18/09/2024 14:49,Deepa,9228196374,,Facial,De-tan,,Manicure,Bleaching,Wash,,,,Miscellaneous,3498,Anjali,GPay,,2024-09-18,38,Wednesday
15/10/2024 20:08:00,15/10/2024 20:08,Shruthi,9856566058,Waxing,Facial,De-tan,Pedicure,Manicure,Bleaching,,,,,,206,Suganya Sri,GPay,,2024-10-15,42,Tuesday
05/11/2024 10:18:00,05/11/2024 10:18,Deepa,9223879264,Waxing,Facial,,Pedicure,Manicure,Bleaching,,Massage,Threading,,,1060,Pinky,GPay,Anjali,2024-11-05,45,Tuesday
16/10/2024 12:04:00,16/10/2024 12:04,Priya,9973461100,Waxing,Facial,,,,,,Massage,,,Miscellaneous,643,Anjali,Cash,,2024-10-16,42,Wednesday
11/11/2024 16:07:00,11/11/2024 16:07,Harini,9802950366,,,,,Manicure,,,,Threading,Hair Cut,Miscellaneous,1538,Poornima,GPay,,2024-11-11,46,Monday
27/08/2024 11:25:00,27/08/2024 11:25,Swathi,9773807829,Waxing,,De-tan,,Manicure,,,,,,Miscellaneous,1644,Pinky,GPay,Anjali,2024-08-27,35,Tuesday
07/11/2024 11:55:00,07/11/2024 11:55,Anjali,9478723884,Waxing,,,,,Bleaching,Wash,Massage,,Hair Cut,,1573,Suganya Sri,Cash,,2024-11-07,45,Thursday
27/09/2024 14:00:00,27/09/2024 14:00,Anjali,9243912451,Waxing,,,,Manicure,Bleaching,Wash,Massage,Threading,,Miscellaneous,2992,Pinky,PhonePe,Pinky,2024-09-27,39,Friday
17/10/2024 14:44:00,17/10/2024 14:44,Ranjani,9560170579,Waxing,,,,,Bleaching,,Massage,Threading,Hair Cut,,1901,Anjali,Card,,2024-10-17,42,Thursday
02/11/2024 12:14:00,02/11/2024 12:14,Divya,9467517811,,Facial,De-tan,Pedicure,Manicure,,,,,,Miscellaneous,2579,Pinky,GPay,,2024-11-02,44,Saturday
04/09/2024 09:08:00,04/09/2024 09:08,Nisha,9286933865,,Facial,De-tan,Pedicure,Manicure,,Wash,,Threading,,Miscellaneous,698,Pinky,PhonePe,Poornima,2024-09-04,36,Wednesday
19/09/2024 15:49:00,19/09/2024 15:49,Kavya,9804725084,Waxing,,De-tan,,Manicure,Bleaching,Wash,Massage,,Hair Cut,,2193,Anjali,Card,Suganya Sri,2024-09-19,38,Thursday
14/09/2024 12:48:00,14/09/2024 12:48,Sandhya,9192363264,,Facial,De-tan,Pedicure,Manicure,Bleaching,Wash,,,,Miscellaneous,2340,Suganya Sri,PhonePe,,2024-09-14,37,Saturday
06/09/2024 12:34:00,06/09/2024 12:34,Anjali,9876891015,Waxing,Facial,,,,Bleaching,Wash,Massage,Threading,Hair Cut,,276,Anjali,Card,,2024-09-06,36,Friday
16/10/2024 20:49:00,16/10/2024 20:49,Nisha,9211715644,Waxing,,De-tan,Pedicure,,Bleaching,,,Threading,Hair Cut,Miscellaneous,990,Malar,Cash,Anjali,2024-10-16,42,Wednesday
10/09/2024 16:47:00,10/09/2024 16:47,Divya,9719117217,Waxing,,,,,,,Massage,Threading,,,1686,Poornima,GPay,,2024-09-10,37,Tuesday
03/09/2024 11:19:00,03/09/2024 11:19,Divya,9455588465,Waxing,Facial,De-tan,Pedicure,Manicure,Bleaching,,,Threading,,Miscellaneous,3285,Malar,Card,Suganya Sri,2024-09-03,36,Tuesday
19/11/2024 09:57:00,19/11/2024 09:57,Soumya,9774886099,,,,Pedicure,,Bleaching,,,Threading,,Miscellaneous,2918,Suganya Sri,PhonePe,Suganya Sri,2024-11-19,47,Tuesday
17/11/2024 12:11:00,17/11/2024 12:11,Latha,9626822772,Waxing,Facial,De-tan,Pedicure,Manicure,,,,Threading,,,904,Poornima,PhonePe,Suganya Sri,2024-11-17,46,Sunday
22/09/2024 13:37:00,22/09/2024 13:37,Anjali,9551679589,Waxing,,De-tan,,,,Wash,,,,,2795,Anjali,Cash,,2024-09-22,38,Sunday
25/10/2024 18:00:00,25/10/2024 18:00,Ranjani,9865355012,Waxing,,De-tan,Pedicure,Manicure,,,Massage,,Hair Cut,Miscellaneous,3247,Poornima,GPay,Pinky,2024-10-25,43,Friday
23/10/2024 20:30:00,23/10/2024 20:30,Deepa,9316512284,,Facial,,Pedicure,Manicure,Bleaching,,Massage,Threading,Hair Cut,Miscellaneous,3343,Suganya Sri,PhonePe,Poornima,2024-10-23,43,Wednesday
31/08/2024 16:06:00,31/08/2024 16:06,Keerthana,9493451110,,Facial,De-tan,,Manicure,,,Massage,Threading,Hair Cut,Miscellaneous,314,Poornima,Cash,Poornima,2024-08-31,35,Saturday
28/08/2024 11:46:00,28/08/2024 11:46,Anjali,9812396919,Waxing,,De-tan,,Manicure,,,Massage,,,Miscellaneous,1239,Poornima,GPay,Suganya Sri,2024-08-28,35,Wednesday
19/11/2024 16:03:00,19/11/2024 16:03,Harini,9718306107,,Facial,,Pedicure,Manicure,Bleaching,Wash,,Threading,,Miscellaneous,3184,Malar,Card,,2024-11-19,47,Tuesday
02/10/2024 12:58:00,02/10/2024 12:58,Harini,9434873110,,,De-tan,,,Bleaching,,,,Hair Cut,,1696,Suganya Sri,PhonePe,,2024-10-02,40,Wednesday
08/11/2024 11:13:00,08/11/2024 11:13,Aishwarya,9214480798,,Facial,,,,Bleaching,Wash,,,,,1248,Suganya Sri,Card,Malar,2024-11-08,45,Friday
18/11/2024 18:21:00,18/11/2024 18:21,Divya,9957561734,,,De-tan,Pedicure,,,,,Threading,Hair Cut,,1061,Suganya Sri,PhonePe,,2024-11-18,47,Monday
08/10/2024 10:57:00,08/10/2024 10:57,Priya,9383637665,Waxing,,,,Manicure,,,,,Hair Cut,Miscellaneous,2718,Poornima,GPay,Suganya Sri,2024-10-08,41,Tuesday
03/11/2024 18:11:00,03/11/2024 18:11,Soumya,9345078948,Waxing,Facial,,,Manicure,Bleaching,Wash,,Threading,,Miscellaneous,1842,Suganya Sri,Card,Malar,2024-11-03,44,Sunday
22/10/2024 11:21:00,22/10/2024 11:21,Priya,9347407214,Waxing,,De-tan,,,,Wash,,Threading,Hair Cut,Miscellaneous,1962,Suganya Sri,Cash,,2024-10-22,43,Tuesday
08/11/2024 19:25:00,08/11/2024 19:25,Sangeetha,9451220300,,Facial,,,,Bleaching,Wash,Massage,Threading,Hair Cut,Miscellaneous,2731,Anjali,GPay,Poornima,2024-11-08,45,Friday
07/10/2024 15:15:00,07/10/2024 15:15,Aishwarya,9883513153,,,De-tan,Pedicure,Manicure,,Wash,,Threading,,Miscellaneous,1885,Suganya Sri,Card,Suganya Sri,2024-10-07,41,Monday
12/11/2024 18:37:00,12/11/2024 18:37,Soumya,9538880210,,,De-tan,,,,Wash,,,Hair Cut,,1911,Pinky,GPay,Pinky,2024-11-12,46,Tuesday
24/10/2024 14:46:00,24/10/2024 14:46,Sandhya,9857864872,Waxing,Facial,,,Manicure,,,,,Hair Cut,,3426,Suganya Sri,PhonePe,Pinky,2024-10-24,43,Thursday
29/10/2024 17:05:00,29/10/2024 17:05,Aishwarya,9119549244,,,De-tan,,,Bleaching,Wash,Massage,Threading,Hair Cut,,892,Malar,Cash,Suganya Sri,2024-10-29,44,Tuesday
24/09/2024 20:56:00,24/09/2024 20:56,Soumya,9508513690,Waxing,,,,Manicure,Bleaching,,,,Hair Cut,,2763,Pinky,PhonePe,Malar,2024-09-24,39,Tuesday
27/08/2024 18:37:00,27/08/2024 18:37,Soumya,9387107301,Waxing,,,,,Bleaching,,,,Hair Cut,,2680,Malar,GPay,,2024-08-27,35,Tuesday
24/09/2024 18:18:00,24/09/2024 18:18,Nisha,9219040824,,Facial,,Pedicure,,,,,,Hair Cut,,819,Anjali,Cash,,2024-09-24,39,Tuesday
30/08/2024 19:02:00,30/08/2024 19:02,Priya,9412409363,,Facial,,,,,,Massage,,Hair Cut,,3100,Poornima,GPay,,2024-08-30,35,Friday
07/10/2024 16:23:00,07/10/2024 16:23,Kavya,9182586408,Waxing,,De-tan,,,,,,Threading,Hair Cut,,183,Poornima,Card,Suganya Sri,2024-10-07,41,Monday
14/09/2024 09:55:00,14/09/2024 09:55,Meena,9281335404,Waxing,,,,Manicure,,,,Threading,,,2331,Poornima,Card,Anjali,2024-09-14,37,Saturday
25/08/2024 19:06:00,25/08/2024 19:06,Deepa,9296896043,Waxing,Facial,De-tan,,,,Wash,Massage,,Hair Cut,Miscellaneous,3009,Suganya Sri,Cash,Malar,2024-08-25,34,Sunday
07/09/2024 09:26:00,07/09/2024 09:26,Soumya,9880940026,Waxing,,De-tan,Pedicure,,,Wash,Massage,Threading,Hair Cut,,2237,Malar,Card,,2024-09-07,36,Saturday
05/11/2024 16:53:00,05/11/2024 16:53,Sandhya,9908489399,Waxing,,De-tan,Pedicure,,Bleaching,,Massage,,,Miscellaneous,1787,Pinky,PhonePe,,2024-11-05,45,Tuesday
26/09/2024 13:59:00,26/09/2024 13:59,Swathi,9254943272,Waxing,Facial,,Pedicure,Manicure,Bleaching,,,Threading,,,1290,Pinky,Card,,2024-09-26,39,Thursday
12/10/2024 12:53:00,12/10/2024 12:53,Soumya,9881407843,,,De-tan,,,,Wash,,,,Miscellaneous,2655,Pinky,PhonePe,Malar,2024-10-12,41,Saturday
12/10/2024 10:20:00,12/10/2024 10:20,Sangeetha,9844843966,,,,,Manicure,,,Massage,Threading,,,3191,Malar,PhonePe,,2024-10-12,41,Saturday
12/10/2024 20:03:00,12/10/2024 20:03,Deepa,9136627662,,Facial,,Pedicure,,Bleaching,,,,,Miscellaneous,277,Poornima,GPay,,2024-10-12,41,Saturday
24/08/2024 19:20:00,24/08/2024 19:20,Harini,9343062091,,,,,,,,,,,Miscellaneous,3200,Anjali,Cash,Anjali,2024-08-24,34,Saturday
05/10/2024 16:51:00,05/10/2024 16:51,Divya,9882063778,,,,,Manicure,,Wash,,Threading,Hair Cut,,2228,Pinky,Cash,Malar,2024-10-05,40,Saturday
11/10/2024 10:43:00,11/10/2024 10:43,Sangeetha,9272272411,,Facial,De-tan,Pedicure,Manicure,,,Massage,Threading,Hair Cut,,1658,Poornima,PhonePe,,2024-10-11,41,Friday
20/09/2024 14:07:00,20/09/2024 14:07,Anjali,9959922202,Waxing,,,,Manicure,Bleaching,Wash,Massage,Threading,,Miscellaneous,2841,Suganya Sri,PhonePe,Poornima,2024-09-20,38,Friday
20/10/2024 19:07:00,20/10/2024 19:07,Soumya,9707491595,,,De-tan,Pedicure,,,,,,Hair Cut,,3195,Suganya Sri,PhonePe,Pinky,2024-10-20,42,Sunday
05/09/2024 11:59:00,05/09/2024 11:59,Swathi,9404438706,,,,,,,,,,Hair Cut,,766,Pinky,Cash,Anjali,2024-09-05,36,Thursday
09/09/2024 18:38:00,09/09/2024 18:38,Harini,9674738154,Waxing,,,,,,Wash,Massage,Threading,,,2107,Pinky,Card,Anjali,2024-09-09,37,Monday
06/09/2024 10:11:00,06/09/2024 10:11,Deepa,9179658802,,Facial,De-tan,Pedicure,Manicure,,,Massage,,,,710,Anjali,PhonePe,Suganya Sri,2024-09-06,36,Friday
03/09/2024 18:46:00,03/09/2024 18:46,Sandhya,9934278178,Waxing,,De-tan,Pedicure,,Bleaching,,Massage,Threading,,,341,Poornima,GPay,Pinky,2024-09-03,36,Tuesday
25/10/2024 20:03:00,25/10/2024 20:03,Sandhya,9146335081,Waxing,Facial,,Pedicure,Manicure,Bleaching,,,,,Miscellaneous,383,Pinky,GPay,,2024-10-25,43,Friday
09/10/2024 10:11:00,09/10/2024 10:11,Sangeetha,9690833224,,,,,,Bleaching,,Massage,,,,817,Malar,PhonePe,,2024-10-09,41,Wednesday
12/11/2024 20:04:00,12/11/2024 20:04,Shruthi,9474934084,,,,,Manicure,,Wash,Massage,Threading,,Miscellaneous,1973,Anjali,Cash,Suganya Sri,2024-11-12,46,Tuesday
17/09/2024 17:38:00,17/09/2024 17:38,Latha,9484791652,Waxing,Facial,,,,Bleaching,Wash,,Threading,,Miscellaneous,2432,Pinky,Card,Suganya Sri,2024-09-17,38,Tuesday
12/09/2024 20:38:00,12/09/2024 20:38,Latha,9536844311,,Facial,,,Manicure,,Wash,,Threading,Hair Cut,Miscellaneous,2660,Suganya Sri,Cash,Pinky,2024-09-12,37,Thursday
19/10/2024 19:20:00,19/10/2024 19:20,Latha,9457866067,Waxing,Facial,De-tan,,,,Wash,Massage,,,Miscellaneous,2674,Pinky,GPay,Poornima,2024-10-19,42,Saturday
16/10/2024 14:46:00,16/10/2024 14:46,Sangeetha,9109015234,Waxing,Facial,,,Manicure,,,,,,Miscellaneous,1876,Malar,Cash,Poornima,2024-10-16,42,Wednesday
19/09/2024 09:57:00,19/09/2024 09:57,Kavya,9263089350,,,,,,,,Massage,,Hair Cut,,271,Suganya Sri,Card,,2024-09-19,38,Thursday
05/11/2024 10:32:00,05/11/2024 10:32,Harini,9707774191,Waxing,,De-tan,,Manicure,Bleaching,Wash,Massage,Threading,,,1685,Anjali,GPay,Malar,2024-11-05,45,Tuesday
12/11/2024 12:10:00,12/11/2024 12:10,Deepa,9743736477,Waxing,,,Pedicure,Manicure,Bleaching,Wash,,Threading,,,2771,Suganya Sri,Cash,,2024-11-12,46,Tuesday
17/11/2024 15:28:00,17/11/2024 15:28,Deepa,9955907635,Waxing,Facial,De-tan,,Manicure,,,,,,Miscellaneous,2820,Malar,Card,,2024-11-17,46,Sunday
30/09/2024 17:04:00,30/09/2024 17:04,Keerthana,9415075164,Waxing,,De-tan,,Manicure,Bleaching,Wash,Massage,,,,2756,Pinky,GPay,,2024-09-30,40,Monday
17/09/2024 11:14:00,17/09/2024 11:14,Deepa,9301846424,Waxing,,,,,,Wash,,Threading,Hair Cut,,1157,Pinky,Card,Malar,2024-09-17,38,Tuesday
20/11/2024 10:52:00,20/11/2024 10:52,Latha,9912572071,Waxing,Facial,De-tan,,,Bleaching,,Massage,Threading,,,770,Anjali,PhonePe,,2024-11-20,47,Wednesday
16/10/2024 18:53:00,16/10/2024 18:53,Priya,9971039507,Waxing,,De-tan,,Manicure,,,Massage,Threading,,Miscellaneous,3220,Anjali,PhonePe,,2024-10-16,42,Wednesday
26/09/2024 16:05:00,26/09/2024 16:05,Aishwarya,9922190089,,,,,Manicure,Bleaching,Wash,Massage,,Hair Cut,,374,Anjali,GPay,,2024-09-26,39,Thursday
08/09/2024 09:02:00,08/09/2024 09:02,Priya,9745759521,,,,Pedicure,Manicure,,Wash,Massage,Threading,,Miscellaneous,2971,Suganya Sri,GPay,,2024-09-08,36,Sunday
24/10/2024 13:52:00,24/10/2024 13:52,Anjali,9693523454,,Facial,,,Manicure,Bleaching,Wash,Massage,,Hair Cut,,2333,Suganya Sri,Cash,,2024-10-24,43,Thursday
06/09/2024 18:45:00,06/09/2024 18:45,Kavya,9308424802,Waxing,Facial,De-tan,Pedicure,,Bleaching,Wash,Massage,,Hair Cut,,3494,Suganya Sri,GPay,Malar,2024-09-06,36,Friday
16/11/2024 16:27:00,16/11/2024 16:27,Shruthi,9956783923,Waxing,Facial,,Pedicure,,Bleaching,Wash,,,,,3329,Malar,PhonePe,,2024-11-16,46,Saturday
27/09/2024 18:50:00,27/09/2024 18:50,Sandhya,9524969341,,,De-tan,Pedicure,,,,,,,,2217,Poornima,Card,Poornima,2024-09-27,39,Friday
03/11/2024 19:36:00,03/11/2024 19:36,Kavya,9211136047,,,De-tan,,Manicure,,,Massage,Threading,,Miscellaneous,645,Poornima,GPay,,2024-11-03,44,Sunday
30/10/2024 16:25:00,30/10/2024 16:25,Priya,9864744466,Waxing,,,Pedicure,Manicure,,,Massage,,Hair Cut,Miscellaneous,2952,Malar,Card,,2024-10-30,44,Wednesday
20/11/2024 14:03:00,20/11/2024 14:03,Keerthana,9572545932,Waxing,,De-tan,,,Bleaching,Wash,Massage,Threading,,,3139,Malar,PhonePe,Suganya Sri,2024-11-20,47,Wednesday
06/11/2024 20:38:00,06/11/2024 20:38,Anjali,9287386500,,,De-tan,Pedicure,,Bleaching,Wash,,,,Miscellaneous,1842,Pinky,PhonePe,Poornima,2024-11-06,45,Wednesday
05/10/2024 09:14:00,05/10/2024 09:14,Latha,9634144305,Waxing,Facial,De-tan,,,,,,,,Miscellaneous,1767,Poornima,Cash,,2024-10-05,40,Saturday
10/09/2024 20:29:00,10/09/2024 20:29,Soumya,9334680190,,Facial,,Pedicure,Manicure,Bleaching,,Massage,,Hair Cut,Miscellaneous,929,Malar,Card,Poornima,2024-09-10,37,Tuesday
11/11/2024 15:38:00,11/11/2024 15:38,Priya,9521112651,,Facial,,Pedicure,Manicure,Bleaching,Wash,Massage,Threading,,Miscellaneous,1783,Pinky,PhonePe,,2024-11-11,46,Monday
09/09/2024 18:26:00,09/09/2024 18:26,Ranjani,9368493319,,Facial,De-tan,Pedicure,,,,,,,,3270,Pinky,PhonePe,Pinky,2024-09-09,37,Monday
07/11/2024 17:44:00,07/11/2024 17:44,Divya,9534360411,,Facial,De-tan,Pedicure,,Bleaching,,,,Hair Cut,,2316,Malar,Card,,2024-11-07,45,Thursday
17/10/2024 16:37:00,17/10/2024 16:37,Deepa,9409938142,Waxing,Facial,De-tan,,,,,Massage,,,,2381,Malar,PhonePe,Suganya Sri,2024-10-17,42,Thursday
03/11/2024 09:57:00,03/11/2024 09:57,Harini,9532911762,,Facial,De-tan,Pedicure,Manicure,Bleaching,,Massage,,Hair Cut,Miscellaneous,2857,Anjali,Card,Poornima,2024-11-03,44,Sunday
16/11/2024 17:54:00,16/11/2024 17:54,Latha,9707463483,,Facial,,,,Bleaching,,,,,Miscellaneous,3343,Poornima,Card,Poornima,2024-11-16,46,Saturday
13/10/2024 13:38:00,13/10/2024 13:38,Swathi,9861588975,,,,,Manicure,,Wash,,,Hair Cut,,3344,Poornima,PhonePe,Poornima,2024-10-13,41,Sunday
19/09/2024 15:32:00,19/09/2024 15:32,Sandhya,9416045560,,,De-tan,,,,,Massage,Threading,Hair Cut,,2428,Pinky,Card,,2024-09-19,38,Thursday
04/09/2024 12:06:00,04/09/2024 12:06,Shruthi,9326678313,,Facial,,Pedicure,Manicure,,,,,Hair Cut,Miscellaneous,174,Poornima,GPay,,2024-09-04,36,Wednesday
28/08/2024 17:51:00,28/08/2024 17:51,Nisha,9485461061,Waxing,,,,,,Wash,Massage,,,,1945,Malar,Card,,2024-08-28,35,Wednesday
02/10/2024 16:28:00,02/10/2024 16:28,Swathi,9229789743,,Facial,,,Manicure,Bleaching,,Massage,Threading,,,3211,Malar,GPay,,2024-10-02,40,Wednesday
02/10/2024 09:13:00,02/10/2024 09:13,Latha,9594914453,,,De-tan,,Manicure,Bleaching,Wash,Massage,,,Miscellaneous,2781,Malar,Card,Pinky,2024-10-02,40,Wednesday
17/09/2024 10:06:00,17/09/2024 10:06,Shruthi,9281441520,Waxing,,,Pedicure,,Bleaching,,,Threading,Hair Cut,,278,Suganya Sri,Card,Pinky,2024-09-17,38,Tuesday
01/11/2024 10:03:00,01/11/2024 10:03,Keerthana,9939373621,,Facial,,,,Bleaching,,Massage,,,,670,Malar,GPay,Pinky,2024-11-01,44,Friday
07/09/2024 19:18:00,07/09/2024 19:18,Divya,9114110986,,Facial,De-tan,Pedicure,,,,,Threading,,,2097,Poornima,Cash,,2024-09-07,36,Saturday
13/11/2024 18:50:00,13/11/2024 18:50,Latha,9591227907,,,,Pedicure,,Bleaching,Wash,Massage,,Hair Cut,Miscellaneous,885,Anjali,PhonePe,Poornima,2024-11-13,46,Wednesday
26/08/2024 09:16:00,26/08/2024 09:16,Sandhya,9799254834,Waxing,,De-tan,Pedicure,Manicure,,Wash,Massage,Threading,,Miscellaneous,2277,Pinky,GPay,,2024-08-26,35,Monday
16/11/2024 14:49:00,16/11/2024 14:49,Soumya,9308842732,Waxing,,,Pedicure,Manicure,,Wash,Massage,Threading,Hair Cut,,654,Suganya Sri,Card,,2024-11-16,46,Saturday
17/09/2024 15:31:00,17/09/2024 15:31,Harini,9229038598,Waxing,Facial,,Pedicure,Manicure,,,Massage,,Hair Cut,,412,Pinky,Cash,,2024-09-17,38,Tuesday
14/11/2024 18:38:00,14/11/2024 18:38,Shruthi,9586584913,Waxing,,De-tan,,,,,Massage,Threading,Hair Cut,Miscellaneous,2446,Malar,Card,Malar,2024-11-14,46,Thursday
03/10/2024 11:01:00,03/10/2024 11:01,Shruthi,9934830797,Waxing,Facial,De-tan,Pedicure,Manicure,,Wash,,,,Miscellaneous,1408,Anjali,Card,,2024-10-03,40,Thursday
10/09/2024 09:18:00,10/09/2024 09:18,Priya,9890602629,Waxing,,De-tan,Pedicure,Manicure,,,Massage,Threading,Hair Cut,Miscellaneous,1083,Anjali,Card,Suganya Sri,2024-09-10,37,Tuesday
24/08/2024 12:53:00,24/08/2024 12:53,Shruthi,9284489967,Waxing,,,,,,Wash,Massage,Threading,Hair Cut,,334,Poornima,Cash,,2024-08-24,34,Saturday
27/10/2024 11:44:00,27/10/2024 11:44,Divya,9899646509,,,,,,,,Massage,,Hair Cut,Miscellaneous,203,Suganya Sri,GPay,,2024-10-27,43,Sunday
15/11/2024 20:08:00,15/11/2024 20:08,Sangeetha,9210471675,,,De-tan,,Manicure,,,Massage,,Hair Cut,Miscellaneous,406,Pinky,GPay,Anjali,2024-11-15,46,Friday
21/10/2024 10:54:00,21/10/2024 10:54,Swathi,9598875926,,,De-tan,Pedicure,Manicure,,,,,,,731,Anjali,GPay,Malar,2024-10-21,43,Monday
06/09/2024 17:25:00,06/09/2024 17:25,Sandhya,9788084213,,Facial,,Pedicure,,Bleaching,,,Threading,Hair Cut,,3130,Suganya Sri,Card,Pinky,2024-09-06,36,Friday
16/10/2024 10:56:00,16/10/2024 10:56,Aishwarya,9512312460,Waxing,Facial,De-tan,,,,Wash,,Threading,,,1495,Poornima,Card,Malar,2024-10-16,42,Wednesday
07/10/2024 12:18:00,07/10/2024 12:18,Priya,9108442256,Waxing,Facial,,,,,,Massage,,Hair Cut,Miscellaneous,941,Poornima,GPay,,2024-10-07,41,Monday
25/10/2024 18:22:00,25/10/2024 18:22,Anjali,9607003856,,Facial,De-tan,,Manicure,Bleaching,Wash,Massage,Threading,Hair Cut,,1274,Suganya Sri,PhonePe,Anjali,2024-10-25,43,Friday
19/11/2024 09:22:00,19/11/2024 09:22,Priya,9642368120,,Facial,,Pedicure,Manicure,Bleaching,,,Threading,Hair Cut,Miscellaneous,1538,Poornima,GPay,Malar,2024-11-19,47,Tuesday
23/08/2024 16:43:00,23/08/2024 16:43,Nisha,9978301760,,,De-tan,,,Bleaching,,,,,Miscellaneous,1047,Malar,Cash,,2024-08-23,34,Friday
16/10/2024 16:18:00,16/10/2024 16:18,Soumya,9467738072,Waxing,Facial,De-tan,Pedicure,,,Wash,Massage,Threading,,,3464,Pinky,PhonePe,Poornima,2024-10-16,42,Wednesday
17/11/2024 10:42:00,17/11/2024 10:42,Soumya,9898997659,,,De-tan,Pedicure,Manicure,,Wash,,Threading,Hair Cut,,898,Pinky,PhonePe,Malar,2024-11-17,46,Sunday
06/10/2024 20:43:00,06/10/2024 20:43,Anjali,9255714049,,Facial,,,,,Wash,Massage,,,Miscellaneous,2861,Anjali,GPay,,2024-10-06,40,Sunday
19/09/2024 12:04:00,19/09/2024 12:04,Sandhya,9368143343,Waxing,Facial,,Pedicure,Manicure,,Wash,Massage,Threading,Hair Cut,Miscellaneous,334,Pinky,Cash,Anjali,2024-09-19,38,Thursday
13/09/2024 16:30:00,13/09/2024 16:30,Harini,9753996230,,,,Pedicure,Manicure,,Wash,,Threading,,,941,Malar,Cash,Anjali,2024-09-13,37,Friday
03/09/2024 20:49:00,03/09/2024 20:49,Divya,9479050041,,Facial,De-tan,,,Bleaching,Wash,,,,Miscellaneous,2774,Malar,GPay,,2024-09-03,36,Tuesday
30/08/2024 11:35:00,30/08/2024 11:35,Anjali,9357764967,,Facial,De-tan,,,Bleaching,Wash,Massage,,,Miscellaneous,2025,Pinky,Cash,,2024-08-30,35,Friday
21/09/2024 12:35:00,21/09/2024 12:35,Keerthana,9271503450,,Facial,,Pedicure,Manicure,,,,,Hair Cut,,3170,Malar,Cash,Poornima,2024-09-21,38,Saturday
15/09/2024 16:42:00,15/09/2024 16:42,Priya,9659714555,,,De-tan,Pedicure,Manicure,,Wash,Massage,Threading,,,3233,Pinky,PhonePe,Poornima,2024-09-15,37,Sunday
18/11/2024 10:57:00,18/11/2024 10:57,Swathi,9769011220,Waxing,,,Pedicure,,Bleaching,Wash,,Threading,,Miscellaneous,817,Anjali,PhonePe,,2024-11-18,47,Monday
15/10/2024 09:50:00,15/10/2024 09:50,Swathi,9723211599,Waxing,,De-tan,Pedicure,,Bleaching,Wash,,,Hair Cut,,2754,Anjali,GPay,Poornima,2024-10-15,42,Tuesday
03/10/2024 17:19:00,03/10/2024 17:19,Meena,9187635977,,,De-tan,Pedicure,Manicure,Bleaching,Wash,,Threading,,,391,Poornima,Card,Suganya Sri,2024-10-03,40,Thursday
31/10/2024 17:12:00,31/10/2024 17:12,Ranjani,9244223414,Waxing,Facial,De-tan,,,,Wash,,Threading,Hair Cut,Miscellaneous,1579,Suganya Sri,GPay,Pinky,2024-10-31,44,Thursday
13/11/2024 15:02:00,13/11/2024 15:02,Priya,9281847089,,,De-tan,,,,,Massage,,Hair Cut,Miscellaneous,1999,Pinky,GPay,Pinky,2024-11-13,46,Wednesday
16/09/2024 16:41:00,16/09/2024 16:41,Aishwarya,9489658470,Waxing,Facial,,Pedicure,,Bleaching,Wash,Massage,Threading,,Miscellaneous,2832,Pinky,PhonePe,Anjali,2024-09-16,38,Monday
28/10/2024 17:23:00,28/10/2024 17:23,Divya,9130605643,,,,,,,Wash,Massage,,,,3044,Suganya Sri,Cash,Pinky,2024-10-28,44,Monday
11/10/2024 10:25:00,11/10/2024 10:25,Deepa,9515003064,Waxing,,,,,,Wash,,Threading,Hair Cut,,1362,Anjali,PhonePe,Poornima,2024-10-11,41,Friday
18/10/2024 13:31:00,18/10/2024 13:31,Swathi,9689347455,Waxing,Facial,De-tan,,,Bleaching,,Massage,,,Miscellaneous,2492,Poornima,Cash,,2024-10-18,42,Friday
03/10/2024 15:25:00,03/10/2024 15:25,Ranjani,9447673469,,,,Pedicure,Manicure,Bleaching,,Massage,,,Miscellaneous,1161,Suganya Sri,PhonePe,Poornima,2024-10-03,40,Thursday
13/09/2024 16:49:00,13/09/2024 16:49,Divya,9470295816,,,,Pedicure,Manicure,,,,Threading,Hair Cut,Miscellaneous,2825,Anjali,GPay,,2024-09-13,37,Friday
11/10/2024 15:50:00,11/10/2024 15:50,Nisha,9539996259,Waxing,,De-tan,Pedicure,,Bleaching,,,Threading,,Miscellaneous,3097,Pinky,Cash,Anjali,2024-10-11,41,Friday
05/09/2024 20:09:00,05/09/2024 20:09,Aishwarya,9949027528,Waxing,,,,Manicure,Bleaching,,Massage,,Hair Cut,Miscellaneous,1463,Pinky,PhonePe,,2024-09-05,36,Thursday
08/11/2024 15:19:00,08/11/2024 15:19,Keerthana,9363269335,,Facial,De-tan,,,,,,,,Miscellaneous,1655,Malar,PhonePe,,2024-11-08,45,Friday
05/11/2024 17:06:00,05/11/2024 17:06,Sangeetha,9971865801,Waxing,,De-tan,,Manicure,Bleaching,Wash,Massage,Threading,,,463,Suganya Sri,PhonePe,,2024-11-05,45,Tuesday
17/10/2024 19:51:00,17/10/2024 19:51,Divya,9491498026,Waxing,Facial,De-tan,Pedicure,Manicure,Bleaching,,,,Hair Cut,Miscellaneous,494,Malar,Card,Poornima,2024-10-17,42,Thursday
05/11/2024 20:57:00,05/11/2024 20:57,Shruthi,9249279309,,Facial,,Pedicure,,,Wash,,Threading,,,1910,Poornima,Cash,,2024-11-05,45,Tuesday
22/10/2024 12:13:00,22/10/2024 12:13,Swathi,9368509784,Waxing,Facial,De-tan,,Manicure,Bleaching,,,Threading,,,917,Malar,GPay,Pinky,2024-10-22,43,Tuesday
25/10/2024 09:32:00,25/10/2024 09:32,Meena,9859993150,Waxing,Facial,De-tan,Pedicure,,,,Massage,,Hair Cut,,1054,Poornima,PhonePe,Pinky,2024-10-25,43,Friday
22/10/2024 11:09:00,22/10/2024 11:09,Ranjani,9431084023,,,De-tan,,,,,Massage,,,Miscellaneous,2851,Pinky,Cash,Malar,2024-10-22,43,Tuesday
14/09/2024 20:17:00,14/09/2024 20:17,Divya,9927203035,Waxing,Facial,,Pedicure,,,,,,,Miscellaneous,569,Poornima,Card,,2024-09-14,37,Saturday
18/11/2024 18:29:00,18/11/2024 18:29,Keerthana,9920175604,,,,,,,,,,,Miscellaneous,2744,Anjali,Cash,,2024-11-18,47,Monday
16/11/2024 20:57:00,16/11/2024 20:57,Deepa,9881919018,,Facial,De-tan,,Manicure,Bleaching,Wash,Massage,,,Miscellaneous,255,Poornima,Cash,Pinky,2024-11-16,46,Saturday
29/08/2024 15:01:00,29/08/2024 15:01,Aishwarya,9629458578,,,De-tan,Pedicure,Manicure,,Wash,Massage,,Hair Cut,Miscellaneous,3316,Malar,Card,,2024-08-29,35,Thursday
17/11/2024 18:57:00,17/11/2024 18:57,Deepa,9922739882,,Facial,,Pedicure,,Bleaching,,,Threading,,Miscellaneous,2105,Pinky,GPay,,2024-11-17,46,Sunday
06/10/2024 13:32:00,06/10/2024 13:32,Soumya,9229193650,Waxing,,De-tan,Pedicure,,Bleaching,,Massage,,,Miscellaneous,1974,Poornima,PhonePe,Anjali,2024-10-06,40,Sunday
23/09/2024 11:55:00,23/09/2024 11:55,Ranjani,9101327062,Waxing,,De-tan,,Manicure,Bleaching,Wash,Massage,,,,3019,Poornima,Card,,2024-09-23,39,Monday
31/08/2024 15:47:00,31/08/2024 15:47,Sangeetha,9333398676,,,,Pedicure,Manicure,,,,,Hair Cut,,2601,Malar,PhonePe,Suganya Sri,2024-08-31,35,Saturday
29/08/2024 19:05:00,29/08/2024 19:05,Shruthi,9619933470,,,,Pedicure,Manicure,,Wash,,Threading,,,912,Pinky,Cash,Suganya Sri,2024-08-29,35,Thursday
24/10/2024 12:11:00,24/10/2024 12:11,Latha,9805132108,Waxing,,De-tan,,,Bleaching,Wash,,Threading,Hair Cut,,1154,Poornima,GPay,Suganya Sri,2024-10-24,43,Thursday
12/10/2024 15:23:00,12/10/2024 15:23,Ranjani,9218785812,Waxing,Facial,De-tan,Pedicure,Manicure,,,Massage,Threading,,,1095,Malar,GPay,Malar,2024-10-12,41,Saturday
04/10/2024 12:03:00,04/10/2024 12:03,Priya,9381601592,Waxing,Facial,,,,Bleaching,,Massage,Threading,Hair Cut,Miscellaneous,862,Malar,PhonePe,Anjali,2024-10-04,40,Friday
11/11/2024 11:23:00,11/11/2024 11:23,Aishwarya,9652249694,,,De-tan,Pedicure,Manicure,Bleaching,Wash,,Threading,,Miscellaneous,1019,Suganya Sri,PhonePe,,2024-11-11,46,Monday
19/11/2024 17:09:00,19/11/2024 17:09,Shruthi,9126027823,Waxing,Facial,De-tan,Pedicure,Manicure,,Wash,,,Hair Cut,Miscellaneous,1461,Suganya Sri,GPay,,2024-11-19,47,Tuesday
01/10/2024 20:41:00,01/10/2024 20:41,Meena,9623518852,,Facial,De-tan,,,,Wash,,Threading,,Miscellaneous,2484,Suganya Sri,GPay,,2024-10-01,40,Tuesday
15/09/2024 13:06:00,15/09/2024 13:06,Swathi,9820131763,Waxing,Facial,,,,Bleaching,,,Threading,Hair Cut,,522,Malar,PhonePe,,2024-09-15,37,Sunday
17/11/2024 14:26:00,17/11/2024 14:26,Meena,9356065455,,,,Pedicure,,Bleaching,,,,,,1255,Suganya Sri,GPay,Malar,2024-11-17,46,Sunday
04/10/2024 19:22:00,04/10/2024 19:22,Shruthi,9166445511,,Facial,De-tan,,,,,,,,,1501,Anjali,GPay,Malar,2024-10-04,40,Friday
26/09/2024 17:20:00,26/09/2024 17:20,Aishwarya,9104830316,,,De-tan,Pedicure,,,Wash,Massage,,Hair Cut,,2700,Malar,PhonePe,,2024-09-26,39,Thursday
09/11/2024 14:40:00,09/11/2024 14:40,Kavya,9408276384,,,,Pedicure,,Bleaching,Wash,Massage,,Hair Cut,,800,Poornima,Cash,,2024-11-09,45,Saturday
09/09/2024 16:33:00,09/09/2024 16:33,Sangeetha,9993329734,,,De-tan,Pedicure,,,Wash,Massage,,,,994,Suganya Sri,Cash,Pinky,2024-09-09,37,Monday
17/09/2024 11:08:00,17/09/2024 11:08,Nisha,9159508860,Waxing,,,Pedicure,Manicure,,Wash,,Threading,Hair Cut,Miscellaneous,1859,Pinky,GPay,Anjali,2024-09-17,38,Tuesday
04/11/2024 09:06:00,04/11/2024 09:06,Divya,9860443639,Waxing,,,,,Bleaching,Wash,Massage,,Hair Cut,Miscellaneous,1204,Anjali,Cash,Suganya Sri,2024-11-04,45,Monday
18/11/2024 11:05:00,18/11/2024 11:05,Meena,9569883422,,,,Pedicure,Manicure,,,,,,,1972,Poornima,Cash,Pinky,2024-11-18,47,Monday
04/09/2024 14:29:00,04/09/2024 14:29,Keerthana,9352522998,,Facial,De-tan,Pedicure,Manicure,,,Massage,Threading,,,838,Pinky,Cash,,2024-09-04,36,Wednesday
17/11/2024 09:03:00,17/11/2024 09:03,Keerthana,9215205252,Waxing,Facial,De-tan,Pedicure,Manicure,Bleaching,Wash,,,,,1313,Malar,PhonePe,Malar,2024-11-17,46,Sunday
22/10/2024 10:29:00,22/10/2024 10:29,Ranjani,9763008345,Waxing,Facial,,,Manicure,Bleaching,Wash,,Threading,,,269,Suganya Sri,Card,,2024-10-22,43,Tuesday
23/08/2024 11:29:00,23/08/2024 11:29,Ranjani,9465762397,Waxing,,De-tan,Pedicure,Manicure,Bleaching,,Massage,,,Miscellaneous,1434,Poornima,Cash,,2024-08-23,34,Friday
05/10/2024 18:01:00,05/10/2024 18:01,Deepa,9951624496,Waxing,,De-tan,,,Bleaching,,,Threading,,Miscellaneous,3288,Anjali,Cash,,2024-10-05,40,Saturday
09/09/2024 17:52:00,09/09/2024 17:52,Meena,9653191162,,,,Pedicure,Manicure,Bleaching,Wash,Massage,Threading,Hair Cut,,591,Suganya Sri,Cash,Poornima,2024-09-09,37,Monday
11/11/2024 14:12:00,11/11/2024 14:12,Shruthi,9804921471,,,,,Manicure,,Wash,Massage,,,,1121,Suganya Sri,GPay,,2024-11-11,46,Monday
05/09/2024 15:54:00,05/09/2024 15:54,Swathi,9231299372,Waxing,,,,Manicure,Bleaching,Wash,,Threading,Hair Cut,,2004,Suganya Sri,Cash,,2024-09-05,36,Thursday
16/11/2024 10:39:00,16/11/2024 10:39,Sangeetha,9414466009,,Facial,De-tan,Pedicure,Manicure,Bleaching,Wash,,Threading,Hair Cut,,2708,Suganya Sri,GPay,Pinky,2024-11-16,46,Saturday
28/08/2024 17:57:00,28/08/2024 17:57,Sandhya,9248994727,,,De-tan,Pedicure,Manicure,,,Massage,,Hair Cut,Miscellaneous,2266,Anjali,Card,Malar,2024-08-28,35,Wednesday
27/09/2024 16:25:00,27/09/2024 16:25,Divya,9158526538,Waxing,,,Pedicure,Manicure,,,Massage,Threading,Hair Cut,Miscellaneous,2993,Poornima,Cash,Poornima,2024-09-27,39,Friday
11/11/2024 20:06:00,11/11/2024 20:06,Nisha,9824133568,,,,,,,Wash,Massage,Threading,,Miscellaneous,2084,Suganya Sri,Card,,2024-11-11,46,Monday
07/10/2024 17:31:00,07/10/2024 17:31,Ranjani,9143170536,,,,Pedicure,,,Wash,,Threading,Hair Cut,Miscellaneous,2910,Suganya Sri,Card,,2024-10-07,41,Monday
04/09/2024 15:15:00,04/09/2024 15:15,Priya,9476905242,Waxing,,De-tan,Pedicure,,Bleaching,Wash,Massage,Threading,Hair Cut,Miscellaneous,2987,Suganya Sri,PhonePe,Malar,2024-09-04,36,Wednesday
27/10/2024 18:31:00,27/10/2024 18:31,Priya,9310594769,,,De-tan,Pedicure,,,Wash,Massage,Threading,Hair Cut,Miscellaneous,730,Pinky,PhonePe,,2024-10-27,43,Sunday
23/09/2024 15:51:00,23/09/2024 15:51,Sangeetha,9410922879,,,,,Manicure,,Wash,Massage,Threading,,Miscellaneous,382,Malar,GPay,,2024-09-23,39,Monday
08/10/2024 14:53:00,08/10/2024 14:53,Kavya,9670335971,Waxing,Facial,,,,Bleaching,Wash,Massage,,Hair Cut,,1104,Poornima,Card,Anjali,2024-10-08,41,Tuesday
01/09/2024 09:50:00,01/09/2024 09:50,Latha,9609488874,,Facial,De-tan,,Manicure,,Wash,Massage,,,,2994,Malar,PhonePe,,2024-09-01,35,Sunday
21/10/2024 14:12:00,21/10/2024 14:12,Soumya,9503915368,,Facial,De-tan,Pedicure,,Bleaching,Wash,,,Hair Cut,Miscellaneous,2122,Pinky,Cash,,2024-10-21,43,Monday
16/09/2024 13:37:00,16/09/2024 13:37,Ranjani,9410382577,Waxing,Facial,,Pedicure,,,,Massage,,,,3198,Suganya Sri,GPay,,2024-09-16,38,Monday
04/10/2024 17:20:00,04/10/2024 17:20,Swathi,9149916631,,,De-tan,Pedicure,Manicure,Bleaching,Wash,,,,Miscellaneous,2589,Pinky,PhonePe,,2024-10-04,40,Friday
02/10/2024 09:47:00,02/10/2024 09:47,Anjali,9364250150,Waxing,,,Pedicure,Manicure,,Wash,Massage,Threading,,,1185,Suganya Sri,Card,Pinky,2024-10-02,40,Wednesday
14/09/2024 12:16:00,14/09/2024 12:16,Shruthi,9673497194,Waxing,,De-tan,Pedicure,Manicure,,,Massage,,Hair Cut,,1043,Anjali,Card,,2024-09-14,37,Saturday
09/09/2024 10:24:00,09/09/2024 10:24,Nisha,9634440941,Waxing,Facial,,Pedicure,,,Wash,Massage,Threading,,Miscellaneous,1238,Pinky,Card,Malar,2024-09-09,37,Monday
02/09/2024 19:54:00,02/09/2024 19:54,Divya,9735704296,Waxing,,De-tan,,,,,Massage,,Hair Cut,Miscellaneous,2923,Anjali,PhonePe,Anjali,2024-09-02,36,Monday
24/08/2024 17:27:00,24/08/2024 17:27,Soumya,9385091387,,Facial,De-tan,Pedicure,,,,Massage,Threading,,,157,Malar,Card,Suganya Sri,2024-08-24,34,Saturday
30/10/2024 20:08:00,30/10/2024 20:08,Nisha,9994300647,Waxing,Facial,De-tan,,Manicure,Bleaching,,Massage,Threading,Hair Cut,,3373,Poornima,Cash,,2024-10-30,44,Wednesday
14/10/2024 14:31:00,14/10/2024 14:31,Aishwarya,9791692352,Waxing,Facial,,,Manicure,,Wash,,,,,1221,Pinky,PhonePe,Malar,2024-10-14,42,Monday
16/11/2024 12:27:00,16/11/2024 12:27,Priya,9132458335,Waxing,Facial,De-tan,Pedicure,Manicure,Bleaching,Wash,,Threading,Hair Cut,Miscellaneous,2929,Malar,PhonePe,Anjali,2024-11-16,46,Saturday
26/09/2024 11:57:00,26/09/2024 11:57,Keerthana,9698293030,Waxing,,De-tan,Pedicure,Manicure,,Wash,Massage,,Hair Cut,Miscellaneous,2033,Anjali,GPay,Suganya Sri,2024-09-26,39,Thursday
09/09/2024 16:04:00,09/09/2024 16:04,Deepa,9670902670,,Facial,De-tan,,,Bleaching,,,,Hair Cut,Miscellaneous,1130,Malar,Card,Pinky,2024-09-09,37,Monday
14/09/2024 09:13:00,14/09/2024 09:13,Shruthi,9746986342,,,De-tan,,Manicure,Bleaching,Wash,Massage,,Hair Cut,,1432,Pinky,Card,Malar,2024-09-14,37,Saturday
12/11/2024 17:48:00,12/11/2024 17:48,Sangeetha,9259136308,,,De-tan,,Manicure,,Wash,,,,Miscellaneous,822,Anjali,Card,,2024-11-12,46,Tuesday
01/10/2024 19:38:00,01/10/2024 19:38,Priya,9772825954,,,,,Manicure,,Wash,Massage,Threading,Hair Cut,,585,Pinky,Cash,,2024-10-01,40,Tuesday
07/11/2024 19:45:00,07/11/2024 19:45,Anjali,9464462068,,,De-tan,,Manicure,Bleaching,Wash,Massage,,,Miscellaneous,2109,Poornima,Cash,,2024-11-07,45,Thursday
07/10/2024 12:44:00,07/10/2024 12:44,Priya,9589744604,Waxing,Facial,,Pedicure,,,,Massage,Threading,Hair Cut,,350,Malar,Cash,,2024-10-07,41,Monday
15/11/2024 12:43:00,15/11/2024 12:43,Keerthana,9545015157,,Facial,De-tan,Pedicure,Manicure,,,,,Hair Cut,Miscellaneous,2411,Malar,PhonePe,,2024-11-15,46,Friday
25/08/2024 16:56:00,25/08/2024 16:56,Harini,9310354742,,Facial,De-tan,,Manicure,,Wash,,Threading,Hair Cut,Miscellaneous,3280,Anjali,Card,Poornima,2024-08-25,34,Sunday
29/10/2024 20:02:00,29/10/2024 20:02,Sandhya,9480920304,Waxing,,De-tan,Pedicure,Manicure,Bleaching,,,,,Miscellaneous,3282,Anjali,PhonePe,,2024-10-29,44,Tuesday
02/09/2024 14:31:00,02/09/2024 14:31,Shruthi,9942714027,,Facial,,,Manicure,Bleaching,Wash,,Threading,,,1379,Pinky,GPay,Pinky,2024-09-02,36,Monday
25/10/2024 17:33:00,25/10/2024 17:33,Keerthana,9971220573,,,De-tan,,Manicure,,,,,Hair Cut,Miscellaneous,2897,Poornima,PhonePe,,2024-10-25,43,Friday
16/10/2024 18:51:00,16/10/2024 18:51,Deepa,9115247964,Waxing,Facial,,,,,,,,,Miscellaneous,2927,Poornima,PhonePe,Pinky,2024-10-16,42,Wednesday
14/09/2024 11:39:00,14/09/2024 11:39,Nisha,9528303494,Waxing,Facial,De-tan,Pedicure,,,Wash,,,Hair Cut,Miscellaneous,1749,Poornima,GPay,Poornima,2024-09-14,37,Saturday
30/09/2024 09:45:00,30/09/2024 09:45,Sangeetha,9214085524,,Facial,,Pedicure,Manicure,Bleaching,Wash,,,,,736,Poornima,GPay,,2024-09-30,40,Monday
17/11/2024 19:52:00,17/11/2024 19:52,Shruthi,9819378833,Waxing,Facial,De-tan,Pedicure,,Bleaching,Wash,,Threading,Hair Cut,Miscellaneous,2083,Pinky,PhonePe,Pinky,2024-11-17,46,Sunday
10/11/2024 13:19:00,10/11/2024 13:19,Sandhya,9800845712,,,De-tan,,Manicure,,Wash,Massage,Threading,,,2562,Pinky,PhonePe,,2024-11-10,45,Sunday
25/09/2024 18:09:00,25/09/2024 18:09,Swathi,9821568252,Waxing,,,,Manicure,Bleaching,,,Threading,,Miscellaneous,1317,Malar,Card,Pinky,2024-09-25,39,Wednesday
14/10/2024 11:17:00,14/10/2024 11:17,Ranjani,9129452657,Waxing,,,,Manicure,Bleaching,,Massage,Threading,Hair Cut,,2533,Malar,Cash,Anjali,2024-10-14,42,Monday
25/10/2024 16:18:00,25/10/2024 16:18,Divya,9761420933,,,De-tan,Pedicure,,,Wash,Massage,,,Miscellaneous,3028,Poornima,Cash,Pinky,2024-10-25,43,Friday
06/10/2024 12:53:00,06/10/2024 12:53,Anjali,9929155328,Waxing,Facial,,Pedicure,Manicure,,,Massage,,,Miscellaneous,1267,Poornima,Cash,Pinky,2024-10-06,40,Sunday
05/11/2024 16:46:00,05/11/2024 16:46,Kavya,9838555179,,Facial,De-tan,Pedicure,,,Wash,Massage,Threading,Hair Cut,,1650,Anjali,GPay,,2024-11-05,45,Tuesday
13/09/2024 18:52:00,13/09/2024 18:52,Harini,9319613486,,,,,Manicure,,Wash,Massage,Threading,Hair Cut,Miscellaneous,2021,Anjali,GPay,Poornima,2024-09-13,37,Friday
25/08/2024 15:25:00,25/08/2024 15:25,Harini,9844899393,Waxing,,De-tan,Pedicure,Manicure,,Wash,Massage,Threading,,Miscellaneous,988,Pinky,Cash,Suganya Sri,2024-08-25,34,Sunday
26/10/2024 11:34:00,26/10/2024 11:34,Swathi,9310889670,,Facial,De-tan,Pedicure,,Bleaching,Wash,,Threading,Hair Cut,Miscellaneous,3335,Pinky,PhonePe,Suganya Sri,2024-10-26,43,Saturday
17/10/2024 17:56:00,17/10/2024 17:56,Soumya,9706425994,Waxing,Facial,,,,Bleaching,,Massage,,,,1359,Anjali,Card,Pinky,2024-10-17,42,Thursday
31/10/2024 19:19:00,31/10/2024 19:19,Priya,9456347543,,,,,,Bleaching,Wash,,,,Miscellaneous,822,Suganya Sri,PhonePe,,2024-10-31,44,Thursday
17/10/2024 15:43:00,17/10/2024 15:43,Sangeetha,9945952660,,Facial,,Pedicure,,Bleaching,,,,,,170,Poornima,Cash,Suganya Sri,2024-10-17,42,Thursday
13/11/2024 12:10:00,13/11/2024 12:10,Anjali,9405083242,,Facial,De-tan,Pedicure,,Bleaching,,Massage,,,Miscellaneous,2167,Poornima,Cash,,2024-11-13,46,Wednesday
17/11/2024 14:31:00,17/11/2024 14:31,Anjali,9167705823,,Facial,,Pedicure,Manicure,,Wash,,Threading,,Miscellaneous,2526,Anjali,GPay,Pinky,2024-11-17,46,Sunday
13/09/2024 09:57:00,13/09/2024 09:57,Ranjani,9796126456,Waxing,Facial,,Pedicure,Manicure,,,,Threading,Hair Cut,,1840,Anjali,Card,Suganya Sri,2024-09-13,37,Friday
04/11/2024 11:02:00,04/11/2024 11:02,Harini,9120244510,,,De-tan,Pedicure,Manicure,Bleaching,Wash,,Threading,Hair Cut,,2835,Pinky,Card,Anjali,2024-11-04,45,Monday
08/10/2024 11:55:00,08/10/2024 11:55,Priya,9140876797,,Facial,De-tan,,Manicure,Bleaching,Wash,,,,Miscellaneous,2858,Poornima,Card,,2024-10-08,41,Tuesday
15/09/2024 13:33:00,15/09/2024 13:33,Priya,9176429702,Waxing,,,,Manicure,Bleaching,,,,,Miscellaneous,3455,Anjali,PhonePe,,2024-09-15,37,Sunday
06/09/2024 18:48:00,06/09/2024 18:48,Kavya,9938896011,Waxing,Facial,,,,,,,,Hair Cut,Miscellaneous,1935,Pinky,Cash,,2024-09-06,36,Friday
09/10/2024 12:12:00,09/10/2024 12:12,Sangeetha,9586174926,,,,Pedicure,Manicure,,Wash,,,,Miscellaneous,2146,Pinky,GPay,Malar,2024-10-09,41,Wednesday
06/11/2024 12:43:00,06/11/2024 12:43,Kavya,9887683501,Waxing,Facial,,Pedicure,,,Wash,Massage,,,,2550,Poornima,Cash,Malar,2024-11-06,45,Wednesday
25/08/2024 09:27:00,25/08/2024 09:27,Kavya,9622003859,,Facial,De-tan,Pedicure,,Bleaching,Wash,Massage,Threading,,,3162,Poornima,Cash,,2024-08-25,34,Sunday
07/11/2024 20:24:00,07/11/2024 20:24,Sangeetha,9961570753,,Facial,,,Manicure,,,Massage,Threading,Hair Cut,,1256,Suganya Sri,PhonePe,,2024-11-07,45,Thursday
20/10/2024 13:34:00,20/10/2024 13:34,Kavya,9330077304,,,,,,,,Massage,Threading,,,2110,Pinky,Cash,Pinky,2024-10-20,42,Sunday
22/09/2024 19:42:00,22/09/2024 19:42,Ranjani,9916876231,Waxing,Facial,De-tan,,,Bleaching,Wash,Massage,Threading,Hair Cut,Miscellaneous,399,Suganya Sri,GPay,,2024-09-22,38,Sunday
27/10/2024 17:03:00,27/10/2024 17:03,Nisha,9299139541,Waxing,Facial,De-tan,Pedicure,Manicure,Bleaching,,Massage,Threading,Hair Cut,Miscellaneous,509,Anjali,Card,Poornima,2024-10-27,43,Sunday
19/11/2024 20:31:00,19/11/2024 20:31,Soumya,9448141153,Waxing,,De-tan,,,Bleaching,,Massage,Threading,Hair Cut,,1371,Pinky,Card,Pinky,2024-11-19,47,Tuesday
19/10/2024 14:19:00,19/10/2024 14:19,Kavya,9190087734,,Facial,De-tan,,Manicure,Bleaching,,,,Hair Cut,Miscellaneous,1803,Poornima,Card,,2024-10-19,42,Saturday
08/10/2024 18:51:00,08/10/2024 18:51,Nisha,9778032031,Waxing,Facial,De-tan,Pedicure,Manicure,Bleaching,Wash,Massage,Threading,Hair Cut,,1661,Poornima,Cash,,2024-10-08,41,Tuesday
16/09/2024 16:22:00,16/09/2024 16:22,Swathi,9339730192,,,,Pedicure,,,Wash,,Threading,Hair Cut,,326,Malar,PhonePe,Malar,2024-09-16,38,Monday
09/11/2024 14:35:00,09/11/2024 14:35,Shruthi,9619801862,,Facial,De-tan,Pedicure,,Bleaching,Wash,,Threading,Hair Cut,,1273,Malar,GPay,Malar,2024-11-09,45,Saturday
15/09/2024 15:30:00,15/09/2024 15:30,Ranjani,9132085173,,Facial,,,Manicure,Bleaching,Wash,,Threading,Hair Cut,,933,Suganya Sri,Card,Pinky,2024-09-15,37,Sunday
04/09/2024 15:53:00,04/09/2024 15:53,Keerthana,9946240561,,,De-tan,,Manicure,Bleaching,Wash,Massage,Threading,Hair Cut,,787,Malar,Card,,2024-09-04,36,Wednesday
11/10/2024 18:45:00,11/10/2024 18:45,Priya,9795823643,,Facial,,Pedicure,,Bleaching,,,,Hair Cut,,482,Malar,Card,Poornima,2024-10-11,41,Friday
04/09/2024 13:12:00,04/09/2024 13:12,Shruthi,9150134180,Waxing,,,,,,Wash,Massage,Threading,,,2817,Poornima,PhonePe,,2024-09-04,36,Wednesday
06/10/2024 09:19:00,06/10/2024 09:19,Anjali,9962613842,Waxing,,De-tan,,Manicure,Bleaching,,Massage,,,,555,Pinky,Card,Anjali,2024-10-06,40,Sunday
31/08/2024 09:44:00,31/08/2024 09:44,Kavya,9833854686,Waxing,Facial,De-tan,,,Bleaching,,,Threading,,,1339,Malar,GPay,,2024-08-31,35,Saturday
09/09/2024 15:54:00,09/09/2024 15:54,Nisha,9962006230,Waxing,Facial,De-tan,,,Bleaching,Wash,Massage,,Hair Cut,,3298,Pinky,GPay,,2024-09-09,37,Monday
13/10/2024 18:02:00,13/10/2024 18:02,Sandhya,9560169370,Waxing,,De-tan,Pedicure,Manicure,Bleaching,Wash,,Threading,Hair Cut,,1326,Anjali,GPay,,2024-10-13,41,Sunday
23/10/2024 09:52:00,23/10/2024 09:52,Anjali,9602002516,,,,Pedicure,Manicure,,Wash,Massage,Threading,Hair Cut,,1752,Poornima,PhonePe,Anjali,2024-10-23,43,Wednesday
19/11/2024 09:39:00,19/11/2024 09:39,Meena,9899029323,,,De-tan,,Manicure,Bleaching,Wash,Massage,Threading,,Miscellaneous,214,Pinky,GPay,Poornima,2024-11-19,47,Tuesday
25/08/2024 09:36:00,25/08/2024 09:36,Meena,9998120372,,,,Pedicure,,,Wash,Massage,Threading,,Miscellaneous,1986,Anjali,GPay,Pinky,2024-08-25,34,Sunday
06/09/2024 11:10:00,06/09/2024 11:10,Aishwarya,9226033682,Waxing,,,,,Bleaching,,Massage,,,,2672,Suganya Sri,Cash,Anjali,2024-09-06,36,Friday
26/09/2024 12:15:00,26/09/2024 12:15,Latha,9761794803,,,De-tan,Pedicure,Manicure,,Wash,,Threading,,,2079,Anjali,PhonePe,,2024-09-26,39,Thursday
13/10/2024 20:06:00,13/10/2024 20:06,Kavya,9977549992,,Facial,De-tan,Pedicure,Manicure,,,,Threading,,Miscellaneous,2860,Poornima,Card,,2024-10-13,41,Sunday
01/10/2024 12:08:00,01/10/2024 12:08,Priya,9349467899,Waxing,Facial,,Pedicure,Manicure,Bleaching,,Massage,,,,3231,Pinky,Card,,2024-10-01,40,Tuesday
17/10/2024 12:50:00,17/10/2024 12:50,Deepa,9124344129,,Facial,,,,Bleaching,Wash,Massage,,Hair Cut,,746,Malar,GPay,,2024-10-17,42,Thursday
20/09/2024 12:25:00,20/09/2024 12:25,Kavya,9723561133,Waxing,,,,Manicure,Bleaching,,Massage,Threading,,,552,Malar,Card,,2024-09-20,38,Friday
09/11/2024 18:18:00,09/11/2024 18:18,Sandhya,9637226370,Waxing,Facial,De-tan,,Manicure,Bleaching,Wash,,Threading,Hair Cut,,2596,Anjali,Card,,2024-11-09,45,Saturday
26/08/2024 10:52:00,26/08/2024 10:52,Priya,9540738516,,Facial,De-tan,Pedicure,,,Wash,Massage,Threading,,Miscellaneous,836,Anjali,PhonePe,,2024-08-26,35,Monday
05/11/2024 10:10:00,05/11/2024 10:10,Sandhya,9112910255,Waxing,Facial,De-tan,,,Bleaching,Wash,,Threading,,,1308,Malar,Card,Suganya Sri,2024-11-05,45,Tuesday
05/10/2024 12:02:00,05/10/2024 12:02,Latha,9885879474,Waxing,,De-tan,,,,,Massage,,,Miscellaneous,2885,Anjali,Card,,2024-10-05,40,Saturday
24/08/2024 17:16:00,24/08/2024 17:16,Sandhya,9721635848,Waxing,,De-tan,Pedicure,,,,,Threading,Hair Cut,,3223,Suganya Sri,Card,Pinky,2024-08-24,34,Saturday
05/11/2024 11:39:00,05/11/2024 11:39,Keerthana,9912990009,,Facial,De-tan,,Manicure,,,Massage,,,,1225,Poornima,Card,Suganya Sri,2024-11-05,45,Tuesday
10/11/2024 17:57:00,10/11/2024 17:57,Kavya,9722942996,,,De-tan,Pedicure,Manicure,Bleaching,Wash,Massage,,Hair Cut,,574,Anjali,PhonePe,,2024-11-10,45,Sunday
18/11/2024 14:47:00,18/11/2024 14:47,Aishwarya,9349046186,,,De-tan,,,Bleaching,,,,,Miscellaneous,1873,Pinky,Card,Malar,2024-11-18,47,Monday
14/10/2024 18:51:00,14/10/2024 18:51,Kavya,9489674655,Waxing,Facial,,,,Bleaching,Wash,Massage,Threading,Hair Cut,,2817,Pinky,PhonePe,,2024-10-14,42,Monday
08/10/2024 18:50:00,08/10/2024 18:50,Aishwarya,9298579530,Waxing,Facial,De-tan,Pedicure,,,,,,,Miscellaneous,2451,Poornima,GPay,,2024-10-08,41,Tuesday
12/11/2024 18:11:00,12/11/2024 18:11,Keerthana,9925498464,Waxing,Facial,De-tan,,Manicure,,,Massage,,,Miscellaneous,2446,Malar,PhonePe,Malar,2024-11-12,46,Tuesday
25/10/2024 20:17:00,25/10/2024 20:17,Sangeetha,9557698128,,Facial,De-tan,,Manicure,Bleaching,Wash,Massage,,Hair Cut,,982,Malar,PhonePe,,2024-10-25,43,Friday
07/09/2024 09:38:00,07/09/2024 09:38,Latha,9675032837,Waxing,Facial,,,,Bleaching,Wash,Massage,,Hair Cut,,3439,Suganya Sri,GPay,Suganya Sri,2024-09-07,36,Saturday
12/10/2024 12:34:00,12/10/2024 12:34,Ranjani,9784060204,,Facial,,,Manicure,Bleaching,Wash,,,Hair Cut,Miscellaneous,1961,Malar,PhonePe,Pinky,2024-10-12,41,Saturday
09/10/2024 18:16:00,09/10/2024 18:16,Sandhya,9264006470,Waxing,,,,,,Wash,,Threading,,Miscellaneous,2830,Pinky,Card,Malar,2024-10-09,41,Wednesday
10/11/2024 13:39:00,10/11/2024 13:39,Divya,9654568168,Waxing,Facial,De-tan,Pedicure,Manicure,Bleaching,Wash,Massage,,Hair Cut,,1773,Anjali,PhonePe,,2024-11-10,45,Sunday
14/11/2024 17:36:00,14/11/2024 17:36,Sandhya,9689444019,,,,,,,Wash,Massage,,Hair Cut,Miscellaneous,2105,Malar,Card,Anjali,2024-11-14,46,Thursday
13/09/2024 09:13:00,13/09/2024 09:13,Sangeetha,9578603907,,,De-tan,Pedicure,,,Wash,Massage,Threading,Hair Cut,Miscellaneous,1194,Malar,GPay,,2024-09-13,37,Friday
01/11/2024 13:31:00,01/11/2024 13:31,Divya,9667970029,Waxing,,De-tan,Pedicure,,,,Massage,,,,2324,Anjali,Cash,Poornima,2024-11-01,44,Friday
27/08/2024 10:49:00,27/08/2024 10:49,Ranjani,9761550911,,,,,,,Wash,,,Hair Cut,,3212,Pinky,PhonePe,Suganya Sri,2024-08-27,35,Tuesday
14/11/2024 10:25:00,14/11/2024 10:25,Swathi,9451978150,Waxing,Facial,De-tan,Pedicure,,,,,Threading,Hair Cut,,1905,Malar,Card,Suganya Sri,2024-11-14,46,Thursday
22/09/2024 20:01:00,22/09/2024 20:01,Swathi,9217559467,,,De-tan,,,,,,,,Miscellaneous,2198,Anjali,Cash,Poornima,2024-09-22,38,Sunday
16/09/2024 19:44:00,16/09/2024 19:44,Divya,9747690028,Waxing,,De-tan,Pedicure,Manicure,Bleaching,Wash,,Threading,Hair Cut,Miscellaneous,224,Suganya Sri,GPay,,2024-09-16,38,Monday
22/09/2024 11:39:00,22/09/2024 11:39,Swathi,9177105620,Waxing,,,,Manicure,,,Massage,Threading,,,1984,Malar,GPay,Pinky,2024-09-22,38,Sunday
27/08/2024 17:35:00,27/08/2024 17:35,Nisha,9329047002,,,De-tan,,Manicure,Bleaching,,,Threading,,,2694,Anjali,GPay,,2024-08-27,35,Tuesday
23/08/2024 10:08:00,23/08/2024 10:08,Latha,9907109151,Waxing,Facial,,Pedicure,,Bleaching,Wash,Massage,Threading,,,1755,Suganya Sri,PhonePe,,2024-08-23,34,Friday
29/10/2024 17:45:00,29/10/2024 17:45,Anjali,9333726569,,,De-tan,Pedicure,Manicure,Bleaching,Wash,,Threading,Hair Cut,,318,Pinky,Cash,,2024-10-29,44,Tuesday
10/11/2024 16:25:00,10/11/2024 16:25,Shruthi,9127651231,,,De-tan,Pedicure,,Bleaching,Wash,,,Hair Cut,,1729,Pinky,GPay,,2024-11-10,45,Sunday
16/09/2024 11:05:00,16/09/2024 11:05,Ranjani,9447531706,,Facial,De-tan,Pedicure,,,,,,Hair Cut,Miscellaneous,211,Malar,GPay,Suganya Sri,2024-09-16,38,Monday
07/09/2024 17:09:00,07/09/2024 17:09,Keerthana,9494800474,Waxing,Facial,De-tan,,Manicure,,,,Threading,Hair Cut,,1162,Anjali,GPay,,2024-09-07,36,Saturday
07/11/2024 14:36:00,07/11/2024 14:36,Sangeetha,9108662828,Waxing,,De-tan,Pedicure,,Bleaching,,Massage,Threading,Hair Cut,Miscellaneous,3316,Anjali,GPay,Anjali,2024-11-07,45,Thursday
26/08/2024 20:18:00,26/08/2024 20:18,Sandhya,9679035677,Waxing,Facial,De-tan,Pedicure,,,Wash,Massage,,Hair Cut,,1238,Suganya Sri,PhonePe,,2024-08-26,35,Monday
16/11/2024 12:41:00,16/11/2024 12:41,Meena,9717473159,Waxing,Facial,De-tan,,Manicure,Bleaching,Wash,,,,Miscellaneous,3090,Suganya Sri,Cash,,2024-11-16,46,Saturday
19/10/2024 11:31:00,19/10/2024 11:31,Soumya,9928575375,,,De-tan,Pedicure,,,,,,,Miscellaneous,702,Pinky,PhonePe,,2024-10-19,42,Saturday
29/10/2024 12:40:00,29/10/2024 12:40,Nisha,9172807917,,,De-tan,,,Bleaching,Wash,Massage,Threading,Hair Cut,Miscellaneous,411,Malar,Card,,2024-10-29,44,Tuesday
04/10/2024 10:03:00,04/10/2024 10:03,Kavya,9373066494,,,,Pedicure,Manicure,Bleaching,Wash,,,,,1566,Pinky,Cash,Pinky,2024-10-04,40,Friday
17/11/2024 09:30:00,17/11/2024 09:30,Kavya,9357054881,Waxing,,De-tan,Pedicure,,,Wash,Massage,Threading,,Miscellaneous,1944,Poornima,Cash,Malar,2024-11-17,46,Sunday
10/09/2024 15:20:00,10/09/2024 15:20,Harini,9294725928,Waxing,Facial,,Pedicure,Manicure,,,Massage,,Hair Cut,,1822,Malar,Card,,2024-09-10,37,Tuesday
17/10/2024 17:05:00,17/10/2024 17:05,Sandhya,9163850895,,Facial,,Pedicure,,,Wash,,,,Miscellaneous,1333,Suganya Sri,Card,Poornima,2024-10-17,42,Thursday
31/08/2024 10:13:00,31/08/2024 10:13,Swathi,9205854019,,Facial,,Pedicure,,Bleaching,Wash,Massage,Threading,,,603,Anjali,PhonePe,,2024-08-31,35,Saturday
11/09/2024 09:09:00,11/09/2024 09:09,Harini,9568954505,Waxing,Facial,De-tan,Pedicure,Manicure,Bleaching,,Massage,Threading,,,2295,Malar,PhonePe,,2024-09-11,37,Wednesday
16/09/2024 12:47:00,16/09/2024 12:47,Nisha,9134682453,Waxing,Facial,,,Manicure,,,Massage,,Hair Cut,,2684,Anjali,Card,,2024-09-16,38,Monday
19/10/2024 13:19:00,19/10/2024 13:19,Meena,9523910759,,,De-tan,Pedicure,Manicure,,,,,,,3412,Anjali,PhonePe,Suganya Sri,2024-10-19,42,Saturday
19/11/2024 09:08:00,19/11/2024 09:08,Nisha,9550294822,Waxing,,,,,Bleaching,Wash,,Threading,,,3396,Suganya Sri,PhonePe,Poornima,2024-11-19,47,Tuesday
19/11/2024 13:57:00,19/11/2024 13:57,Divya,9196208759,,Facial,De-tan,,,,,Massage,,Hair Cut,Miscellaneous,1881,Suganya Sri,PhonePe,,2024-11-19,47,Tuesday
08/11/2024 20:06:00,08/11/2024 20:06,Kavya,9690407223,,,,Pedicure,,Bleaching,,Massage,,,Miscellaneous,1908,Malar,Card,,2024-11-08,45,Friday
17/10/2024 19:47:00,17/10/2024 19:47,Sangeetha,9179076687,,,,Pedicure,,,Wash,Massage,Threading,Hair Cut,Miscellaneous,2659,Pinky,PhonePe,,2024-10-17,42,Thursday
09/11/2024 13:51:00,09/11/2024 13:51,Priya,9997417691,,Facial,De-tan,,Manicure,,,Massage,Threading,,,3278,Suganya Sri,GPay,Pinky,2024-11-09,45,Saturday
18/10/2024 20:11:00,18/10/2024 20:11,Kavya,9792820093,,Facial,,,,Bleaching,,Massage,,,Miscellaneous,245,Poornima,Card,Pinky,2024-10-18,42,Friday
28/08/2024 17:33:00,28/08/2024 17:33,Divya,9410649111,Waxing,Facial,De-tan,Pedicure,Manicure,,,Massage,,,,816,Malar,GPay,Poornima,2024-08-28,35,Wednesday
02/09/2024 17:53:00,02/09/2024 17:53,Swathi,9842240567,,,De-tan,Pedicure,,Bleaching,Wash,,,,Miscellaneous,3246,Pinky,GPay,,2024-09-02,36,Monday
23/09/2024 12:25:00,23/09/2024 12:25,Sangeetha,9849269371,,Facial,De-tan,,,Bleaching,Wash,,Threading,Hair Cut,,869,Anjali,GPay,,2024-09-23,39,Monday
17/10/2024 14:12:00,17/10/2024 14:12,Meena,9541617932,,,De-tan,,Manicure,,Wash,,Threading,Hair Cut,Miscellaneous,2068,Malar,PhonePe,,2024-10-17,42,Thursday
08/11/2024 16:29:00,08/11/2024 16:29,Kavya,9878126580,Waxing,,,,,Bleaching,Wash,,,Hair Cut,Miscellaneous,1466,Suganya Sri,Card,,2024-11-08,45,Friday
06/11/2024 18:51:00,06/11/2024 18:51,Shruthi,9748984083,Waxing,Facial,De-tan,Pedicure,Manicure,,,Massage,,Hair Cut,Miscellaneous,479,Suganya Sri,PhonePe,,2024-11-06,45,Wednesday
30/08/2024 13:56:00,30/08/2024 13:56,Soumya,9579504017,Waxing,,,Pedicure,Manicure,,,,Threading,Hair Cut,,3354,Anjali,GPay,Anjali,2024-08-30,35,Friday
24/09/2024 14:34:00,24/09/2024 14:34,Keerthana,9919986906,Waxing,,De-tan,Pedicure,,Bleaching,Wash,Massage,Threading,Hair Cut,,996,Anjali,GPay,,2024-09-24,39,Tuesday
25/08/2024 18:09:00,25/08/2024 18:09,Kavya,9642593838,Waxing,,De-tan,,,,Wash,Massage,,Hair Cut,Miscellaneous,2875,Malar,Card,,2024-08-25,34,Sunday
31/08/2024 15:16:00,31/08/2024 15:16,Divya,9519945387,Waxing,Facial,,Pedicure,,Bleaching,,Massage,Threading,,,2951,Suganya Sri,PhonePe,Malar,2024-08-31,35,Saturday
26/09/2024 17:12:00,26/09/2024 17:12,Ranjani,9133520303,Waxing,,De-tan,,Manicure,,,Massage,,Hair Cut,Miscellaneous,3144,Pinky,Cash,Anjali,2024-09-26,39,Thursday
29/08/2024 10:00:00,29/08/2024 10:00,Shruthi,9752344056,,Facial,De-tan,,Manicure,,,Massage,Threading,,,2125,Pinky,GPay,,2024-08-29,35,Thursday
02/09/2024 09:00:00,02/09/2024 09:00,Harini,9994688664,Waxing,Facial,,,Manicure,Bleaching,Wash,Massage,,Hair Cut,,1259,Anjali,Cash,,2024-09-02,36,Monday
12/10/2024 16:22:00,12/10/2024 16:22,Soumya,9484929259,Waxing,Facial,,Pedicure,,,Wash,,,,Miscellaneous,839,Suganya Sri,GPay,Malar,2024-10-12,41,Saturday
17/11/2024 14:14:00,17/11/2024 14:14,Latha,9398431678,,,De-tan,,Manicure,Bleaching,Wash,Massage,Threading,Hair Cut,,1807,Malar,GPay,,2024-11-17,46,Sunday
29/08/2024 18:24:00,29/08/2024 18:24,Anjali,9285930302,Waxing,Facial,De-tan,Pedicure,Manicure,,Wash,,Threading,Hair Cut,Miscellaneous,3381,Pinky,GPay,,2024-08-29,35,Thursday
26/08/2024 11:50:00,26/08/2024 11:50,Swathi,9101491259,Waxing,,,,,,Wash,,,,Miscellaneous,3317,Suganya Sri,Card,,2024-08-26,35,Monday
05/11/2024 16:29:00,05/11/2024 16:29,Anjali,9400261162,Waxing,Facial,,Pedicure,,,Wash,,,,Miscellaneous,676,Suganya Sri,GPay,Anjali,2024-11-05,45,Tuesday
12/11/2024 18:48:00,12/11/2024 18:48,Divya,9539336935,Waxing,,,,,Bleaching,,,Threading,Hair Cut,,3221,Poornima,Cash,,2024-11-12,46,Tuesday
03/10/2024 20:13:00,03/10/2024 20:13,Ranjani,9552071395,Waxing,,De-tan,,Manicure,Bleaching,Wash,,Threading,Hair Cut,Miscellaneous,2114,Malar,GPay,,2024-10-03,40,Thursday
01/09/2024 18:19:00,01/09/2024 18:19,Swathi,9998817767,,Facial,,Pedicure,,Bleaching,Wash,Massage,Threading,Hair Cut,Miscellaneous,1964,Malar,GPay,Malar,2024-09-01,35,Sunday
20/10/2024 19:11:00,20/10/2024 19:11,Swathi,9365761590,,Facial,,,,,,,,Hair Cut,,2717,Pinky,Card,,2024-10-20,42,Sunday
09/11/2024 16:08:00,09/11/2024 16:08,Nisha,9440144862,Waxing,,,Pedicure,,Bleaching,,,Threading,Hair Cut,Miscellaneous,539,Malar,Card,,2024-11-09,45,Saturday
08/10/2024 09:49:00,08/10/2024 09:49,Swathi,9368581112,Waxing,,,,,,Wash,Massage,Threading,Hair Cut,Miscellaneous,3254,Anjali,GPay,,2024-10-08,41,Tuesday
30/08/2024 13:20:00,30/08/2024 13:20,Meena,9733087120,Waxing,Facial,De-tan,Pedicure,,Bleaching,Wash,Massage,,Hair Cut,,799,Pinky,Card,Pinky,2024-08-30,35,Friday
23/10/2024 11:17:00,23/10/2024 11:17,Shruthi,9411713863,,,De-tan,Pedicure,,,Wash,Massage,,,Miscellaneous,1135,Anjali,GPay,Pinky,2024-10-23,43,Wednesday
29/09/2024 16:40:00,29/09/2024 16:40,Swathi,9243722066,Waxing,Facial,,Pedicure,,Bleaching,Wash,,Threading,,Miscellaneous,2371,Suganya Sri,PhonePe,,2024-09-29,39,Sunday
14/10/2024 15:40:00,14/10/2024 15:40,Nisha,9625289331,,Facial,,,Manicure,Bleaching,Wash,,Threading,Hair Cut,,1573,Suganya Sri,PhonePe,,2024-10-14,42,Monday
26/10/2024 16:16:00,26/10/2024 16:16,Deepa,9863090278,,Facial,,Pedicure,Manicure,,Wash,Massage,Threading,,Miscellaneous,1068,Pinky,PhonePe,Malar,2024-10-26,43,Saturday
18/09/2024 19:30:00,18/09/2024 19:30,Harini,9981452359,,Facial,De-tan,Pedicure,Manicure,Bleaching,Wash,,Threading,,Miscellaneous,373,Anjali,GPay,Malar,2024-09-18,38,Wednesday
13/10/2024 13:04:00,13/10/2024 13:04,Keerthana,9475685609,Waxing,,De-tan,,,Bleaching,Wash,,,,,2402,Pinky,GPay,Pinky,2024-10-13,41,Sunday
10/10/2024 20:17:00,10/10/2024 20:17,Anjali,9320216056,,,De-tan,Pedicure,,Bleaching,,,,,,1191,Malar,PhonePe,,2024-10-10,41,Thursday
05/09/2024 17:25:00,05/09/2024 17:25,Soumya,9455498884,,Facial,,Pedicure,,Bleaching,Wash,Massage,Threading,Hair Cut,,2060,Pinky,Card,,2024-09-05,36,Thursday
20/10/2024 11:03:00,20/10/2024 11:03,Divya,9321538030,Waxing,,,Pedicure,Manicure,Bleaching,Wash,Massage,Threading,Hair Cut,Miscellaneous,1838,Anjali,Cash,Suganya Sri,2024-10-20,42,Sunday
16/11/2024 12:18:00,16/11/2024 12:18,Divya,9936864891,,,De-tan,,Manicure,,,,,Hair Cut,Miscellaneous,208,Malar,GPay,,2024-11-16,46,Saturday
22/09/2024 13:30:00,22/09/2024 13:30,Shruthi,9493967673,,,,Pedicure,,Bleaching,,,Threading,Hair Cut,Miscellaneous,2475,Malar,GPay,,2024-09-22,38,Sunday
15/09/2024 17:35:00,15/09/2024 17:35,Anjali,9641203754,,Facial,,Pedicure,Manicure,Bleaching,Wash,Massage,Threading,Hair Cut,,601,Malar,GPay,,2024-09-15,37,Sunday
30/08/2024 10:30:00,30/08/2024 10:30,Kavya,9995118004,Waxing,Facial,De-tan,Pedicure,Manicure,Bleaching,Wash,Massage,Threading,Hair Cut,,2093,Pinky,Cash,,2024-08-30,35,Friday
20/10/2024 14:37:00,20/10/2024 14:37,Meena,9972852586,,,,Pedicure,Manicure,Bleaching,Wash,Massage,Threading,,Miscellaneous,2756,Pinky,GPay,,2024-10-20,42,Sunday
27/08/2024 15:06:00,27/08/2024 15:06,Deepa,9776266665,,Facial,De-tan,Pedicure,,,Wash,Massage,,Hair Cut,Miscellaneous,2070,Suganya Sri,PhonePe,,2024-08-27,35,Tuesday
19/11/2024 18:32:00,19/11/2024 18:32,Kavya,9551527848,Waxing,Facial,,,,,,,,,Miscellaneous,3082,Poornima,Card,Malar,2024-11-19,47,Tuesday
11/11/2024 18:02:00,11/11/2024 18:02,Deepa,9169852109,,Facial,,,Manicure,,Wash,,Threading,Hair Cut,Miscellaneous,2683,Poornima,PhonePe,Malar,2024-11-11,46,Monday
31/08/2024 18:58:00,31/08/2024 18:58,Nisha,9865015757,Waxing,,De-tan,,,Bleaching,,Massage,,,,549,Anjali,GPay,Poornima,2024-08-31,35,Saturday
15/09/2024 19:48:00,15/09/2024 19:48,Harini,9320106153,Waxing,Facial,De-tan,Pedicure,,,Wash,Massage,,Hair Cut,Miscellaneous,510,Suganya Sri,Cash,,2024-09-15,37,Sunday
12/11/2024 17:23:00,12/11/2024 17:23,Nisha,9159925950,Waxing,Facial,De-tan,,,Bleaching,,,,Hair Cut,Miscellaneous,1263,Suganya Sri,GPay,Poornima,2024-11-12,46,Tuesday
08/09/2024 18:11:00,08/09/2024 18:11,Aishwarya,9391479768,Waxing,Facial,,Pedicure,,Bleaching,,,Threading,,,516,Anjali,PhonePe,Anjali,2024-09-08,36,Sunday
19/11/2024 20:02:00,19/11/2024 20:02,Meena,9895002095,,Facial,,Pedicure,,,Wash,Massage,Threading,,,2740,Pinky,Card,,2024-11-19,47,Tuesday
14/09/2024 12:58:00,14/09/2024 12:58,Meena,9600021148,Waxing,Facial,,,,,Wash,Massage,Threading,Hair Cut,,2719,Poornima,PhonePe,,2024-09-14,37,Saturday
08/10/2024 13:59:00,08/10/2024 13:59,Aishwarya,9132254380,,,De-tan,Pedicure,,Bleaching,,,Threading,,Miscellaneous,2310,Pinky,Cash,,2024-10-08,41,Tuesday
19/10/2024 09:14:00,19/10/2024 09:14,Harini,9411167567,Waxing,Facial,,,Manicure,,,,Threading,,Miscellaneous,3386,Poornima,Card,,2024-10-19,42,Saturday
07/09/2024 17:30:00,07/09/2024 17:30,Sangeetha,9869797484,,Facial,,,Manicure,Bleaching,Wash,,,Hair Cut,Miscellaneous,2082,Poornima,Cash,,2024-09-07,36,Saturday
30/08/2024 12:24:00,30/08/2024 12:24,Divya,9272230643,Waxing,Facial,,Pedicure,,Bleaching,Wash,Massage,Threading,,,319,Pinky,Cash,,2024-08-30,35,Friday
27/08/2024 19:33:00,27/08/2024 19:33,Sandhya,9548820556,Waxing,,De-tan,,,,,,,Hair Cut,Miscellaneous,1302,Pinky,Cash,,2024-08-27,35,Tuesday
14/09/2024 15:42:00,14/09/2024 15:42,Aishwarya,9277151660,Waxing,,De-tan,Pedicure,,Bleaching,Wash,Massage,Threading,,,2675,Suganya Sri,GPay,Malar,2024-09-14,37,Saturday
01/09/2024 12:03:00,01/09/2024 12:03,Divya,9359643921,,Facial,De-tan,,,Bleaching,Wash,Massage,Threading,Hair Cut,Miscellaneous,3046,Anjali,Card,Anjali,2024-09-01,35,Sunday
04/11/2024 19:41:00,04/11/2024 19:41,Divya,9232918826,Waxing,,De-tan,,,Bleaching,Wash,Massage,,Hair Cut,,399,Anjali,PhonePe,,2024-11-04,45,Monday
12/10/2024 10:34:00,12/10/2024 10:34,Nisha,9265970014,,Facial,De-tan,Pedicure,,Bleaching,,Massage,,Hair Cut,Miscellaneous,1531,Suganya Sri,Cash,Suganya Sri,2024-10-12,41,Saturday
09/11/2024 17:15:00,09/11/2024 17:15,Aishwarya,9723494591,,,De-tan,Pedicure,,Bleaching,,Massage,,,Miscellaneous,1538,Malar,Card,Anjali,2024-11-09,45,Saturday
20/10/2024 10:29:00,20/10/2024 10:29,Meena,9290578665,Waxing,Facial,De-tan,,Manicure,,Wash,Massage,Threading,,Miscellaneous,1419,Pinky,Cash,,2024-10-20,42,Sunday
10/10/2024 17:25:00,10/10/2024 17:25,Sandhya,9321923853,Waxing,Facial,,Pedicure,,,Wash,Massage,Threading,,Miscellaneous,3077,Anjali,Card,,2024-10-10,41,Thursday
02/11/2024 16:18:00,02/11/2024 16:18,Sandhya,9555261007,,Facial,De-tan,Pedicure,,,,Massage,,,Miscellaneous,1666,Pinky,Card,,2024-11-02,44,Saturday
22/09/2024 14:34:00,22/09/2024 14:34,Priya,9178370431,,,,,,Bleaching,,,Threading,Hair Cut,,952,Poornima,Cash,Anjali,2024-09-22,38,Sunday
23/09/2024 09:06:00,23/09/2024 09:06,Priya,9173143108,,Facial,,,Manicure,Bleaching,,,Threading,,,1674,Pinky,GPay,Anjali,2024-09-23,39,Monday
19/10/2024 15:41:00,19/10/2024 15:41,Priya,9980217105,Waxing,,De-tan,Pedicure,,,,Massage,,,,152,Pinky,Card,Suganya Sri,2024-10-19,42,Saturday
31/08/2024 11:42:00,31/08/2024 11:42,Latha,9266763982,,,,Pedicure,Manicure,Bleaching,,,Threading,Hair Cut,Miscellaneous,1990,Anjali,PhonePe,,2024-08-31,35,Saturday
05/09/2024 13:42:00,05/09/2024 13:42,Ranjani,9327964638,,,De-tan,,,Bleaching,,,Threading,,Miscellaneous,2650,Malar,Cash,,2024-09-05,36,Thursday
16/11/2024 11:27:00,16/11/2024 11:27,Divya,9778407003,Waxing,Facial,De-tan,Pedicure,Manicure,Bleaching,Wash,Massage,,Hair Cut,,1802,Suganya Sri,GPay,,2024-11-16,46,Saturday
15/10/2024 20:08:00,15/10/2024 20:08,Soumya,9107223542,,Facial,De-tan,,,Bleaching,Wash,,Threading,,Miscellaneous,648,Anjali,PhonePe,Malar,2024-10-15,42,Tuesday
16/10/2024 20:47:00,16/10/2024 20:47,Divya,9750783370,,Facial,,Pedicure,,,,,,,Miscellaneous,3156,Poornima,Card,Pinky,2024-10-16,42,Wednesday
29/08/2024 10:30:00,29/08/2024 10:30,Divya,9392293921,,Facial,De-tan,Pedicure,Manicure,Bleaching,Wash,,,Hair Cut,,1052,Pinky,Card,Poornima,2024-08-29,35,Thursday
07/09/2024 17:08:00,07/09/2024 17:08,Sangeetha,9990145497,,Facial,,Pedicure,Manicure,,Wash,,,Hair Cut,,1643,Anjali,GPay,Pinky,2024-09-07,36,Saturday
10/11/2024 09:36:00,10/11/2024 09:36,Sangeetha,9986130570,Waxing,Facial,,Pedicure,Manicure,,Wash,,,,Miscellaneous,2401,Suganya Sri,GPay,,2024-11-10,45,Sunday
07/11/2024 15:41:00,07/11/2024 15:41,Latha,9593373445,,,,,Manicure,Bleaching,Wash,Massage,,,Miscellaneous,3287,Poornima,PhonePe,,2024-11-07,45,Thursday
03/09/2024 15:02:00,03/09/2024 15:02,Swathi,9294653247,Waxing,Facial,De-tan,Pedicure,Manicure,,,,Threading,Hair Cut,Miscellaneous,2292,Suganya Sri,GPay,Malar,2024-09-03,36,Tuesday
05/09/2024 17:17:00,05/09/2024 17:17,Shruthi,9931058888,,,De-tan,Pedicure,Manicure,Bleaching,,Massage,,,,2099,Suganya Sri,Card,,2024-09-05,36,Thursday
02/11/2024 12:52:00,02/11/2024 12:52,Anjali,9852684302,Waxing,Facial,De-tan,,,,,,Threading,Hair Cut,Miscellaneous,2211,Anjali,PhonePe,Malar,2024-11-02,44,Saturday
17/09/2024 12:19:00,17/09/2024 12:19,Latha,9338862956,Waxing,Facial,,Pedicure,,Bleaching,,,,Hair Cut,Miscellaneous,2136,Poornima,Cash,,2024-09-17,38,Tuesday
20/10/2024 14:49:00,20/10/2024 14:49,Deepa,9435498756,Waxing,Facial,De-tan,Pedicure,Manicure,,Wash,,,,Miscellaneous,1842,Poornima,Cash,,2024-10-20,42,Sunday
27/08/2024 09:00:00,27/08/2024 09:00,Sandhya,9807205120,,,De-tan,Pedicure,Manicure,Bleaching,,Massage,Threading,Hair Cut,,3275,Suganya Sri,PhonePe,Pinky,2024-08-27,35,Tuesday
20/09/2024 17:33:00,20/09/2024 17:33,Meena,9885649774,Waxing,Facial,De-tan,Pedicure,Manicure,Bleaching,Wash,Massage,Threading,Hair Cut,,189,Pinky,Cash,,2024-09-20,38,Friday
03/11/2024 17:21:00,03/11/2024 17:21,Shruthi,9851274347,Waxing,Facial,De-tan,Pedicure,,Bleaching,Wash,Massage,,Hair Cut,Miscellaneous,1914,Suganya Sri,Cash,,2024-11-03,44,Sunday
02/09/2024 10:40:00,02/09/2024 10:40,Meena,9720436523,Waxing,Facial,De-tan,,,,,Massage,Threading,,,2561,Anjali,GPay,Anjali,2024-09-02,36,Monday
25/09/2024 20:54:00,25/09/2024 20:54,Meena,9162306708,Waxing,Facial,,Pedicure,,Bleaching,,Massage,Threading,,Miscellaneous,2525,Suganya Sri,GPay,,2024-09-25,39,Wednesday
14/11/2024 13:42:00,14/11/2024 13:42,Ranjani,9981344658,Waxing,,De-tan,Pedicure,Manicure,,Wash,Massage,Threading,,Miscellaneous,3340,Malar,PhonePe,Poornima,2024-11-14,46,Thursday
11/10/2024 20:12:00,11/10/2024 20:12,Soumya,9104870088,Waxing,Facial,De-tan,,,Bleaching,,,,,,567,Suganya Sri,Card,Suganya Sri,2024-10-11,41,Friday
10/11/2024 09:15:00,10/11/2024 09:15,Meena,9724457475,Waxing,,De-tan,,,,,,Threading,,,1219,Poornima,PhonePe,,2024-11-10,45,Sunday
19/11/2024 10:40:00,19/11/2024 10:40,Latha,9432044990,,,De-tan,,,,Wash,Massage,,,Miscellaneous,1405,Pinky,GPay,,2024-11-19,47,Tuesday
03/09/2024 18:26:00,03/09/2024 18:26,Harini,9323369043,,Facial,De-tan,Pedicure,Manicure,Bleaching,Wash,,,,Miscellaneous,2985,Malar,GPay,,2024-09-03,36,Tuesday
09/09/2024 12:54:00,09/09/2024 12:54,Keerthana,9331627096,Waxing,Facial,,,Manicure,,Wash,,Threading,Hair Cut,,2340,Poornima,Cash,Pinky,2024-09-09,37,Monday
05/09/2024 09:51:00,05/09/2024 09:51,Deepa,9516147727,,,De-tan,Pedicure,,,Wash,Massage,,Hair Cut,Miscellaneous,981,Anjali,PhonePe,Anjali,2024-09-05,36,Thursday
14/11/2024 20:22:00,14/11/2024 20:22,Aishwarya,9182907770,Waxing,,,Pedicure,,Bleaching,,,,,,907,Poornima,PhonePe,Pinky,2024-11-14,46,Thursday
11/11/2024 19:45:00,11/11/2024 19:45,Priya,9493121894,Waxing,,De-tan,,,Bleaching,Wash,,,Hair Cut,,2168,Suganya Sri,Card,Anjali,2024-11-11,46,Monday
11/09/2024 15:28:00,11/09/2024 15:28,Kavya,9692641128,Waxing,Facial,,Pedicure,Manicure,,,,Threading,,,2493,Poornima,Cash,,2024-09-11,37,Wednesday
27/10/2024 09:54:00,27/10/2024 09:54,Keerthana,9255490025,Waxing,Facial,,Pedicure,Manicure,,,,,,,992,Poornima,PhonePe,,2024-10-27,43,Sunday
02/11/2024 20:50:00,02/11/2024 20:50,Ranjani,9654994328,Waxing,,De-tan,Pedicure,Manicure,,,Massage,Threading,Hair Cut,Miscellaneous,1779,Pinky,Cash,Pinky,2024-11-02,44,Saturday
16/11/2024 13:50:00,16/11/2024 13:50,Anjali,9783096219,Waxing,,,,Manicure,,Wash,,,Hair Cut,,3011,Anjali,PhonePe,,2024-11-16,46,Saturday
25/10/2024 16:07:00,25/10/2024 16:07,Ranjani,9780380730,Waxing,Facial,,,,Bleaching,Wash,,Threading,Hair Cut,Miscellaneous,3059,Pinky,Card,Suganya Sri,2024-10-25,43,Friday
29/10/2024 09:21:00,29/10/2024 09:21,Priya,9968284765,,Facial,De-tan,Pedicure,Manicure,,,Massage,Threading,Hair Cut,Miscellaneous,3181,Malar,Card,,2024-10-29,44,Tuesday
28/08/2024 18:55:00,28/08/2024 18:55,Anjali,9414174849,Waxing,Facial,De-tan,,,,Wash,,Threading,,,2363,Poornima,PhonePe,,2024-08-28,35,Wednesday
15/10/2024 20:46:00,15/10/2024 20:46,Sandhya,9971065893,,,De-tan,Pedicure,,,Wash,,Threading,,,1468,Suganya Sri,GPay,Pinky,2024-10-15,42,Tuesday
17/09/2024 20:18:00,17/09/2024 20:18,Deepa,9257776778,Waxing,,,,Manicure,,,,,,Miscellaneous,1145,Suganya Sri,GPay,Poornima,2024-09-17,38,Tuesday
30/10/2024 09:01:00,30/10/2024 09:01,Ranjani,9681312598,Waxing,Facial,De-tan,,,,Wash,,Threading,,,2252,Suganya Sri,GPay,Pinky,2024-10-30,44,Wednesday
23/08/2024 11:55:00,23/08/2024 11:55,Swathi,9955169784,,Facial,De-tan,,Manicure,Bleaching,Wash,Massage,Threading,Hair Cut,Miscellaneous,1110,Malar,Cash,Poornima,2024-08-23,34,Friday
04/09/2024 14:05:00,04/09/2024 14:05,Meena,9194485684,Waxing,Facial,De-tan,,,Bleaching,,Massage,Threading,Hair Cut,,1308,Pinky,GPay,Malar,2024-09-04,36,Wednesday
01/09/2024 18:06:00,01/09/2024 18:06,Harini,9645419115,,Facial,,Pedicure,Manicure,Bleaching,,,Threading,Hair Cut,,346,Malar,PhonePe,,2024-09-01,35,Sunday
03/09/2024 19:19:00,03/09/2024 19:19,Priya,9402550068,,,De-tan,Pedicure,,,Wash,Massage,,,Miscellaneous,1671,Anjali,Card,Anjali,2024-09-03,36,Tuesday
24/09/2024 15:00:00,24/09/2024 15:00,Shruthi,9665812233,,,De-tan,Pedicure,,,,Massage,,,Miscellaneous,1785,Poornima,Card,,2024-09-24,39,Tuesday
29/09/2024 20:22:00,29/09/2024 20:22,Harini,9826302515,,,De-tan,,,Bleaching,,,Threading,Hair Cut,,3431,Poornima,Card,Suganya Sri,2024-09-29,39,Sunday
16/10/2024 19:51:00,16/10/2024 19:51,Swathi,9544977195,Waxing,,De-tan,Pedicure,,,Wash,Massage,,Hair Cut,,3000,Pinky,Cash,,2024-10-16,42,Wednesday
30/09/2024 15:55:00,30/09/2024 15:55,Soumya,9225436900,Waxing,Facial,,Pedicure,Manicure,Bleaching,,Massage,Threading,Hair Cut,,2392,Poornima,PhonePe,Poornima,2024-09-30,40,Monday
27/10/2024 15:23:00,27/10/2024 15:23,Shruthi,9583803440,,Facial,De-tan,,Manicure,,,,,,Miscellaneous,3484,Poornima,Card,,2024-10-27,43,Sunday
15/09/2024 11:25:00,15/09/2024 11:25,Sangeetha,9787497177,,,De-tan,Pedicure,,Bleaching,Wash,,,,,1556,Suganya Sri,PhonePe,Pinky,2024-09-15,37,Sunday
07/10/2024 20:11:00,07/10/2024 20:11,Keerthana,9830602409,Waxing,,,,,Bleaching,,,,,,786,Poornima,Card,,2024-10-07,41,Monday
18/09/2024 20:13:00,18/09/2024 20:13,Priya,9266808443,Waxing,Facial,,Pedicure,Manicure,,Wash,Massage,,,,623,Suganya Sri,Cash,,2024-09-18,38,Wednesday
14/11/2024 11:47:00,14/11/2024 11:47,Latha,9537567591,,Facial,,Pedicure,Manicure,Bleaching,Wash,Massage,,,Miscellaneous,1397,Poornima,Card,,2024-11-14,46,Thursday
16/09/2024 14:04:00,16/09/2024 14:04,Latha,9178052501,Waxing,,,,Manicure,Bleaching,,Massage,,,,2771,Malar,GPay,,2024-09-16,38,Monday
28/08/2024 15:30:00,28/08/2024 15:30,Harini,9642748896,,Facial,,,,,Wash,,Threading,,,2854,Suganya Sri,PhonePe,Pinky,2024-08-28,35,Wednesday
11/11/2024 14:54:00,11/11/2024 14:54,Shruthi,9507600965,,Facial,,,Manicure,Bleaching,Wash,,,Hair Cut,,1690,Pinky,Cash,,2024-11-11,46,Monday
20/10/2024 17:52:00,20/10/2024 17:52,Sandhya,9831495633,,,De-tan,Pedicure,Manicure,,,,,,,811,Malar,GPay,,2024-10-20,42,Sunday
30/10/2024 19:21:00,30/10/2024 19:21,Ranjani,9407984225,Waxing,,,Pedicure,Manicure,Bleaching,,Massage,,Hair Cut,Miscellaneous,1562,Poornima,GPay,,2024-10-30,44,Wednesday
08/10/2024 20:48:00,08/10/2024 20:48,Ranjani,9480445663,Waxing,,,,,,,,Threading,,Miscellaneous,2368,Poornima,Card,Poornima,2024-10-08,41,Tuesday
16/11/2024 18:53:00,16/11/2024 18:53,Priya,9416247438,,,De-tan,Pedicure,,Bleaching,Wash,,,,Miscellaneous,781,Suganya Sri,PhonePe,,2024-11-16,46,Saturday
04/09/2024 14:46:00,04/09/2024 14:46,Latha,9875642190,,Facial,De-tan,,Manicure,,,Massage,Threading,Hair Cut,,3304,Anjali,GPay,Anjali,2024-09-04,36,Wednesday
29/09/2024 17:35:00,29/09/2024 17:35,Harini,9956989763,Waxing,,De-tan,,,,Wash,,,,,1181,Malar,Card,Poornima,2024-09-29,39,Sunday
06/11/2024 14:18:00,06/11/2024 14:18,Ranjani,9959610328,Waxing,,De-tan,,Manicure,Bleaching,Wash,Massage,,Hair Cut,,3226,Anjali,Cash,,2024-11-06,45,Wednesday
07/09/2024 13:45:00,07/09/2024 13:45,Keerthana,9970473507,Waxing,,De-tan,Pedicure,,Bleaching,Wash,,Threading,Hair Cut,Miscellaneous,683,Poornima,GPay,Pinky,2024-09-07,36,Saturday
07/09/2024 15:06:00,07/09/2024 15:06,Divya,9952297488,Waxing,,,Pedicure,,Bleaching,,,,,,1025,Anjali,Card,,2024-09-07,36,Saturday
23/09/2024 14:06:00,23/09/2024 14:06,Soumya,9720496619,,Facial,De-tan,Pedicure,Manicure,,,Massage,,,Miscellaneous,1640,Suganya Sri,PhonePe,Suganya Sri,2024-09-23,39,Monday
12/09/2024 15:04:00,12/09/2024 15:04,Soumya,9605977560,Waxing,Facial,De-tan,,,Bleaching,,Massage,Threading,Hair Cut,Miscellaneous,1348,Suganya Sri,Card,,2024-09-12,37,Thursday
03/10/2024 15:51:00,03/10/2024 15:51,Ranjani,9777885971,Waxing,Facial,De-tan,Pedicure,,,,,,Hair Cut,Miscellaneous,1655,Pinky,Card,Pinky,2024-10-03,40,Thursday
10/11/2024 15:47:00,10/11/2024 15:47,Keerthana,9332326834,Waxing,,,,Manicure,,,,,,,480,Pinky,GPay,Anjali,2024-11-10,45,Sunday
12/10/2024 11:33:00,12/10/2024 11:33,Soumya,9310609802,,Facial,De-tan,Pedicure,,,,,Threading,Hair Cut,Miscellaneous,975,Malar,GPay,,2024-10-12,41,Saturday
25/08/2024 18:39:00,25/08/2024 18:39,Aishwarya,9433522890,,Facial,,,Manicure,,Wash,,Threading,Hair Cut,,1391,Poornima,Cash,Malar,2024-08-25,34,Sunday
01/09/2024 11:43:00,01/09/2024 11:43,Swathi,9758770094,Waxing,,,Pedicure,,Bleaching,,Massage,Threading,Hair Cut,Miscellaneous,2911,Poornima,GPay,,2024-09-01,35,Sunday
24/09/2024 10:15:00,24/09/2024 10:15,Ranjani,9659700490,,Facial,De-tan,,,Bleaching,,,Threading,Hair Cut,,1750,Malar,GPay,,2024-09-24,39,Tuesday
20/10/2024 13:13:00,20/10/2024 13:13,Anjali,9733624125,Waxing,Facial,De-tan,Pedicure,Manicure,Bleaching,Wash,Massage,Threading,Hair Cut,,363,Suganya Sri,PhonePe,Suganya Sri,2024-10-20,42,Sunday
13/11/2024 11:47:00,13/11/2024 11:47,Divya,9895325834,Waxing,,De-tan,Pedicure,Manicure,Bleaching,Wash,Massage,,Hair Cut,,3297,Malar,Cash,,2024-11-13,46,Wednesday
30/09/2024 16:04:00,30/09/2024 16:04,Sandhya,9594119593,Waxing,Facial,,,Manicure,Bleaching,Wash,,,,Miscellaneous,1363,Pinky,PhonePe,,2024-09-30,40,Monday
28/08/2024 10:10:00,28/08/2024 10:10,Aishwarya,9680778519,,,,Pedicure,Manicure,Bleaching,,Massage,Threading,,,2459,Pinky,PhonePe,Suganya Sri,2024-08-28,35,Wednesday
10/09/2024 10:39:00,10/09/2024 10:39,Aishwarya,9148773717,,Facial,De-tan,Pedicure,,Bleaching,Wash,Massage,Threading,,Miscellaneous,929,Suganya Sri,Card,,2024-09-10,37,Tuesday
22/09/2024 10:21:00,22/09/2024 10:21,Aishwarya,9265315005,,Facial,De-tan,Pedicure,Manicure,Bleaching,Wash,Massage,,,Miscellaneous,2593,Poornima,GPay,Malar,2024-09-22,38,Sunday
24/09/2024 09:42:00,24/09/2024 09:42,Latha,9481392124,Waxing,,,,Manicure,,,Massage,Threading,Hair Cut,Miscellaneous,1890,Anjali,PhonePe,Anjali,2024-09-24,39,Tuesday
25/09/2024 20:29:00,25/09/2024 20:29,Keerthana,9506907588,,Facial,,Pedicure,Manicure,,Wash,Massage,,Hair Cut,,3048,Anjali,GPay,Suganya Sri,2024-09-25,39,Wednesday
21/09/2024 14:29:00,21/09/2024 14:29,Ranjani,9175100852,,Facial,,Pedicure,,Bleaching,Wash,,Threading,Hair Cut,,1892,Suganya Sri,PhonePe,,2024-09-21,38,Saturday
07/10/2024 18:11:00,07/10/2024 18:11,Meena,9208205508,,,,,,Bleaching,,Massage,,,Miscellaneous,257,Pinky,Card,,2024-10-07,41,Monday
24/10/2024 19:35:00,24/10/2024 19:35,Divya,9981320909,Waxing,,,,Manicure,,,Massage,,Hair Cut,,1086,Anjali,GPay,Malar,2024-10-24,43,Thursday
08/09/2024 12:22:00,08/09/2024 12:22,Sangeetha,9786032902,Waxing,Facial,,Pedicure,Manicure,Bleaching,,Massage,Threading,,Miscellaneous,3428,Malar,Card,Malar,2024-09-08,36,Sunday
03/09/2024 09:22:00,03/09/2024 09:22,Swathi,9689418590,Waxing,Facial,,,,,Wash,Massage,,Hair Cut,,725,Suganya Sri,GPay,Anjali,2024-09-03,36,Tuesday
03/11/2024 17:42:00,03/11/2024 17:42,Deepa,9643454900,,Facial,De-tan,,Manicure,Bleaching,Wash,Massage,Threading,Hair Cut,,669,Suganya Sri,Card,Malar,2024-11-03,44,Sunday
14/09/2024 16:38:00,14/09/2024 16:38,Divya,9327208476,,,De-tan,Pedicure,Manicure,Bleaching,Wash,Massage,Threading,,Miscellaneous,1620,Malar,Card,Poornima,2024-09-14,37,Saturday
14/09/2024 14:58:00,14/09/2024 14:58,Shruthi,9795096476,,Facial,,,Manicure,Bleaching,Wash,Massage,,Hair Cut,Miscellaneous,222,Malar,PhonePe,,2024-09-14,37,Saturday
27/08/2024 10:22:00,27/08/2024 10:22,Swathi,9435636574,Waxing,,,Pedicure,,Bleaching,Wash,Massage,,Hair Cut,Miscellaneous,1268,Suganya Sri,GPay,,2024-08-27,35,Tuesday
16/10/2024 15:38:00,16/10/2024 15:38,Deepa,9504561203,Waxing,Facial,De-tan,,Manicure,Bleaching,,,,,,1506,Anjali,GPay,,2024-10-16,42,Wednesday
29/10/2024 19:36:00,29/10/2024 19:36,Nisha,9856113601,,,,Pedicure,,Bleaching,,Massage,Threading,,Miscellaneous,612,Anjali,GPay,,2024-10-29,44,Tuesday
16/10/2024 17:30:00,16/10/2024 17:30,Anjali,9606290968,,Facial,De-tan,Pedicure,,,,,,Hair Cut,,536,Suganya Sri,Cash,,2024-10-16,42,Wednesday
18/10/2024 17:06:00,18/10/2024 17:06,Harini,9149694685,,Facial,,Pedicure,,,Wash,,,,Miscellaneous,3114,Anjali,Cash,,2024-10-18,42,Friday
02/09/2024 17:09:00,02/09/2024 17:09,Shruthi,9833939969,,,,Pedicure,,Bleaching,,,Threading,Hair Cut,Miscellaneous,2670,Malar,PhonePe,Anjali,2024-09-02,36,Monday
17/10/2024 16:52:00,17/10/2024 16:52,Ranjani,9344099269,,,,,,Bleaching,Wash,,Threading,Hair Cut,,1005,Suganya Sri,Card,,2024-10-17,42,Thursday
09/11/2024 20:53:00,09/11/2024 20:53,Shruthi,9399616303,,,,Pedicure,,,Wash,Massage,Threading,,,327,Suganya Sri,Card,Suganya Sri,2024-11-09,45,Saturday
02/09/2024 13:42:00,02/09/2024 13:42,Soumya,9342258077,Waxing,,,,,Bleaching,Wash,Massage,,Hair Cut,Miscellaneous,3404,Malar,Cash,,2024-09-02,36,Monday
16/10/2024 09:25:00,16/10/2024 09:25,Harini,9390035351,Waxing,,,Pedicure,,Bleaching,Wash,,,,Miscellaneous,679,Suganya Sri,Card,,2024-10-16,42,Wednesday
19/11/2024 19:24:00,19/11/2024 19:24,Ranjani,9164865568,,Facial,De-tan,,,Bleaching,,,,Hair Cut,Miscellaneous,3299,Poornima,Cash,Suganya Sri,2024-11-19,47,Tuesday
02/11/2024 15:19:00,02/11/2024 15:19,Nisha,9899412076,,,De-tan,,Manicure,,Wash,Massage,Threading,,Miscellaneous,3032,Malar,PhonePe,Pinky,2024-11-02,44,Saturday
17/10/2024 13:35:00,17/10/2024 13:35,Shruthi,9312786406,,,De-tan,Pedicure,,Bleaching,Wash,,,Hair Cut,Miscellaneous,2438,Suganya Sri,Cash,Malar,2024-10-17,42,Thursday
29/09/2024 10:58:00,29/09/2024 10:58,Harini,9556126625,Waxing,Facial,,,,Bleaching,Wash,,Threading,,,1482,Malar,GPay,,2024-09-29,39,Sunday
22/09/2024 15:09:00,22/09/2024 15:09,Ranjani,9934719268,Waxing,Facial,De-tan,Pedicure,,Bleaching,,Massage,,,,998,Anjali,Card,Suganya Sri,2024-09-22,38,Sunday
31/08/2024 14:39:00,31/08/2024 14:39,Harini,9356333256,,Facial,,Pedicure,,,Wash,Massage,Threading,Hair Cut,Miscellaneous,2423,Poornima,GPay,,2024-08-31,35,Saturday
15/09/2024 15:05:00,15/09/2024 15:05,Deepa,9129247655,,,,,Manicure,Bleaching,,Massage,Threading,,,2686,Malar,GPay,Malar,2024-09-15,37,Sunday
07/11/2024 18:32:00,07/11/2024 18:32,Deepa,9647721476,Waxing,Facial,,,,,Wash,Massage,,Hair Cut,Miscellaneous,549,Anjali,PhonePe,Poornima,2024-11-07,45,Thursday
23/09/2024 09:04:00,23/09/2024 09:04,Harini,9966106099,,,,,,,Wash,,,Hair Cut,,220,Anjali,GPay,Suganya Sri,2024-09-23,39,Monday
01/09/2024 20:21:00,01/09/2024 20:21,Divya,9720637064,,,De-tan,Pedicure,Manicure,Bleaching,Wash,,Threading,,Miscellaneous,428,Poornima,PhonePe,,2024-09-01,35,Sunday
17/09/2024 19:51:00,17/09/2024 19:51,Swathi,9509620757,Waxing,,De-tan,Pedicure,,Bleaching,Wash,,,,,517,Suganya Sri,GPay,Malar,2024-09-17,38,Tuesday
09/10/2024 19:22:00,09/10/2024 19:22,Nisha,9651738610,,Facial,De-tan,,,Bleaching,Wash,,,,,1920,Malar,Cash,Malar,2024-10-09,41,Wednesday
11/09/2024 11:27:00,11/09/2024 11:27,Ranjani,9210360051,Waxing,Facial,De-tan,,,,,Massage,Threading,Hair Cut,,666,Poornima,PhonePe,Malar,2024-09-11,37,Wednesday
18/10/2024 19:05:00,18/10/2024 19:05,Aishwarya,9474650543,,Facial,De-tan,Pedicure,,Bleaching,,Massage,,Hair Cut,Miscellaneous,1208,Poornima,Cash,,2024-10-18,42,Friday
16/09/2024 16:43:00,16/09/2024 16:43,Keerthana,9194781504,,Facial,De-tan,Pedicure,,,,Massage,Threading,Hair Cut,Miscellaneous,2513,Anjali,Card,Pinky,2024-09-16,38,Monday
28/08/2024 17:30:00,28/08/2024 17:30,Nisha,9512967389,,Facial,De-tan,,,,Wash,,,Hair Cut,Miscellaneous,3005,Malar,GPay,,2024-08-28,35,Wednesday
07/11/2024 19:50:00,07/11/2024 19:50,Sandhya,9731712302,Waxing,Facial,,,,Bleaching,Wash,,,,Miscellaneous,3141,Anjali,Card,,2024-11-07,45,Thursday
29/08/2024 15:38:00,29/08/2024 15:38,Meena,9511110133,Waxing,Facial,,Pedicure,Manicure,,Wash,Massage,,,,2824,Suganya Sri,GPay,Malar,2024-08-29,35,Thursday
07/11/2024 20:52:00,07/11/2024 20:52,Soumya,9600788399,,Facial,De-tan,Pedicure,Manicure,Bleaching,,Massage,,,,1725,Malar,Cash,,2024-11-07,45,Thursday
13/11/2024 19:23:00,13/11/2024 19:23,Divya,9387988068,Waxing,,,,Manicure,Bleaching,Wash,,Threading,,Miscellaneous,1647,Suganya Sri,PhonePe,Anjali,2024-11-13,46,Wednesday
12/09/2024 11:00:00,12/09/2024 11:00,Aishwarya,9844340162,,,De-tan,,Manicure,,,,Threading,,Miscellaneous,1067,Anjali,PhonePe,,2024-09-12,37,Thursday
06/11/2024 17:33:00,06/11/2024 17:33,Latha,9535042749,,Facial,,Pedicure,,,Wash,,,,Miscellaneous,253,Malar,PhonePe,Malar,2024-11-06,45,Wednesday
09/10/2024 11:04:00,09/10/2024 11:04,Kavya,9747643057,Waxing,Facial,,Pedicure,,Bleaching,,Massage,,,,1659,Suganya Sri,Cash,Anjali,2024-10-09,41,Wednesday
10/11/2024 13:58:00,10/11/2024 13:58,Nisha,9561072389,Waxing,Facial,,Pedicure,Manicure,Bleaching,Wash,Massage,Threading,Hair Cut,Miscellaneous,3383,Malar,Card,,2024-11-10,45,Sunday
17/11/2024 14:55:00,17/11/2024 14:55,Latha,9349093738,Waxing,,De-tan,Pedicure,Manicure,Bleaching,,Massage,Threading,Hair Cut,Miscellaneous,2609,Malar,Card,Malar,2024-11-17,46,Sunday
13/09/2024 11:17:00,13/09/2024 11:17,Harini,9153841394,Waxing,Facial,De-tan,,Manicure,Bleaching,,,,,,948,Poornima,Cash,Poornima,2024-09-13,37,Friday
12/10/2024 09:11:00,12/10/2024 09:11,Soumya,9325677289,,,De-tan,,,Bleaching,Wash,Massage,Threading,,Miscellaneous,495,Anjali,GPay,Pinky,2024-10-12,41,Saturday
06/10/2024 11:10:00,06/10/2024 11:10,Keerthana,9663939188,Waxing,,,Pedicure,Manicure,Bleaching,Wash,Massage,Threading,,Miscellaneous,998,Malar,Cash,,2024-10-06,40,Sunday
26/08/2024 12:47:00,26/08/2024 12:47,Nisha,9229173153,Waxing,Facial,,,,,Wash,,Threading,Hair Cut,,1398,Suganya Sri,Card,,2024-08-26,35,Monday
30/10/2024 19:00:00,30/10/2024 19:00,Shruthi,9301795292,,,,Pedicure,,Bleaching,,,Threading,,,2621,Anjali,GPay,Pinky,2024-10-30,44,Wednesday
25/09/2024 16:27:00,25/09/2024 16:27,Latha,9502464839,,Facial,,Pedicure,Manicure,,,Massage,,,,3309,Pinky,Cash,,2024-09-25,39,Wednesday
06/09/2024 15:15:00,06/09/2024 15:15,Soumya,9576178754,Waxing,Facial,De-tan,Pedicure,,,Wash,,,,Miscellaneous,1046,Pinky,Cash,,2024-09-06,36,Friday
26/08/2024 11:19:00,26/08/2024 11:19,Keerthana,9733721074,Waxing,Facial,,Pedicure,Manicure,,Wash,,Threading,Hair Cut,,1977,Suganya Sri,Cash,Poornima,2024-08-26,35,Monday
01/09/2024 10:19:00,01/09/2024 10:19,Latha,9186510579,,,De-tan,Pedicure,,,,,Threading,,Miscellaneous,2115,Pinky,PhonePe,Anjali,2024-09-01,35,Sunday
12/10/2024 16:20:00,12/10/2024 16:20,Soumya,9547542590,,,De-tan,,,,,,,Hair Cut,Miscellaneous,1579,Malar,Cash,Malar,2024-10-12,41,Saturday
24/09/2024 10:58:00,24/09/2024 10:58,Sandhya,9521581654,,,,,Manicure,,Wash,Massage,Threading,,Miscellaneous,1000,Suganya Sri,GPay,Poornima,2024-09-24,39,Tuesday
28/10/2024 10:21:00,28/10/2024 10:21,Anjali,9623305860,Waxing,,,Pedicure,,,Wash,,Threading,Hair Cut,,2038,Malar,PhonePe,,2024-10-28,44,Monday
20/09/2024 16:34:00,20/09/2024 16:34,Keerthana,9196211239,,,,Pedicure,,,,Massage,Threading,Hair Cut,Miscellaneous,2918,Anjali,PhonePe,Suganya Sri,2024-09-20,38,Friday
13/09/2024 14:04:00,13/09/2024 14:04,Nisha,9594903312,,Facial,,Pedicure,,Bleaching,Wash,,,Hair Cut,,2314,Pinky,Card,,2024-09-13,37,Friday
06/09/2024 13:53:00,06/09/2024 13:53,Meena,9741722694,Waxing,,,,,,,Massage,,,Miscellaneous,2450,Poornima,GPay,Pinky,2024-09-06,36,Friday
11/11/2024 13:21:00,11/11/2024 13:21,Divya,9658601933,Waxing,,De-tan,Pedicure,Manicure,Bleaching,Wash,,,Hair Cut,,1383,Suganya Sri,Card,,2024-11-11,46,Monday
31/10/2024 19:51:00,31/10/2024 19:51,Ranjani,9302841849,Waxing,Facial,,,Manicure,,,Massage,Threading,,,2656,Pinky,PhonePe,Pinky,2024-10-31,44,Thursday
29/09/2024 14:01:00,29/09/2024 14:01,Keerthana,9718794612,,,De-tan,,,Bleaching,,Massage,,,,544,Anjali,PhonePe,Suganya Sri,2024-09-29,39,Sunday
23/09/2024 12:14:00,23/09/2024 12:14,Priya,9381903850,,,De-tan,Pedicure,,,Wash,Massage,Threading,,Miscellaneous,1632,Anjali,PhonePe,Suganya Sri,2024-09-23,39,Monday
21/10/2024 20:37:00,21/10/2024 20:37,Deepa,9756336605,Waxing,,,Pedicure,Manicure,Bleaching,,,Threading,,Miscellaneous,2056,Anjali,GPay,,2024-10-21,43,Monday
09/09/2024 11:25:00,09/09/2024 11:25,Divya,9741795877,Waxing,Facial,,,,Bleaching,,,Threading,Hair Cut,Miscellaneous,2630,Anjali,Cash,Malar,2024-09-09,37,Monday
16/11/2024 11:13:00,16/11/2024 11:13,Ranjani,9215100322,,Facial,De-tan,Pedicure,Manicure,Bleaching,Wash,Massage,Threading,Hair Cut,,2069,Pinky,Card,Malar,2024-11-16,46,Saturday
14/09/2024 13:46:00,14/09/2024 13:46,Keerthana,9355268249,,,,Pedicure,Manicure,Bleaching,,,Threading,,Miscellaneous,389,Poornima,Card,Suganya Sri,2024-09-14,37,Saturday
27/08/2024 15:28:00,27/08/2024 15:28,Swathi,9268178187,,Facial,,,,Bleaching,Wash,Massage,,,,1118,Poornima,GPay,,2024-08-27,35,Tuesday
19/11/2024 09:20:00,19/11/2024 09:20,Aishwarya,9361706913,Waxing,,De-tan,,,,,,Threading,,Miscellaneous,2672,Pinky,PhonePe,Pinky,2024-11-19,47,Tuesday
15/09/2024 18:39:00,15/09/2024 18:39,Latha,9837552447,Waxing,,De-tan,,,,Wash,Massage,,,Miscellaneous,2851,Poornima,Cash,Malar,2024-09-15,37,Sunday
10/09/2024 12:48:00,10/09/2024 12:48,Keerthana,9625059782,,,De-tan,Pedicure,,,Wash,Massage,Threading,Hair Cut,Miscellaneous,2663,Anjali,Cash,,2024-09-10,37,Tuesday
12/11/2024 14:38:00,12/11/2024 14:38,Harini,9782556293,,,De-tan,,Manicure,Bleaching,Wash,,Threading,Hair Cut,,2159,Suganya Sri,Cash,,2024-11-12,46,Tuesday
28/10/2024 13:32:00,28/10/2024 13:32,Swathi,9476235335,,Facial,De-tan,,Manicure,Bleaching,,,Threading,Hair Cut,Miscellaneous,1920,Malar,PhonePe,Poornima,2024-10-28,44,Monday
22/10/2024 18:47:00,22/10/2024 18:47,Keerthana,9786307002,,,,,,Bleaching,,,Threading,Hair Cut,,176,Pinky,PhonePe,,2024-10-22,43,Tuesday
17/10/2024 10:02:00,17/10/2024 10:02,Aishwarya,9633950727,Waxing,Facial,,Pedicure,Manicure,Bleaching,Wash,Massage,,,,872,Suganya Sri,Cash,,2024-10-17,42,Thursday
11/11/2024 20:48:00,11/11/2024 20:48,Ranjani,9821440947,Waxing,Facial,De-tan,Pedicure,,,Wash,Massage,Threading,,Miscellaneous,508,Pinky,Card,,2024-11-11,46,Monday
28/09/2024 09:56:00,28/09/2024 09:56,Deepa,9444822324,,,De-tan,Pedicure,,,Wash,,,,,401,Anjali,Cash,Poornima,2024-09-28,39,Saturday
20/10/2024 11:19:00,20/10/2024 11:19,Deepa,9375262523,Waxing,Facial,De-tan,Pedicure,Manicure,,Wash,,,Hair Cut,Miscellaneous,2279,Malar,GPay,,2024-10-20,42,Sunday
13/10/2024 18:00:00,13/10/2024 18:00,Soumya,9836114126,,,De-tan,,,Bleaching,,Massage,Threading,,,3268,Pinky,Card,,2024-10-13,41,Sunday
07/11/2024 11:16:00,07/11/2024 11:16,Deepa,9445917324,,,De-tan,,,Bleaching,,,Threading,,,1465,Suganya Sri,GPay,,2024-11-07,45,Thursday
09/11/2024 12:57:00,09/11/2024 12:57,Aishwarya,9883478377,,,,,Manicure,Bleaching,Wash,Massage,Threading,,,1077,Poornima,PhonePe,,2024-11-09,45,Saturday
05/10/2024 14:04:00,05/10/2024 14:04,Aishwarya,9334172919,Waxing,Facial,De-tan,,Manicure,Bleaching,,,Threading,,,233,Poornima,Card,Suganya Sri,2024-10-05,40,Saturday
06/11/2024 11:37:00,06/11/2024 11:37,Harini,9997412878,Waxing,Facial,De-tan,Pedicure,Manicure,Bleaching,,,Threading,Hair Cut,,1701,Malar,PhonePe,Malar,2024-11-06,45,Wednesday
18/10/2024 15:09:00,18/10/2024 15:09,Shruthi,9805899983,Waxing,Facial,,,Manicure,Bleaching,Wash,Massage,,Hair Cut,Miscellaneous,172,Malar,Cash,Poornima,2024-10-18,42,Friday
19/11/2024 18:09:00,19/11/2024 18:09,Meena,9954521520,Waxing,Facial,De-tan,,Manicure,,Wash,Massage,Threading,Hair Cut,Miscellaneous,1312,Poornima,GPay,Suganya Sri,2024-11-19,47,Tuesday
23/08/2024 17:24:00,23/08/2024 17:24,Deepa,9948058158,Waxing,,,,,Bleaching,Wash,,Threading,,Miscellaneous,924,Suganya Sri,Card,,2024-08-23,34,Friday
22/09/2024 18:41:00,22/09/2024 18:41,Priya,9844141917,,,De-tan,Pedicure,,Bleaching,,Massage,Threading,Hair Cut,Miscellaneous,1400,Suganya Sri,Cash,Pinky,2024-09-22,38,Sunday
02/09/2024 15:32:00,02/09/2024 15:32,Divya,9772214911,Waxing,,,,Manicure,,,Massage,Threading,,Miscellaneous,975,Pinky,Cash,,2024-09-02,36,Monday
01/09/2024 15:52:00,01/09/2024 15:52,Meena,9682470587,,Facial,,,Manicure,Bleaching,Wash,Massage,,,,2843,Malar,Card,,2024-09-01,35,Sunday
12/10/2024 13:41:00,12/10/2024 13:41,Sandhya,9109474535,Waxing,Facial,De-tan,,Manicure,,,Massage,Threading,,,955,Suganya Sri,Cash,,2024-10-12,41,Saturday
24/10/2024 14:23:00,24/10/2024 14:23,Shruthi,9443012421,,Facial,,,,,Wash,,Threading,Hair Cut,Miscellaneous,2648,Anjali,Card,Malar,2024-10-24,43,Thursday
09/10/2024 11:31:00,09/10/2024 11:31,Swathi,9816140009,Waxing,,De-tan,Pedicure,,Bleaching,Wash,Massage,Threading,Hair Cut,,1281,Pinky,GPay,Pinky,2024-10-09,41,Wednesday
04/09/2024 17:01:00,04/09/2024 17:01,Divya,9779639103,Waxing,,De-tan,,,Bleaching,,,,,,2045,Suganya Sri,Card,Suganya Sri,2024-09-04,36,Wednesday
29/10/2024 18:12:00,29/10/2024 18:12,Nisha,9214383571,Waxing,,De-tan,Pedicure,,Bleaching,Wash,,,,,3225,Malar,PhonePe,Poornima,2024-10-29,44,Tuesday
12/10/2024 20:34:00,12/10/2024 20:34,Meena,9676699856,,Facial,De-tan,Pedicure,Manicure,Bleaching,,,Threading,,Miscellaneous,2045,Pinky,Card,Anjali,2024-10-12,41,Saturday
29/09/2024 18:07:00,29/09/2024 18:07,Sandhya,9885775368,,Facial,,,Manicure,Bleaching,,Massage,,,Miscellaneous,1268,Suganya Sri,Card,Pinky,2024-09-29,39,Sunday
30/10/2024 10:44:00,30/10/2024 10:44,Anjali,9747880010,,Facial,De-tan,,Manicure,Bleaching,,Massage,,,,2490,Malar,GPay,Poornima,2024-10-30,44,Wednesday
01/10/2024 19:17:00,01/10/2024 19:17,Sangeetha,9575353717,Waxing,Facial,De-tan,,,Bleaching,,Massage,Threading,Hair Cut,Miscellaneous,885,Suganya Sri,PhonePe,,2024-10-01,40,Tuesday
19/11/2024 16:02:00,19/11/2024 16:02,Divya,9198801369,Waxing,Facial,,,,,Wash,,,,,2893,Pinky,Cash,Pinky,2024-11-19,47,Tuesday
27/08/2024 12:44:00,27/08/2024 12:44,Soumya,9318855268,,Facial,,Pedicure,,,,,Threading,,Miscellaneous,566,Suganya Sri,Card,Pinky,2024-08-27,35,Tuesday
30/10/2024 09:53:00,30/10/2024 09:53,Meena,9186046269,,,De-tan,,Manicure,,Wash,Massage,,,,2683,Pinky,Card,Suganya Sri,2024-10-30,44,Wednesday
20/10/2024 18:05:00,20/10/2024 18:05,Nisha,9275317577,,,,,,Bleaching,,Massage,Threading,Hair Cut,,3401,Pinky,Card,Suganya Sri,2024-10-20,42,Sunday
26/08/2024 10:32:00,26/08/2024 10:32,Nisha,9234539414,Waxing,Facial,De-tan,Pedicure,Manicure,Bleaching,,,,,,2905,Anjali,PhonePe,Suganya Sri,2024-08-26,35,Monday
13/10/2024 16:19:00,13/10/2024 16:19,Ranjani,9823844885,,Facial,,Pedicure,,,Wash,,,Hair Cut,Miscellaneous,2749,Suganya Sri,GPay,,2024-10-13,41,Sunday
10/10/2024 12:27:00,10/10/2024 12:27,Deepa,9878346778,,,De-tan,,Manicure,Bleaching,,,Threading,Hair Cut,Miscellaneous,2038,Pinky,Card,Pinky,2024-10-10,41,Thursday
05/09/2024 12:13:00,05/09/2024 12:13,Deepa,9684509850,Waxing,Facial,De-tan,,Manicure,Bleaching,,,,,,493,Anjali,Cash,Pinky,2024-09-05,36,Thursday
23/10/2024 16:44:00,23/10/2024 16:44,Meena,9239184583,,,,,Manicure,,Wash,,Threading,Hair Cut,,1412,Poornima,GPay,,2024-10-23,43,Wednesday
08/11/2024 15:59:00,08/11/2024 15:59,Keerthana,9367281416,,,De-tan,Pedicure,Manicure,Bleaching,Wash,Massage,Threading,Hair Cut,Miscellaneous,535,Anjali,Cash,Anjali,2024-11-08,45,Friday
10/11/2024 16:07:00,10/11/2024 16:07,Kavya,9442356010,,,De-tan,,Manicure,Bleaching,Wash,,Threading,,,947,Poornima,PhonePe,,2024-11-10,45,Sunday
09/09/2024 15:39:00,09/09/2024 15:39,Soumya,9397608827,,,De-tan,,,,Wash,,,,,1298,Anjali,Card,Suganya Sri,2024-09-09,37,Monday
21/09/2024 15:28:00,21/09/2024 15:28,Shruthi,9450459709,,,De-tan,,,,Wash,,Threading,Hair Cut,Miscellaneous,3301,Poornima,PhonePe,,2024-09-21,38,Saturday
30/08/2024 19:19:00,30/08/2024 19:19,Latha,9362847127,Waxing,,De-tan,,Manicure,,,,,Hair Cut,,1863,Pinky,Card,,2024-08-30,35,Friday
24/08/2024 12:49:00,24/08/2024 12:49,Anjali,9319576164,,,,,Manicure,,Wash,,Threading,Hair Cut,Miscellaneous,949,Poornima,Cash,Malar,2024-08-24,34,Saturday
02/09/2024 12:34:00,02/09/2024 12:34,Meena,9409561864,Waxing,,,Pedicure,Manicure,,Wash,,Threading,Hair Cut,Miscellaneous,3134,Anjali,Card,Malar,2024-09-02,36,Monday
08/11/2024 11:19:00,08/11/2024 11:19,Shruthi,9127780634,Waxing,,,Pedicure,Manicure,,Wash,Massage,Threading,,,1921,Poornima,Card,,2024-11-08,45,Friday
26/08/2024 18:18:00,26/08/2024 18:18,Ranjani,9692873580,,,De-tan,Pedicure,Manicure,Bleaching,Wash,,,,Miscellaneous,1236,Suganya Sri,Cash,Anjali,2024-08-26,35,Monday
19/10/2024 19:38:00,19/10/2024 19:38,Divya,9335466009,Waxing,Facial,,Pedicure,,Bleaching,,Massage,,Hair Cut,Miscellaneous,2366,Malar,PhonePe,Anjali,2024-10-19,42,Saturday
13/11/2024 20:00:00,13/11/2024 20:00,Aishwarya,9208405268,,,,Pedicure,Manicure,Bleaching,,,,,,2202,Malar,Cash,Suganya Sri,2024-11-13,46,Wednesday
02/10/2024 10:51:00,02/10/2024 10:51,Anjali,9431322077,Waxing,,De-tan,Pedicure,,Bleaching,,,,,,1584,Anjali,PhonePe,Pinky,2024-10-02,40,Wednesday
27/10/2024 18:36:00,27/10/2024 18:36,Kavya,9621399059,,Facial,De-tan,Pedicure,,Bleaching,Wash,,Threading,Hair Cut,Miscellaneous,3064,Anjali,Card,,2024-10-27,43,Sunday
18/09/2024 19:15:00,18/09/2024 19:15,Soumya,9955547151,Waxing,,,Pedicure,Manicure,,,Massage,,Hair Cut,Miscellaneous,2605,Pinky,PhonePe,Suganya Sri,2024-09-18,38,Wednesday
08/09/2024 10:24:00,08/09/2024 10:24,Shruthi,9212266552,Waxing,,,Pedicure,,Bleaching,,,,,Miscellaneous,1404,Malar,Cash,Malar,2024-09-08,36,Sunday
25/10/2024 14:48:00,25/10/2024 14:48,Sandhya,9725611526,,Facial,,Pedicure,Manicure,Bleaching,Wash,,Threading,,,1096,Anjali,GPay,,2024-10-25,43,Friday
16/10/2024 11:25:00,16/10/2024 11:25,Swathi,9468506166,Waxing,,,Pedicure,Manicure,,,,Threading,Hair Cut,Miscellaneous,2167,Pinky,Card,,2024-10-16,42,Wednesday
13/10/2024 16:32:00,13/10/2024 16:32,Aishwarya,9933430772,,Facial,De-tan,,,Bleaching,Wash,,,,Miscellaneous,3105,Suganya Sri,Card,Anjali,2024-10-13,41,Sunday
24/08/2024 16:32:00,24/08/2024 16:32,Sangeetha,9453567712,Waxing,Facial,De-tan,,Manicure,,Wash,Massage,,,,867,Malar,PhonePe,Suganya Sri,2024-08-24,34,Saturday
03/11/2024 18:06:00,03/11/2024 18:06,Latha,9735056283,,,,,Manicure,,Wash,Massage,Threading,Hair Cut,Miscellaneous,2173,Poornima,Card,,2024-11-03,44,Sunday
10/09/2024 16:44:00,10/09/2024 16:44,Meena,9581543352,,,,,Manicure,Bleaching,Wash,Massage,,,Miscellaneous,2060,Suganya Sri,PhonePe,Anjali,2024-09-10,37,Tuesday
14/09/2024 10:25:00,14/09/2024 10:25,Deepa,9787239312,,,De-tan,,Manicure,Bleaching,Wash,,Threading,,Miscellaneous,3009,Pinky,PhonePe,Suganya Sri,2024-09-14,37,Saturday
11/11/2024 20:51:00,11/11/2024 20:51,Keerthana,9768921035,,,De-tan,,,,,,Threading,Hair Cut,,2478,Poornima,Cash,,2024-11-11,46,Monday
31/08/2024 10:14:00,31/08/2024 10:14,Ranjani,9984691274,,,,Pedicure,,Bleaching,Wash,Massage,Threading,Hair Cut,Miscellaneous,1024,Anjali,Card,,2024-08-31,35,Saturday
12/11/2024 09:20:00,12/11/2024 09:20,Soumya,9741201651,,,,Pedicure,,Bleaching,,,Threading,Hair Cut,,753,Poornima,Cash,Suganya Sri,2024-11-12,46,Tuesday
17/10/2024 15:06:00,17/10/2024 15:06,Sandhya,9236693115,,,De-tan,Pedicure,,Bleaching,Wash,,,,,2638,Anjali,Cash,Poornima,2024-10-17,42,Thursday
11/09/2024 13:13:00,11/09/2024 13:13,Nisha,9610450119,,,,,,Bleaching,Wash,Massage,,Hair Cut,,694,Suganya Sri,Cash,Malar,2024-09-11,37,Wednesday
07/10/2024 17:03:00,07/10/2024 17:03,Aishwarya,9327290092,Waxing,,,Pedicure,,Bleaching,,Massage,Threading,,Miscellaneous,3403,Pinky,Card,Poornima,2024-10-07,41,Monday
05/11/2024 17:37:00,05/11/2024 17:37,Nisha,9297516662,Waxing,,,Pedicure,Manicure,,,Massage,Threading,Hair Cut,,753,Suganya Sri,PhonePe,Malar,2024-11-05,45,Tuesday
24/08/2024 14:07:00,24/08/2024 14:07,Kavya,9714904311,Waxing,,De-tan,Pedicure,Manicure,Bleaching,Wash,,,,Miscellaneous,1842,Suganya Sri,GPay,,2024-08-24,34,Saturday
21/09/2024 20:28:00,21/09/2024 20:28,Nisha,9343265001,Waxing,Facial,,,Manicure,,,,,,Miscellaneous,1585,Anjali,PhonePe,,2024-09-21,38,Saturday
11/09/2024 12:32:00,11/09/2024 12:32,Swathi,9616741528,Waxing,,De-tan,,Manicure,,Wash,,Threading,,Miscellaneous,3101,Poornima,Card,Suganya Sri,2024-09-11,37,Wednesday
27/08/2024 09:13:00,27/08/2024 09:13,Harini,9905196988,Waxing,,De-tan,,Manicure,,Wash,,,Hair Cut,Miscellaneous,1873,Pinky,PhonePe,Anjali,2024-08-27,35,Tuesday
26/08/2024 13:13:00,26/08/2024 13:13,Priya,9467896272,,Facial,,Pedicure,,Bleaching,Wash,Massage,Threading,Hair Cut,,826,Pinky,GPay,Pinky,2024-08-26,35,Monday
05/11/2024 16:09:00,05/11/2024 16:09,Aishwarya,9765111077,Waxing,,,Pedicure,Manicure,,Wash,,Threading,Hair Cut,Miscellaneous,3192,Pinky,GPay,Suganya Sri,2024-11-05,45,Tuesday
14/10/2024 13:29:00,14/10/2024 13:29,Sandhya,9486528243,Waxing,Facial,,Pedicure,Manicure,,Wash,Massage,Threading,Hair Cut,,2514,Suganya Sri,PhonePe,Pinky,2024-10-14,42,Monday
19/11/2024 09:45:00,19/11/2024 09:45,Swathi,9172797465,Waxing,Facial,De-tan,,Manicure,Bleaching,Wash,,,,Miscellaneous,272,Pinky,Cash,,2024-11-19,47,Tuesday
10/10/2024 18:39:00,10/10/2024 18:39,Soumya,9473030135,,,,Pedicure,Manicure,Bleaching,,,Threading,,Miscellaneous,2360,Poornima,Cash,Poornima,2024-10-10,41,Thursday
09/10/2024 15:43:00,09/10/2024 15:43,Swathi,9411898058,,Facial,De-tan,Pedicure,,,,Massage,,Hair Cut,Miscellaneous,1036,Poornima,PhonePe,Poornima,2024-10-09,41,Wednesday
15/10/2024 19:43:00,15/10/2024 19:43,Anjali,9459729942,,,De-tan,,Manicure,Bleaching,Wash,,,,Miscellaneous,2082,Malar,PhonePe,Suganya Sri,2024-10-15,42,Tuesday
05/09/2024 09:36:00,05/09/2024 09:36,Anjali,9530712484,,,De-tan,Pedicure,,Bleaching,,,Threading,Hair Cut,Miscellaneous,1663,Suganya Sri,PhonePe,Anjali,2024-09-05,36,Thursday
28/09/2024 14:46:00,28/09/2024 14:46,Shruthi,9753582748,Waxing,Facial,De-tan,Pedicure,Manicure,Bleaching,Wash,,Threading,Hair Cut,,3329,Pinky,Card,,2024-09-28,39,Saturday
